<?xml version='1.0' encoding='utf-8'?>
<feed xmlns="http://www.w3.org/2005/Atom" xml:lang="en-us"><title>Docket updates for McFadden v. Fenix Internet, LLC, 1:23-cv-06151</title><link href="https://michaellee50.github.io/CourtListener/feed-McFadden-Fenix Internet.xml" rel="self" type="application/atom+xml" /><link href="https://www.courtlistener.com/" rel="alternate" /><link href="https://www.courtlistener.com/docket/67731727/feed/" rel="self" /><id>https://www.courtlistener.com/</id><updated>2025-09-29T00:00:00-07:00</updated><author><name>Free Law Project</name><email>feeds@courtlistener.com</email></author><rights>Created for the public domain by Free Law Project</rights><entry><title>Entry #106 in McFadden v. Fenix Internet, LLC, 1:23-cv-06151</title><link href="https://www.courtlistener.com/docket/67731727/mcfadden-v-fenix-internet-llc/?order_by=desc#entry-106" rel="alternate" /><published>2025-09-29T00:00:00-07:00</published><id>https://www.courtlistener.com/docket/67731727/mcfadden-v-fenix-internet-llc/?order_by=desc#entry-106</id><summary type="html">ENTERED JUDGMENT. Mailed notice. (exr, ) (Entered: 09/29/2025)</summary><link href="https://ecf.ilnd.uscourts.gov/doc1/067033283630?caseid=437583" length="0" rel="enclosure" /><updated>2025-09-29T00:00:00-07:00</updated></entry><entry><title>Entry #105 in McFadden v. Fenix Internet, LLC, 1:23-cv-06151</title><link href="https://www.courtlistener.com/docket/67731727/mcfadden-v-fenix-internet-llc/?order_by=desc#entry-105" rel="alternate" /><published>2025-09-29T00:00:00-07:00</published><id>https://www.courtlistener.com/docket/67731727/mcfadden-v-fenix-internet-llc/?order_by=desc#entry-105</id><summary type="html">MEMORANDUM Opinion and Order   signed by the Honorable John F. Kness on 9/29/2025.  Mailed notice.  (exr, )</summary><link href="https://storage.courtlistener.com/recap/gov.uscourts.ilnd.437583/gov.uscourts.ilnd.437583.105.0.pdf" length="0" rel="enclosure" /><updated>2025-09-29T00:00:00-07:00</updated></entry><entry><title>Entry #104 in McFadden v. Fenix Internet, LLC, 1:23-cv-06151</title><link href="https://www.courtlistener.com/docket/67731727/mcfadden-v-fenix-internet-llc/?order_by=desc#entry-104" rel="alternate" /><published>2025-09-29T00:00:00-07:00</published><id>https://www.courtlistener.com/docket/67731727/mcfadden-v-fenix-internet-llc/?order_by=desc#entry-104</id><summary type="html">MINUTE entry before the Honorable John F. Kness: For the reasons provided in the accompanying Memorandum Opinion and Order, which is being entered separately, the motion of Defendants Fenix International Limited and Fenix Internet, LLC to dismiss under the doctrine of forum non conveniens is granted. Case dismissed without prejudice. Enter separate final judgment order. Civil case terminated. Mailed notice. (exr, ) (Entered: 09/29/2025)</summary><link href="https://ecf.ilnd.uscourts.gov/doc1/067033283580?caseid=437583" length="0" rel="enclosure" /><updated>2025-09-29T00:00:00-07:00</updated></entry><entry><title>Entry #103 in McFadden v. Fenix Internet, LLC, 1:23-cv-06151</title><link href="https://www.courtlistener.com/docket/67731727/mcfadden-v-fenix-internet-llc/?order_by=desc#entry-103" rel="alternate" /><published>2025-09-02T00:00:00-07:00</published><id>https://www.courtlistener.com/docket/67731727/mcfadden-v-fenix-internet-llc/?order_by=desc#entry-103</id><summary type="html">MINUTE entry before the Honorable John F. Kness: With regret for the late notice, the Court strikes the case tracking hearing set for tomorrow (9/3/2025). Further guidance will be provided promptly by separate order. Mailed notice (jfk) (Entered: 09/02/2025)</summary><link href="https://ecf.ilnd.uscourts.gov/doc1/067033126202?caseid=437583" length="0" rel="enclosure" /><updated>2025-09-02T00:00:00-07:00</updated></entry><entry><title>Entry #102 in McFadden v. Fenix Internet, LLC, 1:23-cv-06151</title><link href="https://www.courtlistener.com/docket/67731727/mcfadden-v-fenix-internet-llc/?order_by=desc#entry-102" rel="alternate" /><published>2025-07-31T00:00:00-07:00</published><id>https://www.courtlistener.com/docket/67731727/mcfadden-v-fenix-internet-llc/?order_by=desc#entry-102</id><summary type="html">TRANSCRIPT OF PROCEEDINGS, evidentiary hearing, held on 5/21/2025 before the Honorable John F. Kness. Order Number: 51945. Court Reporter Contact Information: Nancy LaBella, Nancy_LaBella@ilnd.uscourts.gov, 312-435-6890. IMPORTANT: The transcript may be viewed at the court's public terminal or purchased through the Court Reporter/Transcriber before the deadline for Release of Transcript Restriction. After that date it may be obtained through the Court Reporter/Transcriber or PACER. For further information on the redaction process, see the Court's web site at www.ilnd.uscourts.gov under Quick Links select Policy Regarding the Availability of Transcripts of Court Proceedings. Redaction Request due 8/21/2025. Redacted Transcript Deadline set for 9/1/2025. Release of Transcript Restriction set for 10/29/2025. (Labella, Nancy) (Entered: 07/31/2025)</summary><link href="https://ecf.ilnd.uscourts.gov/doc1/067032939239?caseid=437583" length="0" rel="enclosure" /><updated>2025-07-31T00:00:00-07:00</updated></entry><entry><title>Entry #101 in McFadden v. Fenix Internet, LLC, 1:23-cv-06151</title><link href="https://www.courtlistener.com/docket/67731727/mcfadden-v-fenix-internet-llc/?order_by=desc#entry-101" rel="alternate" /><published>2025-07-24T00:00:00-07:00</published><id>https://www.courtlistener.com/docket/67731727/mcfadden-v-fenix-internet-llc/?order_by=desc#entry-101</id><summary type="html">MINUTE entry before the Honorable John F. Kness: In a joint statement 100, the parties have confirmed that neither party intends to submit additional briefing on the motion to dismiss (Dkt. 21, 22, 41, 54). The motion is thus taken under advisement. A telephonic hearing for motion tracking purposes is set for 9/3/2025 at 9:30 A.M. The parties are to use the following call-in number: 1-855-244-8681, Access Code: 2315 003 3696. The public and media representatives may have access to the hearing via the same number. Audio recording of the hearing is not permitted; violations of this prohibition may result in sanctions. Participants are directed to keep their device muted when they are not speaking. Mailed notice. (exr, ) (Entered: 07/24/2025)</summary><link href="https://ecf.ilnd.uscourts.gov/doc1/067032898488?caseid=437583" length="0" rel="enclosure" /><updated>2025-07-24T00:00:00-07:00</updated></entry><entry><title>Entry #100 in McFadden v. Fenix Internet, LLC, 1:23-cv-06151</title><link href="https://www.courtlistener.com/docket/67731727/mcfadden-v-fenix-internet-llc/?order_by=desc#entry-100" rel="alternate" /><published>2025-07-24T00:00:00-07:00</published><id>https://www.courtlistener.com/docket/67731727/mcfadden-v-fenix-internet-llc/?order_by=desc#entry-100</id><summary type="html">Joint Statement Regarding Post-Hearing Briefing / STATEMENT by Fenix International Limited, Fenix Internet, LLC (Kutcher, Matthew) (Entered: 07/24/2025)</summary><link href="https://ecf.ilnd.uscourts.gov/doc1/067032895233?caseid=437583" length="0" rel="enclosure" /><updated>2025-07-24T00:00:00-07:00</updated></entry><entry><title>Entry #99 in McFadden v. Fenix Internet, LLC, 1:23-cv-06151</title><link href="https://www.courtlistener.com/docket/67731727/mcfadden-v-fenix-internet-llc/?order_by=desc#entry-99" rel="alternate" /><published>2025-07-17T00:00:00-07:00</published><id>https://www.courtlistener.com/docket/67731727/mcfadden-v-fenix-internet-llc/?order_by=desc#entry-99</id><summary type="html">MINUTE entry before the Honorable John F. Kness: Continued in-person Rule 44.1 Foreign Law Testimony hearing held on 7/17/2025. As discussed on the record, counsel for both parties are directed to confer with each other on the matter of post-hearing briefing. A joint statement outlining the parties' position on whether there should be post-hearing briefing must be filed on or before 7/24/2025. Mailed notice. (exr, ) (Entered: 07/18/2025)</summary><link href="https://ecf.ilnd.uscourts.gov/doc1/067032867512?caseid=437583" length="0" rel="enclosure" /><updated>2025-07-17T00:00:00-07:00</updated></entry><entry><title>Entry #98 in McFadden v. Fenix Internet, LLC, 1:23-cv-06151</title><link href="https://www.courtlistener.com/docket/67731727/mcfadden-v-fenix-internet-llc/?order_by=desc#entry-98" rel="alternate" /><published>2025-06-10T00:00:00-07:00</published><id>https://www.courtlistener.com/docket/67731727/mcfadden-v-fenix-internet-llc/?order_by=desc#entry-98</id><summary type="html">ATTORNEY Appearance for Plaintiffs John P DeFranza, Philip McFadden by Robert Bruce Carey (Carey, Robert) (Entered: 06/10/2025)</summary><link href="https://storage.courtlistener.com/recap/gov.uscourts.ilnd.437583/gov.uscourts.ilnd.437583.98.0.pdf" length="0" rel="enclosure" /><updated>2025-06-10T00:00:00-07:00</updated></entry><entry><title>Entry #97 in McFadden v. Fenix Internet, LLC, 1:23-cv-06151</title><link href="https://www.courtlistener.com/docket/67731727/mcfadden-v-fenix-internet-llc/?order_by=desc#entry-97" rel="alternate" /><published>2025-05-30T00:00:00-07:00</published><id>https://www.courtlistener.com/docket/67731727/mcfadden-v-fenix-internet-llc/?order_by=desc#entry-97</id><summary type="html">MINUTE entry before the Honorable John F. Kness: This matter is set for a continued Rule 44.1 Foreign Law Testimony hearing for 7/17/2025 at 9:30 A.M. Mailed notice. (exr, ) (Entered: 05/30/2025)</summary><link href="https://storage.courtlistener.com/recap/gov.uscourts.ilnd.437583/gov.uscourts.ilnd.437583.97.0_1.pdf" length="0" rel="enclosure" /><updated>2025-05-30T00:00:00-07:00</updated></entry><entry><title>Entry #96 in McFadden v. Fenix Internet, LLC, 1:23-cv-06151</title><link href="https://www.courtlistener.com/docket/67731727/mcfadden-v-fenix-internet-llc/?order_by=desc#entry-96" rel="alternate" /><published>2025-05-28T00:00:00-07:00</published><id>https://www.courtlistener.com/docket/67731727/mcfadden-v-fenix-internet-llc/?order_by=desc#entry-96</id><summary type="html">STATUS Report Joint Status Report re proposed logistics and dates for a continued Rule 44.1 Foreign Law hearing by Fenix International Limited, Fenix Internet, LLC (Kutcher, Matthew) (Entered: 05/28/2025)</summary><link href="https://storage.courtlistener.com/recap/gov.uscourts.ilnd.437583/gov.uscourts.ilnd.437583.96.0.pdf" length="0" rel="enclosure" /><updated>2025-05-28T00:00:00-07:00</updated></entry><entry><title>Entry #95 in McFadden v. Fenix Internet, LLC, 1:23-cv-06151</title><link href="https://www.courtlistener.com/docket/67731727/mcfadden-v-fenix-internet-llc/?order_by=desc#entry-95" rel="alternate" /><published>2025-05-23T00:00:00-07:00</published><id>https://www.courtlistener.com/docket/67731727/mcfadden-v-fenix-internet-llc/?order_by=desc#entry-95</id><summary type="html">MINUTE entry before the Honorable John F. Kness: In-person Rule 44.1 Foreign Law Testimony hearing held on 5/21/2025. As discussed on the record, counsel for both parties are directed to confer with each other and the Courtroom Deputy to schedule a continued hearing. The parties are directed to file a joint written status report detailing proposed dates and the position of each side as to logistics for the continued hearing. The joint written status report shall be filed on or before 5/28/2025. Mailed notice. (exr, ) (Entered: 05/23/2025)</summary><link href="https://ecf.ilnd.uscourts.gov/doc1/067032552489?caseid=437583" length="0" rel="enclosure" /><updated>2025-05-23T00:00:00-07:00</updated></entry><entry><title>Entry #94 in McFadden v. Fenix Internet, LLC, 1:23-cv-06151</title><link href="https://www.courtlistener.com/docket/67731727/mcfadden-v-fenix-internet-llc/?order_by=desc#entry-94" rel="alternate" /><published>2025-05-20T00:00:00-07:00</published><id>https://www.courtlistener.com/docket/67731727/mcfadden-v-fenix-internet-llc/?order_by=desc#entry-94</id><summary type="html">REPLY by Defendants Fenix International Limited, Fenix Internet, LLC to motion to dismiss 21, reply, 54 REDACTED VERSION (Attachments: # 1 Declaration of Matthew L. Kutcher, # 2 Exhibit 1, # 3 Exhibit 2, # 4 Appendix of Foreign Law)(Kutcher, Matthew) (Entered: 05/20/2025)</summary><link href="https://ecf.ilnd.uscourts.gov/doc1/067032527157?caseid=437583" length="0" rel="enclosure" /><updated>2025-05-20T00:00:00-07:00</updated></entry><entry><title>Entry #93 in McFadden v. Fenix Internet, LLC, 1:23-cv-06151</title><link href="https://www.courtlistener.com/docket/67731727/mcfadden-v-fenix-internet-llc/?order_by=desc#entry-93" rel="alternate" /><published>2025-05-20T00:00:00-07:00</published><id>https://www.courtlistener.com/docket/67731727/mcfadden-v-fenix-internet-llc/?order_by=desc#entry-93</id><summary type="html">RESPONSE by Plaintiffs John P DeFranza, Philip McFadden to memorandum in support of motion 46 REDACTED VERSION (Gold, Andrea) (Entered: 05/20/2025)</summary><link href="https://ecf.ilnd.uscourts.gov/doc1/067032522245?caseid=437583" length="0" rel="enclosure" /><updated>2025-05-20T00:00:00-07:00</updated></entry><entry><title>Entry #92 in McFadden v. Fenix Internet, LLC, 1:23-cv-06151</title><link href="https://www.courtlistener.com/docket/67731727/mcfadden-v-fenix-internet-llc/?order_by=desc#entry-92" rel="alternate" /><published>2025-05-20T00:00:00-07:00</published><id>https://www.courtlistener.com/docket/67731727/mcfadden-v-fenix-internet-llc/?order_by=desc#entry-92</id><summary type="html">RESPONSE by John P DeFranza, Philip McFaddenin Opposition to MOTION by Defendants Fenix International Limited, Fenix Internet, LLC to dismiss under forum non conveniens 21 REDACTED VERSION (Gold, Andrea) (Entered: 05/20/2025)</summary><link href="https://ecf.ilnd.uscourts.gov/doc1/067032522173?caseid=437583" length="0" rel="enclosure" /><updated>2025-05-20T00:00:00-07:00</updated></entry><entry><title>Entry #91 in McFadden v. Fenix Internet, LLC, 1:23-cv-06151</title><link href="https://www.courtlistener.com/docket/67731727/mcfadden-v-fenix-internet-llc/?order_by=desc#entry-91" rel="alternate" /><published>2025-05-06T00:00:00-07:00</published><id>https://www.courtlistener.com/docket/67731727/mcfadden-v-fenix-internet-llc/?order_by=desc#entry-91</id><summary type="html">ORDER. Signed by the Honorable John F. Kness on 5/6/2025. Mailed notice. (pk, ) (Entered: 05/06/2025)</summary><link href="https://ecf.ilnd.uscourts.gov/doc1/067032434054?caseid=437583" length="0" rel="enclosure" /><updated>2025-05-06T00:00:00-07:00</updated></entry><entry><title>Entry #90 in McFadden v. Fenix Internet, LLC, 1:23-cv-06151</title><link href="https://www.courtlistener.com/docket/67731727/mcfadden-v-fenix-internet-llc/?order_by=desc#entry-90" rel="alternate" /><published>2025-05-06T00:00:00-07:00</published><id>https://www.courtlistener.com/docket/67731727/mcfadden-v-fenix-internet-llc/?order_by=desc#entry-90</id><summary type="html">MINUTE entry before the Honorable John F. Kness: This order addresses several open matters in this case. As explained in the accompanying order and statement, the May 21, 2025 hearing involving the parties' English law experts will pertain to the operative 2021 version of the OnlyFans Terms of Service. Those witnesses may appear by remote videoconference. The pending motions to seal (Dkt. 39, 48) are granted in part and denied in part. On or before May 21, 2025, the parties are directed to file public copies of the relevant filings redacted in accordance with the separate order and statement. Defendants' unopposed motion 89 seeking a status hearing is denied without prejudice, as the Court intends to enter a separate minute order within the next day or two addressing the remaining logistical questions posed in the motion seeking a hearing. If following entry of that order the parties still desire clarification, either or both may contact the Courtroom Deputy and request a hearing. Enter separate order and statement. Mailed notice. (pk, ) (Entered: 05/06/2025)</summary><link href="https://ecf.ilnd.uscourts.gov/doc1/067032434039?caseid=437583" length="0" rel="enclosure" /><updated>2025-05-06T00:00:00-07:00</updated></entry><entry><title>Entry #89 in McFadden v. Fenix Internet, LLC, 1:23-cv-06151</title><link href="https://www.courtlistener.com/docket/67731727/mcfadden-v-fenix-internet-llc/?order_by=desc#entry-89" rel="alternate" /><published>2025-05-05T00:00:00-07:00</published><id>https://www.courtlistener.com/docket/67731727/mcfadden-v-fenix-internet-llc/?order_by=desc#entry-89</id><summary type="html">MOTION by Defendants Fenix International Limited, Fenix Internet, LLC for Status Hearing (Unopposed) (Kutcher, Matthew) (Entered: 05/05/2025)</summary><link href="https://storage.courtlistener.com/recap/gov.uscourts.ilnd.437583/gov.uscourts.ilnd.437583.89.0.pdf" length="0" rel="enclosure" /><updated>2025-05-05T00:00:00-07:00</updated></entry><entry><title>Entry #88 in McFadden v. Fenix Internet, LLC, 1:23-cv-06151</title><link href="https://www.courtlistener.com/docket/67731727/mcfadden-v-fenix-internet-llc/?order_by=desc#entry-88" rel="alternate" /><published>2025-04-22T00:00:00-07:00</published><id>https://www.courtlistener.com/docket/67731727/mcfadden-v-fenix-internet-llc/?order_by=desc#entry-88</id><summary type="html">NOTICE by John P DeFranza, Philip McFadden OF SUPPLEMENTAL AUTHORITY (Attachments: # 1 Exhibit A)(Gold, Andrea) (Entered: 04/22/2025)</summary><link href="https://ecf.ilnd.uscourts.gov/doc1/067032353270?caseid=437583" length="0" rel="enclosure" /><updated>2025-04-22T00:00:00-07:00</updated></entry><entry><title>Entry #87 in McFadden v. Fenix Internet, LLC, 1:23-cv-06151</title><link href="https://www.courtlistener.com/docket/67731727/mcfadden-v-fenix-internet-llc/?order_by=desc#entry-87" rel="alternate" /><published>2025-04-14T00:00:00-07:00</published><id>https://www.courtlistener.com/docket/67731727/mcfadden-v-fenix-internet-llc/?order_by=desc#entry-87</id><summary type="html">MINUTE entry before the Honorable John F. Kness: For the reasons stated in Plaintiffs' unopposed motion, the Court finds that the case M. Brunner, et al. v. Fenix Internet, LLC, et al., No. 25-cv-03244 (Cummings, J.) is related, within the meaning of LR 40.4, to this case. Accordingly, consistent with LR 40.4, the Court asks that the Executive Committee reassign M. Brunner, et al. v. Fenix Internet, LLC, et al., No. 25-cv-03244, to this Court's calendar.Motion to reassign case 86 is grantedMailed notice (exr, ) (Entered: 04/14/2025)</summary><link href="https://ecf.ilnd.uscourts.gov/doc1/067032306433?caseid=437583" length="0" rel="enclosure" /><updated>2025-04-14T00:00:00-07:00</updated></entry><entry><title>Entry #86 in McFadden v. Fenix Internet, LLC, 1:23-cv-06151</title><link href="https://www.courtlistener.com/docket/67731727/mcfadden-v-fenix-internet-llc/?order_by=desc#entry-86" rel="alternate" /><published>2025-04-10T00:00:00-07:00</published><id>https://www.courtlistener.com/docket/67731727/mcfadden-v-fenix-internet-llc/?order_by=desc#entry-86</id><summary type="html">MOTION by Plaintiffs John P DeFranza, Philip McFadden to reassign case (Attachments: # 1 Exhibit 1 - Brunner Complaint, # 2 Proposed Order)(Gold, Andrea) (Entered: 04/10/2025)</summary><link href="https://storage.courtlistener.com/recap/gov.uscourts.ilnd.437583/gov.uscourts.ilnd.437583.86.0.pdf" length="0" rel="enclosure" /><updated>2025-04-10T00:00:00-07:00</updated></entry><entry><title>Entry #85 in McFadden v. Fenix Internet, LLC, 1:23-cv-06151</title><link href="https://www.courtlistener.com/docket/67731727/mcfadden-v-fenix-internet-llc/?order_by=desc#entry-85" rel="alternate" /><published>2025-03-27T00:00:00-07:00</published><id>https://www.courtlistener.com/docket/67731727/mcfadden-v-fenix-internet-llc/?order_by=desc#entry-85</id><summary type="html">TRANSCRIPT OF PROCEEDINGS held on 12/12/2024 before the Honorable John F. Kness. Order Number: 50751. Court Reporter Contact Information: Nancy LaBella, Nancy_LaBella@ilnd.uscourts.gov, 312-435-6890. IMPORTANT: The transcript may be viewed at the court's public terminal or purchased through the Court Reporter/Transcriber before the deadline for Release of Transcript Restriction. After that date it may be obtained through the Court Reporter/Transcriber or PACER. For further information on the redaction process, see the Court's web site at www.ilnd.uscourts.gov under Quick Links select Policy Regarding the Availability of Transcripts of Court Proceedings. Redaction Request due 4/17/2025. Redacted Transcript Deadline set for 4/28/2025. Release of Transcript Restriction set for 6/25/2025. (Labella, Nancy) (Entered: 03/27/2025)</summary><link href="https://ecf.ilnd.uscourts.gov/doc1/067032204478?caseid=437583" length="0" rel="enclosure" /><updated>2025-03-27T00:00:00-07:00</updated></entry><entry><title>Entry #84 in McFadden v. Fenix Internet, LLC, 1:23-cv-06151</title><link href="https://www.courtlistener.com/docket/67731727/mcfadden-v-fenix-internet-llc/?order_by=desc#entry-84" rel="alternate" /><published>2025-01-30T00:00:00-08:00</published><id>https://www.courtlistener.com/docket/67731727/mcfadden-v-fenix-internet-llc/?order_by=desc#entry-84</id><summary type="html">ATTORNEY Appearance for Plaintiffs Philip McFadden, John P DeFranza by Shana Hope Khader (Khader, Shana) (Entered: 01/30/2025)</summary><link href="https://ecf.ilnd.uscourts.gov/doc1/067031875674?caseid=437583" length="0" rel="enclosure" /><updated>2025-01-30T00:00:00-08:00</updated></entry><entry><title>Entry #83 in McFadden v. Fenix Internet, LLC, 1:23-cv-06151</title><link href="https://www.courtlistener.com/docket/67731727/mcfadden-v-fenix-internet-llc/?order_by=desc#entry-83" rel="alternate" /><published>2025-01-28T00:00:00-08:00</published><id>https://www.courtlistener.com/docket/67731727/mcfadden-v-fenix-internet-llc/?order_by=desc#entry-83</id><summary type="html">MINUTE entry before the Honorable John F. Kness: This matter is set for a hearing for Rule 44.1 Foreign Law Testimony on 5/21/2025 at 9:30 A.M. Mailed notice. (exr, ) (Entered: 01/28/2025)</summary><link href="https://ecf.ilnd.uscourts.gov/doc1/067031857540?caseid=437583" length="0" rel="enclosure" /><updated>2025-01-28T00:00:00-08:00</updated></entry><entry><title>Entry #82 in McFadden v. Fenix Internet, LLC, 1:23-cv-06151</title><link href="https://www.courtlistener.com/docket/67731727/mcfadden-v-fenix-internet-llc/?order_by=desc#entry-82" rel="alternate" /><published>2025-01-22T00:00:00-08:00</published><id>https://www.courtlistener.com/docket/67731727/mcfadden-v-fenix-internet-llc/?order_by=desc#entry-82</id><summary type="html">NOTICE by All Plaintiffs of Firm Name Change (Shub, Jonathan) (Entered: 01/22/2025)</summary><link href="https://ecf.ilnd.uscourts.gov/doc1/067031821256?caseid=437583" length="0" rel="enclosure" /><updated>2025-01-22T00:00:00-08:00</updated></entry><entry><title>Entry #81 in McFadden v. Fenix Internet, LLC, 1:23-cv-06151</title><link href="https://www.courtlistener.com/docket/67731727/mcfadden-v-fenix-internet-llc/?order_by=desc#entry-81" rel="alternate" /><published>2024-12-27T00:00:00-08:00</published><id>https://www.courtlistener.com/docket/67731727/mcfadden-v-fenix-internet-llc/?order_by=desc#entry-81</id><summary type="html">ANNUAL REMINDER: Pursuant to Local Rule 3.2 (Notification of Affiliates), any nongovernmental party, other than an individual or sole proprietorship, must file a statement identifying all its affiliates known to the party after diligent review or, if the party has identified no affiliates, then a statement reflecting that fact must be filed. An affiliate is defined as follows: any entity or individual owning, directly or indirectly (through ownership of one or more other entities), 5% or more of a party. The statement is to be electronically filed as a PDF in conjunction with entering the affiliates in CM/ECF as prompted. As a reminder to counsel, parties must supplement their statements of affiliates within thirty (30) days of any change in the information previously reported. This minute order is being issued to all counsel of record to remind counsel of their obligation to provide updated information as to additional affiliates if such updating is necessary. If counsel has any questions regarding this process, this LINK will provide additional information. Signed by the Honorable Virginia M. Kendall on 12/27/2024: Mailed notice. (tg, ) (Entered: 12/28/2024)</summary><link href="https://ecf.ilnd.uscourts.gov/doc1/067031680832?caseid=437583" length="0" rel="enclosure" /><updated>2024-12-27T00:00:00-08:00</updated></entry><entry><title>Entry #80 in McFadden v. Fenix Internet, LLC, 1:23-cv-06151</title><link href="https://www.courtlistener.com/docket/67731727/mcfadden-v-fenix-internet-llc/?order_by=desc#entry-80" rel="alternate" /><published>2024-12-12T00:00:00-08:00</published><id>https://www.courtlistener.com/docket/67731727/mcfadden-v-fenix-internet-llc/?order_by=desc#entry-80</id><summary type="html">MINUTE entry before the Honorable John F. Kness: Telephonic status hearing held 12/12/2024. As discussed on the record, the Court will set a hearing to hear testimony from the parties' English law experts concerning the validity of the forum selection clause. A substantive order expanding on the reasoning for this decision will be issued separately. The courtroom deputy will reach out to the parties to find a date for the hearing, which will be held by remote means (logistical details to follow). The parties informed the Court that negotiations on the pending motion to seal 48 have stalled. That motion is taken under advisement and will be resolved by separate order. Mailed notice. (exr, ) (Entered: 12/16/2024)</summary><link href="https://ecf.ilnd.uscourts.gov/doc1/067031620172?caseid=437583" length="0" rel="enclosure" /><updated>2024-12-12T00:00:00-08:00</updated></entry><entry><title>Entry #79 in McFadden v. Fenix Internet, LLC, 1:23-cv-06151</title><link href="https://www.courtlistener.com/docket/67731727/mcfadden-v-fenix-internet-llc/?order_by=desc#entry-79" rel="alternate" /><published>2024-12-11T00:00:00-08:00</published><id>https://www.courtlistener.com/docket/67731727/mcfadden-v-fenix-internet-llc/?order_by=desc#entry-79</id><summary type="html">MINUTE entry before the Honorable John F. Kness: Judge Kness' telephone conference line has changed. For any upcoming telephonic hearings in this matter, the parties shall dial 1-855-244-8681 and enter Access Code: 2315 003 3696. Mailed notice. (exr, ) (Entered: 12/11/2024)</summary><link href="https://ecf.ilnd.uscourts.gov/doc1/067031593560?caseid=437583" length="0" rel="enclosure" /><updated>2024-12-11T00:00:00-08:00</updated></entry><entry><title>Entry #78 in McFadden v. Fenix Internet, LLC, 1:23-cv-06151</title><link href="https://www.courtlistener.com/docket/67731727/mcfadden-v-fenix-internet-llc/?order_by=desc#entry-78" rel="alternate" /><published>2024-12-05T00:00:00-08:00</published><id>https://www.courtlistener.com/docket/67731727/mcfadden-v-fenix-internet-llc/?order_by=desc#entry-78</id><summary type="html">ATTORNEY Appearance for Plaintiffs Philip McFadden, John P DeFranza by Leonard Aragon (Aragon, Leonard) (Entered: 12/05/2024)</summary><link href="https://ecf.ilnd.uscourts.gov/doc1/067031556152?caseid=437583" length="0" rel="enclosure" /><updated>2024-12-05T00:00:00-08:00</updated></entry><entry><title>Entry #77 in McFadden v. Fenix Internet, LLC, 1:23-cv-06151</title><link href="https://www.courtlistener.com/docket/67731727/mcfadden-v-fenix-internet-llc/?order_by=desc#entry-77" rel="alternate" /><published>2024-12-05T00:00:00-08:00</published><id>https://www.courtlistener.com/docket/67731727/mcfadden-v-fenix-internet-llc/?order_by=desc#entry-77</id><summary type="html">ATTORNEY Appearance for Plaintiffs Philip McFadden, John P DeFranza by Robert B. Carey (Carey, Robert) (Entered: 12/05/2024)</summary><link href="https://ecf.ilnd.uscourts.gov/doc1/067031556127?caseid=437583" length="0" rel="enclosure" /><updated>2024-12-05T00:00:00-08:00</updated></entry></feed>