<?xml version='1.0' encoding='utf-8'?>
<feed xmlns="http://www.w3.org/2005/Atom" xml:lang="en-us"><title>Docket updates for X Corp. v. Apple Inc., 4:25-cv-00914</title><link href="https://michaellee50.github.io/CourtListener/feed-X-Corp-v-Apple.xml" rel="self" type="application/atom+xml" /><link href="https://www.courtlistener.com/" rel="alternate" /><link href="https://www.courtlistener.com/docket/71191818/feed/" rel="self" /><id>https://www.courtlistener.com/</id><updated>2026-02-05T00:00:00-08:00</updated><author><name>Free Law Project</name><email>feeds@courtlistener.com</email></author><rights>Created for the public domain by Free Law Project</rights><entry><title>Minute entry from 2026-02-05 in X Corp. v. Apple Inc., 4:25-cv-00914</title><link href="https://www.courtlistener.com/docket/71191818/X Corp.-v.-Apple-Inc./" rel="alternate" /><published>2026-02-05T00:00:00-08:00</published><id>https://www.courtlistener.com/docket/71191818/x-corp-v-apple-inc/?order_by=desc#minute-entry-452908883</id><summary type="html">Order on Application for Admission Pro Hac Vice</summary><updated>2026-02-05T00:00:00-08:00</updated></entry><entry><title>Entry #150 in X Corp. v. Apple Inc., 4:25-cv-00914</title><link href="https://www.courtlistener.com/docket/71191818/x-corp-v-apple-inc/?order_by=desc#entry-150" rel="alternate" /><published>2026-02-03T00:00:00-08:00</published><id>https://www.courtlistener.com/docket/71191818/x-corp-v-apple-inc/?order_by=desc#entry-150</id><summary type="html">Order Referring Motion</summary><link href="https://ecf.txnd.uscourts.gov/doc1/177018328200?caseid=408471" length="0" rel="enclosure" /><updated>2026-02-03T00:00:00-08:00</updated></entry><entry><title>Entry #149 in X Corp. v. Apple Inc., 4:25-cv-00914</title><link href="https://www.courtlistener.com/docket/71191818/x-corp-v-apple-inc/?order_by=desc#entry-149" rel="alternate" /><published>2026-02-02T00:00:00-08:00</published><id>https://www.courtlistener.com/docket/71191818/x-corp-v-apple-inc/?order_by=desc#entry-149</id><summary type="html">Order</summary><link href="https://storage.courtlistener.com/recap/gov.uscourts.txnd.408471/gov.uscourts.txnd.408471.149.0.pdf" length="0" rel="enclosure" /><updated>2026-02-02T00:00:00-08:00</updated></entry><entry><title>Entry #145 in X Corp. v. Apple Inc., 4:25-cv-00914</title><link href="https://www.courtlistener.com/docket/71191818/x-corp-v-apple-inc/?order_by=desc#entry-145" rel="alternate" /><published>2026-01-29T00:00:00-08:00</published><id>https://www.courtlistener.com/docket/71191818/x-corp-v-apple-inc/?order_by=desc#entry-145</id><summary type="html">Appendix in Support filed by OpenAI OpCo, LLC, OpenAI, Inc., OpenAI, L.L.C. re 144 Response/Objection, (Hurst, Michael) (Entered: 01/29/2026)</summary><link href="https://ecf.txnd.uscourts.gov/doc1/177018317674?caseid=408471" length="0" rel="enclosure" /><updated>2026-01-29T00:00:00-08:00</updated></entry><entry><title>Entry #144 in X Corp. v. Apple Inc., 4:25-cv-00914</title><link href="https://www.courtlistener.com/docket/71191818/x-corp-v-apple-inc/?order_by=desc#entry-144" rel="alternate" /><published>2026-01-29T00:00:00-08:00</published><id>https://www.courtlistener.com/docket/71191818/x-corp-v-apple-inc/?order_by=desc#entry-144</id><summary type="html">RESPONSE AND OBJECTION filed by OpenAI OpCo, LLC, OpenAI, Inc., OpenAI, L.L.C. re: 117 MOTION to Compel Discovery From The OpenAI Defendants And For Expedited Briefing (Attachments: # 1 Proposed Order Proposed Order) (Hurst, Michael) (Entered: 01/29/2026)</summary><link href="https://ecf.txnd.uscourts.gov/doc1/177018317648?caseid=408471" length="0" rel="enclosure" /><updated>2026-01-29T00:00:00-08:00</updated></entry><entry><title>Minute entry from 2026-01-29 in X Corp. v. Apple Inc., 4:25-cv-00914</title><link href="https://www.courtlistener.com/docket/71191818/X Corp.-v.-Apple-Inc./" rel="alternate" /><published>2026-01-29T00:00:00-08:00</published><id>https://www.courtlistener.com/docket/71191818/x-corp-v-apple-inc/?order_by=desc#minute-entry-452342781</id><summary type="html">***Clerk's Notice of delivery: (see NEF for details) Docket No:143. Thu Jan 29 09:34:11 CST 2026 (crt)</summary><updated>2026-01-29T00:00:00-08:00</updated></entry><entry><title>Entry #143 in X Corp. v. Apple Inc., 4:25-cv-00914</title><link href="https://www.courtlistener.com/docket/71191818/x-corp-v-apple-inc/?order_by=desc#entry-143" rel="alternate" /><published>2026-01-29T00:00:00-08:00</published><id>https://www.courtlistener.com/docket/71191818/x-corp-v-apple-inc/?order_by=desc#entry-143</id><summary type="html">ORDER: The current mediation deadline in the above-captioned case is Wednesday April 22, 2026. The Court hereby ORDERS that the mediation deadline be extended to Thursday, July 2, 2026. (Ordered by Judge Mark Pittman on 1/29/2026) (saw) (Entered: 01/29/2026)</summary><link href="https://storage.courtlistener.com/recap/gov.uscourts.txnd.408471/gov.uscourts.txnd.408471.143.0.pdf" length="0" rel="enclosure" /><updated>2026-01-29T00:00:00-08:00</updated></entry><entry><title>Entry #142 in X Corp. v. Apple Inc., 4:25-cv-00914</title><link href="https://www.courtlistener.com/docket/71191818/x-corp-v-apple-inc/?order_by=desc#entry-142" rel="alternate" /><published>2026-01-25T00:00:00-08:00</published><id>https://www.courtlistener.com/docket/71191818/x-corp-v-apple-inc/?order_by=desc#entry-142</id><summary type="html">Notice of Filing of Official Electronic Transcript of Motion Hearing Proceedings held on January 21, 2026 before Judge Hal R. Ray, Jr.. Court Reporter/Transcriber Monica Guzman, Telephone number 817-850-6681 or mguzman.csr@yahoo.com. Parties are notified of their duty to review the transcript. A copy may be purchased from the court reporter or viewed at the clerk's office. If the transcript contains personal identifiers that must be redacted under MO 61, Fed.R.Civ.P. 5.2 or Fed.R.Crim.P. 49.1, or if the transcript contains the name of a minor child victim or a minor child witness that must be redacted under 18 U.S.C. ยง 3509, file a Redaction Request - Transcript within 21 days. If no action is taken, the entire transcript will be made available through PACER without redaction after 90 calendar days. The clerk will mail a copy of this notice to parties not electronically noticed. (44 pages) Redaction Request due 2/17/2026. Redacted Transcript Deadline set for 2/25/2026. Release of Transcript Restriction set for 4/27/2026. (mwg) (Entered: 01/25/2026)</summary><link href="https://ecf.txnd.uscourts.gov/doc1/177018307167?caseid=408471" length="0" rel="enclosure" /><updated>2026-01-25T00:00:00-08:00</updated></entry><entry><title>Minute entry from 2026-01-23 in X Corp. v. Apple Inc., 4:25-cv-00914</title><link href="https://www.courtlistener.com/docket/71191818/X Corp.-v.-Apple-Inc./" rel="alternate" /><published>2026-01-23T00:00:00-08:00</published><id>https://www.courtlistener.com/docket/71191818/x-corp-v-apple-inc/?order_by=desc#minute-entry-451538064</id><summary type="html">***Clerk's Notice of delivery: (see NEF for details) Docket No:141. Fri Jan 23 16:01:42 CST 2026 (crt)</summary><updated>2026-01-23T00:00:00-08:00</updated></entry><entry><title>Entry #141 in X Corp. v. Apple Inc., 4:25-cv-00914</title><link href="https://www.courtlistener.com/docket/71191818/x-corp-v-apple-inc/?order_by=desc#entry-141" rel="alternate" /><published>2026-01-23T00:00:00-08:00</published><id>https://www.courtlistener.com/docket/71191818/x-corp-v-apple-inc/?order_by=desc#entry-141</id><summary type="html">ORDER: Before the Court is the parties Joint Motion for Entry of a Rule 502(d) Order ("Motion"). Having considered the Motion and applicable law, the Court finds that the Motion should be and hereby is GRANTED. IT IS THEREFORE ORDERED that, pursuant to Fed. R. Evid. 502(d), the production of any discovery material, whether inadvertent or otherwise, in this proceeding shall not, for the purposes of this proceeding or any other federal or state proceeding, constitute a waiver by the Producing Party of any privilege applicable to that discovery material, including the attorney-client privilege, attorney work-product protection, or any other privilege or protection recognized by law. This Order shall be interpreted to provide the maximum protection allowed by Fed. R. Evid. 502(d). The provisions of Fed. R. Evid. 502(b) do not apply. (Ordered by Judge Mark Pittman on 1/23/2026) (saw) (Entered: 01/23/2026)</summary><link href="https://storage.courtlistener.com/recap/gov.uscourts.txnd.408471/gov.uscourts.txnd.408471.141.0.pdf" length="0" rel="enclosure" /><updated>2026-01-23T00:00:00-08:00</updated></entry><entry><title>Entry #140 in X Corp. v. Apple Inc., 4:25-cv-00914</title><link href="https://www.courtlistener.com/docket/71191818/x-corp-v-apple-inc/?order_by=desc#entry-140" rel="alternate" /><published>2026-01-23T00:00:00-08:00</published><id>https://www.courtlistener.com/docket/71191818/x-corp-v-apple-inc/?order_by=desc#entry-140</id><summary type="html">MOTION Joint Motion for Entry of a Rule 502(d) Order filed by X Corp, X.AI LLC (Attachments: # 1 Proposed Order) (Eisman, Scott) (Entered: 01/23/2026)</summary><link href="https://ecf.txnd.uscourts.gov/doc1/177018305798?caseid=408471" length="0" rel="enclosure" /><updated>2026-01-23T00:00:00-08:00</updated></entry><entry><title>Entry #139 in X Corp. v. Apple Inc., 4:25-cv-00914</title><link href="https://www.courtlistener.com/docket/71191818/x-corp-v-apple-inc/?order_by=desc#entry-139" rel="alternate" /><published>2026-01-22T00:00:00-08:00</published><id>https://www.courtlistener.com/docket/71191818/x-corp-v-apple-inc/?order_by=desc#entry-139</id><summary type="html">ORDER: After considering the pleadings, status report, arguments of counsel, applicable legal authorities, and for the reasons stated at the hearing and the additional reasons explained below, the Court finds that the Motion should be and is hereby DENIED in part. The parties resolved the first issue prior to the January 21, 2026 hearing, and it is therefore MOOT. The Court ORDERS OpenAI to file any supplemental brief or evidence in opposition to Plaintiffs' request on or before January 29, 2026. The Court DENIES Plaintiffs' Motion to Compel Discovery (ECF No. 117 ) as to Plaintiffs' request for OpenAI's source code. (Ordered by Magistrate Judge Hal R. Ray, Jr on 1/22/2026) (hcc) (Entered: 01/22/2026)</summary><link href="https://storage.courtlistener.com/recap/gov.uscourts.txnd.408471/gov.uscourts.txnd.408471.139.0.pdf" length="0" rel="enclosure" /><updated>2026-01-22T00:00:00-08:00</updated></entry><entry><title>Entry #138 in X Corp. v. Apple Inc., 4:25-cv-00914</title><link href="https://www.courtlistener.com/docket/71191818/x-corp-v-apple-inc/?order_by=desc#entry-138" rel="alternate" /><published>2026-01-22T00:00:00-08:00</published><id>https://www.courtlistener.com/docket/71191818/x-corp-v-apple-inc/?order_by=desc#entry-138</id><summary type="html">Transcript Order Form: transcript requested by OpenAI, L.L.C., OpenAI, Inc., OpenAI OpCo, LLC for Motion to Compel Hearing on 1/21/2026 (Court Reporter: Monica Guzman.) Payment method: Private funds - Requester has obtained the estimate from the reporter and has paid or will pay the cost as directed. Reminder: If the transcript is ordered for an appeal, Appellant must also file a copy of the order form with the appeals court.. (Hurst, Michael) (Entered: 01/22/2026)</summary><link href="https://ecf.txnd.uscourts.gov/doc1/177018301140?caseid=408471" length="0" rel="enclosure" /><updated>2026-01-22T00:00:00-08:00</updated></entry><entry><title>Entry #137 in X Corp. v. Apple Inc., 4:25-cv-00914</title><link href="https://www.courtlistener.com/docket/71191818/x-corp-v-apple-inc/?order_by=desc#entry-137" rel="alternate" /><published>2026-01-22T00:00:00-08:00</published><id>https://www.courtlistener.com/docket/71191818/x-corp-v-apple-inc/?order_by=desc#entry-137</id><summary type="html">Transcript Order Form: transcript requested by X Corp, X.AI LLC for Motion to Compel hearing 1/21/26 (Court Reporter: Monica Guzman.) Payment method: Private funds - Requester has obtained the estimate from the reporter and has paid or will pay the cost as directed. Reminder: If the transcript is ordered for an appeal, Appellant must also file a copy of the order form with the appeals court.. (Hilton, Christopher) (Entered: 01/22/2026)</summary><link href="https://ecf.txnd.uscourts.gov/doc1/177018300996?caseid=408471" length="0" rel="enclosure" /><updated>2026-01-22T00:00:00-08:00</updated></entry><entry><title>Entry #136 in X Corp. v. Apple Inc., 4:25-cv-00914</title><link href="https://www.courtlistener.com/docket/71191818/x-corp-v-apple-inc/?order_by=desc#entry-136" rel="alternate" /><published>2026-01-21T00:00:00-08:00</published><id>https://www.courtlistener.com/docket/71191818/x-corp-v-apple-inc/?order_by=desc#entry-136</id><summary type="html">ELECTRONIC Minute Entry for proceedings held before Magistrate Judge Hal R. Ray, Jr: Motion Hearing held on 1/21/2026 re: 117 MOTION to Compel Discovery From The OpenAI Defendants And For Expedited Briefing Attorney Appearances: Plaintiff - Christopher D Hilton, Craig Matthew Reiser, Scott Eisman; Defense - Apple Inc - Dee Keely, Henry Liu; Defense OpenAI, Inc. - Andy Kim, Christopher W Patton, Kevin Scott Schwartz. (Court Reporter: Monica Guzman) (No exhibits) Time in Court - :46. (mcrd) (Entered: 01/21/2026)</summary><link href="https://ecf.txnd.uscourts.gov/cgi-bin/show_case_doc?136,408471,,," length="0" rel="enclosure" /><updated>2026-01-21T00:00:00-08:00</updated></entry><entry><title>Entry #135 in X Corp. v. Apple Inc., 4:25-cv-00914</title><link href="https://www.courtlistener.com/docket/71191818/x-corp-v-apple-inc/?order_by=desc#entry-135" rel="alternate" /><published>2026-01-20T00:00:00-08:00</published><id>https://www.courtlistener.com/docket/71191818/x-corp-v-apple-inc/?order_by=desc#entry-135</id><summary type="html">ORDER granting 131 : Before the Court is the parties' Joint Motion to Extend Expert- Related Deadlines in Scheduling Order. ECF No. 131 . The Motion is hereby GRANTED. (Ordered by Judge Mark Pittman on 1/20/2026) (wxc) (Entered: 01/20/2026)</summary><link href="https://ecf.txnd.uscourts.gov/doc1/177018292694?caseid=408471" length="0" rel="enclosure" /><updated>2026-01-20T00:00:00-08:00</updated></entry><entry><title>Entry #134 in X Corp. v. Apple Inc., 4:25-cv-00914</title><link href="https://www.courtlistener.com/docket/71191818/x-corp-v-apple-inc/?order_by=desc#entry-134" rel="alternate" /><published>2026-01-16T00:00:00-08:00</published><id>https://www.courtlistener.com/docket/71191818/x-corp-v-apple-inc/?order_by=desc#entry-134</id><summary type="html">Appendix in Support filed by OpenAI OpCo, LLC, OpenAI, Inc., OpenAI, L.L.C. re 133 Response/Objection, (Hurst, Michael) (Entered: 01/16/2026)</summary><link href="https://ecf.txnd.uscourts.gov/doc1/177018288718?caseid=408471" length="0" rel="enclosure" /><updated>2026-01-16T00:00:00-08:00</updated></entry><entry><title>Entry #133 in X Corp. v. Apple Inc., 4:25-cv-00914</title><link href="https://www.courtlistener.com/docket/71191818/x-corp-v-apple-inc/?order_by=desc#entry-133" rel="alternate" /><published>2026-01-16T00:00:00-08:00</published><id>https://www.courtlistener.com/docket/71191818/x-corp-v-apple-inc/?order_by=desc#entry-133</id><summary type="html">RESPONSE AND OBJECTION filed by OpenAI OpCo, LLC, OpenAI, Inc., OpenAI, L.L.C. re: 117 MOTION to Compel Discovery From The OpenAI Defendants And For Expedited Briefing (Attachments: # 1 Proposed Order Proposed Order) (Hurst, Michael) (Entered: 01/16/2026)</summary><link href="https://ecf.txnd.uscourts.gov/doc1/177018288707?caseid=408471" length="0" rel="enclosure" /><updated>2026-01-16T00:00:00-08:00</updated></entry><entry><title>Entry #132 in X Corp. v. Apple Inc., 4:25-cv-00914</title><link href="https://www.courtlistener.com/docket/71191818/x-corp-v-apple-inc/?order_by=desc#entry-132" rel="alternate" /><published>2026-01-16T00:00:00-08:00</published><id>https://www.courtlistener.com/docket/71191818/x-corp-v-apple-inc/?order_by=desc#entry-132</id><summary type="html">Joint STATUS REPORT pursuant to Order (ECF No. 123) filed by X Corp, X.AI LLC. (Eisman, Scott) (Entered: 01/16/2026)</summary><link href="https://storage.courtlistener.com/recap/gov.uscourts.txnd.408471/gov.uscourts.txnd.408471.132.0.pdf" length="0" rel="enclosure" /><updated>2026-01-16T00:00:00-08:00</updated></entry><entry><title>Entry #131 in X Corp. v. Apple Inc., 4:25-cv-00914</title><link href="https://www.courtlistener.com/docket/71191818/x-corp-v-apple-inc/?order_by=desc#entry-131" rel="alternate" /><published>2026-01-16T00:00:00-08:00</published><id>https://www.courtlistener.com/docket/71191818/x-corp-v-apple-inc/?order_by=desc#entry-131</id><summary type="html">Joint MOTION to Extend Time for Expert-Related Deadlines in Scheduling Order filed by Apple Inc (Wisenberg, Julia) (Entered: 01/16/2026)</summary><link href="https://ecf.txnd.uscourts.gov/doc1/177018288244?caseid=408471" length="0" rel="enclosure" /><updated>2026-01-16T00:00:00-08:00</updated></entry><entry><title>Entry #130 in X Corp. v. Apple Inc., 4:25-cv-00914</title><link href="https://www.courtlistener.com/docket/71191818/x-corp-v-apple-inc/?order_by=desc#entry-130" rel="alternate" /><published>2026-01-15T00:00:00-08:00</published><id>https://www.courtlistener.com/docket/71191818/x-corp-v-apple-inc/?order_by=desc#entry-130</id><summary type="html">LETTER OF REQUEST FOR INTERNATIONAL JUDICIAL ASSISTANCE PURSUANT TO THE HAGUE CONVENTION ON THE TAKING OF EVIDENCE ABROAD IN CIVIL OR COMMERCIAL MATTERS TO OBTAIN EVIDENCE FROM GRABTAXI HOLDINGS PTE. LTD. (Signed by Judge Mark Pittman on 1/15/2026) (bdb) (Entered: 01/16/2026)</summary><link href="https://storage.courtlistener.com/recap/gov.uscourts.txnd.408471/gov.uscourts.txnd.408471.130.0.pdf" length="0" rel="enclosure" /><updated>2026-01-15T00:00:00-08:00</updated></entry><entry><title>Entry #129 in X Corp. v. Apple Inc., 4:25-cv-00914</title><link href="https://www.courtlistener.com/docket/71191818/x-corp-v-apple-inc/?order_by=desc#entry-129" rel="alternate" /><published>2026-01-15T00:00:00-08:00</published><id>https://www.courtlistener.com/docket/71191818/x-corp-v-apple-inc/?order_by=desc#entry-129</id><summary type="html">ORDER GRANTING 127 MOTION FOR ISSUANCE OF LETTER OF REQUEST FOR INTERNATIONAL JUDICIAL ASSISTANCE PURSUANT TO THE HAGUE CONVENTION ON THE TAKING OF EVIDENCE ABROAD IN CIVIL OR COMMERCIAL MATTERS (Ordered by Judge Mark Pittman on 1/15/2026) (bdb) (Entered: 01/16/2026)</summary><link href="https://storage.courtlistener.com/recap/gov.uscourts.txnd.408471/gov.uscourts.txnd.408471.129.0.pdf" length="0" rel="enclosure" /><updated>2026-01-15T00:00:00-08:00</updated></entry><entry><title>Entry #128 in X Corp. v. Apple Inc., 4:25-cv-00914</title><link href="https://www.courtlistener.com/docket/71191818/x-corp-v-apple-inc/?order_by=desc#entry-128" rel="alternate" /><published>2026-01-15T00:00:00-08:00</published><id>https://www.courtlistener.com/docket/71191818/x-corp-v-apple-inc/?order_by=desc#entry-128</id><summary type="html">Appendix in Support filed by X Corp, X.AI LLC re 127 MOTION for Issuance of Letter of Request for International Judicial Assistance Pursuant to the Hague Convention on the Taking of Evidence Abroad in Civil or Commercial Matters (Eisman, Scott) (Entered: 01/15/2026)</summary><link href="https://ecf.txnd.uscourts.gov/doc1/177018285587?caseid=408471" length="0" rel="enclosure" /><updated>2026-01-15T00:00:00-08:00</updated></entry><entry><title>Entry #127 in X Corp. v. Apple Inc., 4:25-cv-00914</title><link href="https://www.courtlistener.com/docket/71191818/x-corp-v-apple-inc/?order_by=desc#entry-127" rel="alternate" /><published>2026-01-15T00:00:00-08:00</published><id>https://www.courtlistener.com/docket/71191818/x-corp-v-apple-inc/?order_by=desc#entry-127</id><summary type="html">MOTION for Issuance of Letter of Request for International Judicial Assistance Pursuant to the Hague Convention on the Taking of Evidence Abroad in Civil or Commercial Matters filed by X Corp, X.AI LLC with Brief/Memorandum in Support. (Attachments: # 1 Proposed Order) (Eisman, Scott) (Entered: 01/15/2026)</summary><link href="https://ecf.txnd.uscourts.gov/doc1/177018285561?caseid=408471" length="0" rel="enclosure" /><updated>2026-01-15T00:00:00-08:00</updated></entry><entry><title>Entry #126 in X Corp. v. Apple Inc., 4:25-cv-00914</title><link href="https://www.courtlistener.com/docket/71191818/x-corp-v-apple-inc/?order_by=desc#entry-126" rel="alternate" /><published>2026-01-14T00:00:00-08:00</published><id>https://www.courtlistener.com/docket/71191818/x-corp-v-apple-inc/?order_by=desc#entry-126</id><summary type="html">ORDER: Attached is a letter from the Republic of Korea denying the Letter of Request for International Judicial Assistance Pursuant to the Hague Convention. ECF No. 121 . (Ordered by Judge Mark Pittman on 1/14/2026) (saw) (Entered: 01/14/2026)</summary><link href="https://storage.courtlistener.com/recap/gov.uscourts.txnd.408471/gov.uscourts.txnd.408471.126.0.pdf" length="0" rel="enclosure" /><updated>2026-01-14T00:00:00-08:00</updated></entry><entry><title>Entry #125 in X Corp. v. Apple Inc., 4:25-cv-00914</title><link href="https://www.courtlistener.com/docket/71191818/x-corp-v-apple-inc/?order_by=desc#entry-125" rel="alternate" /><published>2026-01-12T00:00:00-08:00</published><id>https://www.courtlistener.com/docket/71191818/x-corp-v-apple-inc/?order_by=desc#entry-125</id><summary type="html">ORDER: Before the Court is Plaintiffs' Unopposed Motion to Withdraw Caroline P. Boisvert as Counsel. ECF No. 124 . The Motion is GRANTED. Accordingly, it is hereby ORDERED that Caroline P. Boisvert is withdrawn as counsel for Plaintiffs X Corp. and X.AI LLC in this matter. (Ordered by Judge Mark Pittman on 1/12/2026) (hcc) (Entered: 01/12/2026)</summary><link href="https://ecf.txnd.uscourts.gov/doc1/177018272705?caseid=408471" length="0" rel="enclosure" /><updated>2026-01-12T00:00:00-08:00</updated></entry><entry><title>Entry #124 in X Corp. v. Apple Inc., 4:25-cv-00914</title><link href="https://www.courtlistener.com/docket/71191818/x-corp-v-apple-inc/?order_by=desc#entry-124" rel="alternate" /><published>2026-01-09T00:00:00-08:00</published><id>https://www.courtlistener.com/docket/71191818/x-corp-v-apple-inc/?order_by=desc#entry-124</id><summary type="html">Unopposed MOTION to Withdraw as Attorney Caroline P. Boisvert filed by X Corp, X.AI LLC (Attachments: # 1 Proposed Order) (Eisman, Scott) (Entered: 01/09/2026)</summary><link href="https://ecf.txnd.uscourts.gov/doc1/177018269534?caseid=408471" length="0" rel="enclosure" /><updated>2026-01-09T00:00:00-08:00</updated></entry><entry><title>Entry #123 in X Corp. v. Apple Inc., 4:25-cv-00914</title><link href="https://www.courtlistener.com/docket/71191818/x-corp-v-apple-inc/?order_by=desc#entry-123" rel="alternate" /><published>2026-01-08T00:00:00-08:00</published><id>https://www.courtlistener.com/docket/71191818/x-corp-v-apple-inc/?order_by=desc#entry-123</id><summary type="html">ORDER: the Court SETS the 117 motion for a Hearing, on January 21, 2026, at 1:30 p.m. C.S.T., in the Fourth Floor Courtroom, Eldon B. Mahon United States Court House, 501 W. 10th Street, Fort Worth, Texas 76102.Prior to the hearing, lead counsel for the parties shall confer by telephone to discuss narrowing the issues for the Court to consider. Counsel SHALL file a joint status report on or before January 16, 2026 at 12:00 p.m. describing the results of their telephone conference and advising the Court of issues remaining for determination. Additionally, by January 16, 2026 at 12:00 p.m., Defendants SHALL file a response to the motion. (Ordered by Magistrate Judge Hal R. Ray, Jr on 1/8/2026) (wxc) Modified document relationship on 1/9/2026 (bdb). (Entered: 01/08/2026)</summary><link href="https://storage.courtlistener.com/recap/gov.uscourts.txnd.408471/gov.uscourts.txnd.408471.123.0.pdf" length="0" rel="enclosure" /><updated>2026-01-08T00:00:00-08:00</updated></entry><entry><title>Entry #122 in X Corp. v. Apple Inc., 4:25-cv-00914</title><link href="https://www.courtlistener.com/docket/71191818/x-corp-v-apple-inc/?order_by=desc#entry-122" rel="alternate" /><published>2026-01-08T00:00:00-08:00</published><id>https://www.courtlistener.com/docket/71191818/x-corp-v-apple-inc/?order_by=desc#entry-122</id><summary type="html">ORDER: Before the Court is the 117 Motion to Compel Discovery from The Open AI Defendants and for Expedited Briefing. The Court hereby ORDERS that the Motion be referred to Judge Ray for further proceedings. (Ordered by Judge Mark Pittman on 1/8/2026) (mmw) (Entered: 01/08/2026)</summary><link href="https://ecf.txnd.uscourts.gov/doc1/177018266429?caseid=408471" length="0" rel="enclosure" /><updated>2026-01-08T00:00:00-08:00</updated></entry><entry><title>Entry #121 in X Corp. v. Apple Inc., 4:25-cv-00914</title><link href="https://www.courtlistener.com/docket/71191818/x-corp-v-apple-inc/?order_by=desc#entry-121" rel="alternate" /><published>2026-01-06T00:00:00-08:00</published><id>https://www.courtlistener.com/docket/71191818/x-corp-v-apple-inc/?order_by=desc#entry-121</id><summary type="html">LETTER OF REQUEST FOR INTERNATIONAL JUDICIALASSISTANCE PURSUANT TO THE HAGUE CONVENTION ONTHE TAKING OF EVIDENCE ABROAD IN CIVIL OR COMMERCIALMATTERS TO OBTAIN EVIDENCE FROM LG ELECTRONICS, INC. (includes the certified Korean translation of the Letter of Request) (Clerk Note: see order for specific details) (Ordered by Judge Mark Pittman on 1/6/2026) (mmw) Modified on 1/7/2026 (bdb). (Entered: 01/07/2026)</summary><link href="https://ecf.txnd.uscourts.gov/doc1/177018262750?caseid=408471" length="0" rel="enclosure" /><updated>2026-01-06T00:00:00-08:00</updated></entry></feed>