<?xml version='1.0' encoding='utf-8'?>
<feed xmlns="http://www.w3.org/2005/Atom" xml:lang="en-us"><title>Docket updates for Kadrey v. Meta Platforms, Inc., 3:23-cv-03417</title><link href="https://michaellee50.github.io/CourtListener/feed-kadrey-meta.xml" rel="self" type="application/atom+xml" /><link href="https://www.courtlistener.com/" rel="alternate" /><link href="https://www.courtlistener.com/docket/67569326/feed/" rel="self" /><id>https://www.courtlistener.com/</id><updated>2025-12-09T00:00:00-08:00</updated><author><name>Free Law Project</name><email>feeds@courtlistener.com</email></author><rights>Created for the public domain by Free Law Project</rights><entry><title>Minute entry from 2025-12-09 in Kadrey v. Meta Platforms, Inc., 3:23-cv-03417</title><link href="https://www.courtlistener.com/docket/67569326/kadrey-v-meta-platforms-inc/" rel="alternate" /><published>2025-12-09T00:00:00-08:00</published><id>https://www.courtlistener.com/docket/67569326/kadrey-v-meta-platforms-inc/?order_by=desc#minute-entry-446649367</id><summary type="html">Notice of Appearance/Substitution/Change/Withdrawal of Attorney</summary><updated>2025-12-09T00:00:00-08:00</updated></entry><entry><title>Entry #657 in Kadrey v. Meta Platforms, Inc., 3:23-cv-03417</title><link href="https://www.courtlistener.com/docket/67569326/kadrey-v-meta-platforms-inc/?order_by=desc#entry-657" rel="alternate" /><published>2025-12-09T00:00:00-08:00</published><id>https://www.courtlistener.com/docket/67569326/kadrey-v-meta-platforms-inc/?order_by=desc#entry-657</id><summary type="html">NOTICE of Appearance filed by Jalle H. Dafa on behalf of Christopher Farnsworth (Dafa, Jalle) (Filed on 12/9/2025) (Entered: 12/09/2025)</summary><link href="https://ecf.cand.uscourts.gov/cgi-bin/show_case_doc?657,415175,,," length="0" rel="enclosure" /><updated>2025-12-09T00:00:00-08:00</updated></entry><entry><title>Entry #656 in Kadrey v. Meta Platforms, Inc., 3:23-cv-03417</title><link href="https://www.courtlistener.com/docket/67569326/kadrey-v-meta-platforms-inc/?order_by=desc#entry-656" rel="alternate" /><published>2025-11-25T00:00:00-08:00</published><id>https://www.courtlistener.com/docket/67569326/kadrey-v-meta-platforms-inc/?order_by=desc#entry-656</id><summary type="html">CLERK'S NOTICE SCHEDULING FURTHER CASE MANAGEMENT CONFERENCE. Joint Case Management Statement due by 12/12/2025. Further Case Management Conference set for 12/19/2025 at 10:00 AM by Videoconference Only. This proceeding will be held via a Zoom webinar.Webinar Access: All counsel, members of the public, and media may access the webinar information at https://www.cand.uscourts.gov/vc Court Appearances: Advanced notice is required of counsel or parties who wish to be identified by the court as making an appearance or will be participating in the argument at the hearing. One list of names of all counsel appearing for all parties must be sent in one email to the CRD at vccrd@cand.uscourts.gov no later than Friday, December 12, 2025, by no later than 12:00PM.Civ LR 77-3(d). Persons granted access to court proceedings held by telephone or videoconference are reminded that photographing, recording, and rebroadcasting of court proceedings, including screenshots or other visual copying of a hearing, is absolutely prohibited.Zoom Guidance and Setup: https://www.cand.uscourts.gov/zoom/. Case Management Statement due by 12/12/2025. Further Case Management Conference set for 12/19/2025 10:00 AM in San Francisco, - Videoconference Only. (This is a text-only entry generated by the court. There is no document associated with this entry.)(bxs, COURT STAFF) (Filed on 11/25/2025) (Entered: 11/25/2025)</summary><link href="https://ecf.cand.uscourts.gov/cgi-bin/show_case_doc?656,415175,,," length="0" rel="enclosure" /><updated>2025-11-25T00:00:00-08:00</updated></entry><entry><title>Minute entry from 2025-11-25 in Kadrey v. Meta Platforms, Inc., 3:23-cv-03417</title><link href="https://www.courtlistener.com/docket/67569326/kadrey-v-meta-platforms-inc/" rel="alternate" /><published>2025-11-25T00:00:00-08:00</published><id>https://www.courtlistener.com/docket/67569326/kadrey-v-meta-platforms-inc/?order_by=desc#minute-entry-445391815</id><summary type="html">Clerk's Notice AND ~Util - Teleconference Zoom</summary><updated>2025-11-25T00:00:00-08:00</updated></entry><entry><title>Entry #655 in Kadrey v. Meta Platforms, Inc., 3:23-cv-03417</title><link href="https://www.courtlistener.com/docket/67569326/kadrey-v-meta-platforms-inc/?order_by=desc#entry-655" rel="alternate" /><published>2025-11-25T00:00:00-08:00</published><id>https://www.courtlistener.com/docket/67569326/kadrey-v-meta-platforms-inc/?order_by=desc#entry-655</id><summary type="html">ORDER RELATING CASES: 23-cv-03417-VC &amp; 25-cv-09579-BLF. Signed by Judge Vince Chhabria on 11/25/2025. (bxs, COURT STAFF) (Filed on 11/25/2025) (Entered: 11/25/2025)</summary><link href="https://storage.courtlistener.com/recap/gov.uscourts.cand.415175/gov.uscourts.cand.415175.655.0.pdf" length="0" rel="enclosure" /><updated>2025-11-25T00:00:00-08:00</updated></entry><entry><title>Entry #654 in Kadrey v. Meta Platforms, Inc., 3:23-cv-03417</title><link href="https://www.courtlistener.com/docket/67569326/kadrey-v-meta-platforms-inc/?order_by=desc#entry-654" rel="alternate" /><published>2025-11-20T00:00:00-08:00</published><id>https://www.courtlistener.com/docket/67569326/kadrey-v-meta-platforms-inc/?order_by=desc#entry-654</id><summary type="html">Brief re Public Refiling of Dkt. 635 (Administrative Motion Requesting Leave to Obtain Limited Additional Discovery) filed byTa-Nehisi Coates, Junot Diaz, Christopher Farnsworth, Christopher Golden, Andrew Sean Greer, David Henry Hwang, Richard Kadrey, Matthew Klam, Laura Lippman, Sarah Silverman, Rachel Louise Snyder, Lysa TerKeurst, Jacqueline Woodson. (Attachments: # 1 Declaration David R. Choffnes, # 2 Declaration Maxwell V. Pritt, # 3 Appendix A, # 4 Appendix B, # 5 Appendix C, # 6 Exhibit A, # 7 Exhibit B, # 8 Exhibit C, # 9 Exhibit D, # 10 Exhibit E, # 11 Exhibit F, # 12 Exhibit G, # 13 Exhibit H, # 14 Exhibit I, # 15 Exhibit J, # 16 Exhibit K, # 17 Exhibit L, # 18 Exhibit M, # 19 Exhibit N, # 20 Exhibit O, # 21 Exhibit P, # 22 Exhibit Q, # 23 Exhibit R, # 24 Exhibit S, # 25 Exhibit T, # 26 Exhibit U)(Pritt, Maxwell) (Filed on 11/20/2025) (Entered: 11/20/2025)</summary><link href="https://storage.courtlistener.com/recap/gov.uscourts.cand.415175/gov.uscourts.cand.415175.654.0.pdf" length="0" rel="enclosure" /><updated>2025-11-20T00:00:00-08:00</updated></entry><entry><title>Entry #653 in Kadrey v. Meta Platforms, Inc., 3:23-cv-03417</title><link href="https://www.courtlistener.com/docket/67569326/kadrey-v-meta-platforms-inc/?order_by=desc#entry-653" rel="alternate" /><published>2025-11-19T00:00:00-08:00</published><id>https://www.courtlistener.com/docket/67569326/kadrey-v-meta-platforms-inc/?order_by=desc#entry-653</id><summary type="html">Letter from Kathleen R. Hartnett to Court. (Hartnett, Kathleen) (Filed on 11/19/2025) (Entered: 11/19/2025)</summary><link href="https://storage.courtlistener.com/recap/gov.uscourts.cand.415175/gov.uscourts.cand.415175.653.0_2.pdf" length="0" rel="enclosure" /><updated>2025-11-19T00:00:00-08:00</updated></entry><entry><title>Entry #652 in Kadrey v. Meta Platforms, Inc., 3:23-cv-03417</title><link href="https://www.courtlistener.com/docket/67569326/kadrey-v-meta-platforms-inc/?order_by=desc#entry-652" rel="alternate" /><published>2025-11-18T00:00:00-08:00</published><id>https://www.courtlistener.com/docket/67569326/kadrey-v-meta-platforms-inc/?order_by=desc#entry-652</id><summary type="html">CORRECTION OF DOCKET # 650, [650-1] and [650-2Statement of Non-Opposition re 651 ADMINISTRATIVE MOTION to Relate Case Entrepreneur Media, LLC v. Meta Platforms, LLC, 5:25-cv-09579-BLF filed by Ta-Nehisi Coates, Junot Diaz, Christopher Farnsworth, Christopher Golden, Andrew Sean Greer, David Henry Hwang, Richard Kadrey, Matthew Klam, Laura Lippman, Sarah Silverman, Rachel Louise Snyder, Lysa TerKeurst, Jacqueline Woodson. (Related document(s) 651 ) (Pritt, Maxwell) (Filed on 11/18/2025) Modified on 11/21/2025 (kmg, COURT STAFF). (Entered: 11/18/2025)</summary><link href="https://ecf.cand.uscourts.gov/doc1/035026449856?caseid=415175" length="0" rel="enclosure" /><updated>2025-11-18T00:00:00-08:00</updated></entry><entry><title>Entry #651 in Kadrey v. Meta Platforms, Inc., 3:23-cv-03417</title><link href="https://www.courtlistener.com/docket/67569326/kadrey-v-meta-platforms-inc/?order_by=desc#entry-651" rel="alternate" /><published>2025-11-18T00:00:00-08:00</published><id>https://www.courtlistener.com/docket/67569326/kadrey-v-meta-platforms-inc/?order_by=desc#entry-651</id><summary type="html">(CORRECTION OF DOCKET # 650, [650-1] and [650-2]) filed by Entrepreneur Media LLC. ADMINISTRATIVE MOTION to Relate Case Entrepreneur Media, LLC v. Meta Platforms, LLC, 5:25-cv-09579-BLF Responses due by 11/24/2025. (Attachments: # 1 Declaration of Moez Kaba ISO Corrected Administrative Motion to Relate Case, # 2 Proposed Order)(Kaba, Moez) (Filed on 11/18/2025) Modified on 11/21/2025 (kmg, COURT STAFF). (Entered: 11/18/2025)</summary><link href="https://storage.courtlistener.com/recap/gov.uscourts.cand.415175/gov.uscourts.cand.415175.651.0.pdf" length="0" rel="enclosure" /><updated>2025-11-18T00:00:00-08:00</updated></entry><entry><title>Entry #650 in Kadrey v. Meta Platforms, Inc., 3:23-cv-03417</title><link href="https://www.courtlistener.com/docket/67569326/kadrey-v-meta-platforms-inc/?order_by=desc#entry-650" rel="alternate" /><published>2025-11-18T00:00:00-08:00</published><id>https://www.courtlistener.com/docket/67569326/kadrey-v-meta-platforms-inc/?order_by=desc#entry-650</id><summary type="html">ADMINISTRATIVE MOTION to Relate Case Entrepreneur Media, LLC v. Meta Platforms, LLC, 3:25-CV-3579-BLF filed by Entrepreneur Media LLC. Responses due by 11/24/2025. (Attachments: # 1 Declaration of Moez Kaba ISO Administrative Motion to Relate Case, # 2 Proposed Order)(Kaba, Moez) (Filed on 11/18/2025) (Entered: 11/18/2025)</summary><link href="https://storage.courtlistener.com/recap/gov.uscourts.cand.415175/gov.uscourts.cand.415175.650.0_1.pdf" length="0" rel="enclosure" /><updated>2025-11-18T00:00:00-08:00</updated></entry><entry><title>Entry #649 in Kadrey v. Meta Platforms, Inc., 3:23-cv-03417</title><link href="https://www.courtlistener.com/docket/67569326/kadrey-v-meta-platforms-inc/?order_by=desc#entry-649" rel="alternate" /><published>2025-11-14T00:00:00-08:00</published><id>https://www.courtlistener.com/docket/67569326/kadrey-v-meta-platforms-inc/?order_by=desc#entry-649</id><summary type="html">Transcript of Proceedings held on November 10, 2025, before Judge Vince Chhabria. Court Reporter Kendra Steppler, email at kendra_steppler@cand.uscourts.gov. Per General Order No. 59 and Judicial Conference policy, this transcript may be viewed only at the Clerk's Office public terminal or may be purchased through the Court Reporter until the deadline for the Release of Transcript Restriction. After that date, it may be obtained through PACER. Any Notice of Intent to Request Redaction, if required, is due no later than 5 business days from date of this filing. (Re 645 Transcript Order, ) Release of Transcript Restriction set for 2/12/2026. (Related documents(s) 645 ) (Steppler, Kendra) (Filed on 11/14/2025) (Entered: 11/14/2025)</summary><link href="https://ecf.cand.uscourts.gov/doc1/035026433604?caseid=415175" length="0" rel="enclosure" /><updated>2025-11-14T00:00:00-08:00</updated></entry><entry><title>Entry #648 in Kadrey v. Meta Platforms, Inc., 3:23-cv-03417</title><link href="https://www.courtlistener.com/docket/67569326/kadrey-v-meta-platforms-inc/?order_by=desc#entry-648" rel="alternate" /><published>2025-11-13T00:00:00-08:00</published><id>https://www.courtlistener.com/docket/67569326/kadrey-v-meta-platforms-inc/?order_by=desc#entry-648</id><summary type="html">TRANSCRIPT ORDER for proceedings held on 11/10/2025 before Judge Vince Chhabria by Meta Platforms, Inc., for Court Reporter Kendra Steppler. (Stameshkin, Elizabeth) (Filed on 11/13/2025) (Entered: 11/13/2025)</summary><link href="https://storage.courtlistener.com/recap/gov.uscourts.cand.415175/gov.uscourts.cand.415175.648.0.pdf" length="0" rel="enclosure" /><updated>2025-11-13T00:00:00-08:00</updated></entry><entry><title>Entry #647 in Kadrey v. Meta Platforms, Inc., 3:23-cv-03417</title><link href="https://www.courtlistener.com/docket/67569326/kadrey-v-meta-platforms-inc/?order_by=desc#entry-647" rel="alternate" /><published>2025-11-13T00:00:00-08:00</published><id>https://www.courtlistener.com/docket/67569326/kadrey-v-meta-platforms-inc/?order_by=desc#entry-647</id><summary type="html">Order Granting Plaintiffs' Motion for Additional Discovery; Order re Sealing. Signed by Judge Vince Chhabria on 11/13/25. (vclc2, COURT STAFF) (Filed on 11/13/2025) (Entered: 11/13/2025)</summary><link href="https://storage.courtlistener.com/recap/gov.uscourts.cand.415175/gov.uscourts.cand.415175.647.0.pdf" length="0" rel="enclosure" /><updated>2025-11-13T00:00:00-08:00</updated></entry><entry><title>Entry #646 in Kadrey v. Meta Platforms, Inc., 3:23-cv-03417</title><link href="https://www.courtlistener.com/docket/67569326/kadrey-v-meta-platforms-inc/?order_by=desc#entry-646" rel="alternate" /><published>2025-11-11T00:00:00-08:00</published><id>https://www.courtlistener.com/docket/67569326/kadrey-v-meta-platforms-inc/?order_by=desc#entry-646</id><summary type="html">Letter from Counsel for Meta Regarding Docket 644. (Hartnett, Kathleen) (Filed on 11/11/2025) (Entered: 11/11/2025)</summary><link href="https://storage.courtlistener.com/recap/gov.uscourts.cand.415175/gov.uscourts.cand.415175.646.0.pdf" length="0" rel="enclosure" /><updated>2025-11-11T00:00:00-08:00</updated></entry><entry><title>Entry #645 in Kadrey v. Meta Platforms, Inc., 3:23-cv-03417</title><link href="https://www.courtlistener.com/docket/67569326/kadrey-v-meta-platforms-inc/?order_by=desc#entry-645" rel="alternate" /><published>2025-11-11T00:00:00-08:00</published><id>https://www.courtlistener.com/docket/67569326/kadrey-v-meta-platforms-inc/?order_by=desc#entry-645</id><summary type="html">TRANSCRIPT ORDER for proceedings held on 11/10/2025 before Judge Vince Chhabria by Ta-Nehisi Coates, Junot Diaz, Christopher Farnsworth, Christopher Golden, Andrew Sean Greer, David Henry Hwang, Richard Kadrey, Matthew Klam, Laura Lippman, Sarah Silverman, Rachel Louise Snyder, Lysa TerKeurst, Jacqueline Woodson, for Court Reporter Kendra Steppler. (Stein, Joshua) (Filed on 11/11/2025) (Entered: 11/11/2025)</summary><link href="https://ecf.cand.uscourts.gov/doc1/035026420668?caseid=415175" length="0" rel="enclosure" /><updated>2025-11-11T00:00:00-08:00</updated></entry><entry><title>Entry #644 in Kadrey v. Meta Platforms, Inc., 3:23-cv-03417</title><link href="https://www.courtlistener.com/docket/67569326/kadrey-v-meta-platforms-inc/?order_by=desc#entry-644" rel="alternate" /><published>2025-11-11T00:00:00-08:00</published><id>https://www.courtlistener.com/docket/67569326/kadrey-v-meta-platforms-inc/?order_by=desc#entry-644</id><summary type="html">Letter from Plaintiffs' Interim Lead Counsel Regarding Dkt. 635 . (Attachments: # 1 Exhibit 1)(Pritt, Maxwell) (Filed on 11/11/2025) (Entered: 11/11/2025)</summary><link href="https://storage.courtlistener.com/recap/gov.uscourts.cand.415175/gov.uscourts.cand.415175.644.0.pdf" length="0" rel="enclosure" /><updated>2025-11-11T00:00:00-08:00</updated></entry><entry><title>Minute entry from 2025-11-10 in Kadrey v. Meta Platforms, Inc., 3:23-cv-03417</title><link href="https://www.courtlistener.com/docket/67569326/kadrey-v-meta-platforms-inc/" rel="alternate" /><published>2025-11-10T00:00:00-08:00</published><id>https://www.courtlistener.com/docket/67569326/kadrey-v-meta-platforms-inc/?order_by=desc#minute-entry-443716462</id><summary type="html">Motion Hearing</summary><updated>2025-11-10T00:00:00-08:00</updated></entry><entry><title>Entry #643 in Kadrey v. Meta Platforms, Inc., 3:23-cv-03417</title><link href="https://www.courtlistener.com/docket/67569326/kadrey-v-meta-platforms-inc/?order_by=desc#entry-643" rel="alternate" /><published>2025-11-10T00:00:00-08:00</published><id>https://www.courtlistener.com/docket/67569326/kadrey-v-meta-platforms-inc/?order_by=desc#entry-643</id><summary type="html">Minute Entry for proceedings held before Judge Vince Chhabria: Motion Hearing held on 11/10/2025 re 635 ADMINISTRATIVE MOTION Requesting Leave to Obtain Limited Additional Discovery filed by Christopher Farnsworth, Sarah Silverman, Junot Diaz, Christopher Golden, Laura Lippman, Lysa TerKeurst, Matthew Klam, Ta-Nehisi Coates, Andrew Sean Greer, Jacqueline Woodson, Richard Kadrey, David Henry Hwang, Rachel Louise Snyder. Oral arguments made and heard. Court to issue written ruling. Total Time in Court: 59 minutes. Court Reporter: Kendra Steppler. Plaintiff Attorney: Maxwell Pritt, Daniel Hutchinson, Margaux Poueymirou. Defendant Attorney: Kathleen Hartnett, Bobby Ghajar, Anna Stapleton, Phillip Morton, Elizabeth Stameshkin. (This is a text-only entry generated by the court. There is no document associated with this entry.) (bxs, COURT STAFF) (Date Filed: 11/10/2025) (Entered: 11/10/2025)</summary><link href="https://ecf.cand.uscourts.gov/cgi-bin/show_case_doc?643,415175,,," length="0" rel="enclosure" /><updated>2025-11-10T00:00:00-08:00</updated></entry><entry><title>Minute entry from 2025-11-07 in Kadrey v. Meta Platforms, Inc., 3:23-cv-03417</title><link href="https://www.courtlistener.com/docket/67569326/kadrey-v-meta-platforms-inc/" rel="alternate" /><published>2025-11-07T00:00:00-08:00</published><id>https://www.courtlistener.com/docket/67569326/kadrey-v-meta-platforms-inc/?order_by=desc#minute-entry-443490075</id><summary type="html">Clerk's Notice AND ~Util - Set Motion and Deadlines/Hearings</summary><updated>2025-11-07T00:00:00-08:00</updated></entry><entry><title>Entry #642 in Kadrey v. Meta Platforms, Inc., 3:23-cv-03417</title><link href="https://www.courtlistener.com/docket/67569326/kadrey-v-meta-platforms-inc/?order_by=desc#entry-642" rel="alternate" /><published>2025-11-07T00:00:00-08:00</published><id>https://www.courtlistener.com/docket/67569326/kadrey-v-meta-platforms-inc/?order_by=desc#entry-642</id><summary type="html">CLERK'S NOTICE ADVANCING MOTION HEARING RE 635 . 635 ADMINISTRATIVE MOTION Requesting Leave to Obtain Limited Additional Discovery Hearing advanced to 11/10/2025 at 02:00 PM in San Francisco, Courtroom 04, 17th Floor before Judge Vince Chhabria. (This is a text-only entry generated by the court. There is no document associated with this entry.)(bxs, COURT STAFF) (Filed on 11/7/2025) (Entered: 11/07/2025)</summary><link href="https://ecf.cand.uscourts.gov/cgi-bin/show_case_doc?642,415175,,," length="0" rel="enclosure" /><updated>2025-11-07T00:00:00-08:00</updated></entry><entry><title>Entry #641 in Kadrey v. Meta Platforms, Inc., 3:23-cv-03417</title><link href="https://www.courtlistener.com/docket/67569326/kadrey-v-meta-platforms-inc/?order_by=desc#entry-641" rel="alternate" /><published>2025-11-06T00:00:00-08:00</published><id>https://www.courtlistener.com/docket/67569326/kadrey-v-meta-platforms-inc/?order_by=desc#entry-641</id><summary type="html">Order by Judge Vince Chhabria granting 638 Stipulation Modifying Scheduling Order. Designation of Experts due by 12/19/2025. Rebuttal Reports due by 1/22/2026. Expert Depositions Deadline 02/06/2026. Brief #1 due 2/12/2026. Brief #2 due 3/12/2026. Brief #3 due 4/2/2026. Brief #4 due 4/16/2026. Motion Hearing reset to 4/30/2026 at 10:00 AM in San Francisco, Courtroom 04, 17th Floor before Judge Vince Chhabria. (bxs, COURT STAFF) (Filed on 11/6/2025) (Entered: 11/06/2025)</summary><link href="https://storage.courtlistener.com/recap/gov.uscourts.cand.415175/gov.uscourts.cand.415175.641.0.pdf" length="0" rel="enclosure" /><updated>2025-11-06T00:00:00-08:00</updated></entry><entry><title>Minute entry from 2025-11-06 in Kadrey v. Meta Platforms, Inc., 3:23-cv-03417</title><link href="https://www.courtlistener.com/docket/67569326/kadrey-v-meta-platforms-inc/" rel="alternate" /><published>2025-11-06T00:00:00-08:00</published><id>https://www.courtlistener.com/docket/67569326/kadrey-v-meta-platforms-inc/?order_by=desc#minute-entry-443347515</id><summary type="html">Clerk's Notice AND ~Util - Set Motion and Deadlines/Hearings</summary><updated>2025-11-06T00:00:00-08:00</updated></entry><entry><title>Entry #640 in Kadrey v. Meta Platforms, Inc., 3:23-cv-03417</title><link href="https://www.courtlistener.com/docket/67569326/kadrey-v-meta-platforms-inc/?order_by=desc#entry-640" rel="alternate" /><published>2025-11-06T00:00:00-08:00</published><id>https://www.courtlistener.com/docket/67569326/kadrey-v-meta-platforms-inc/?order_by=desc#entry-640</id><summary type="html">CLERK'S NOTICE SCHEDULING MOTION HEARING RE 635 Administrative Motion Requesting Leave to Obtain Limited Additional Discovery. Motion Hearing set for 11/12/2025 at 10:00 AM in San Francisco, Courtroom 04, 17th Floor before Judge Vince Chhabria. (This is a text-only entry generated by the court. There is no document associated with this entry.)(bxs, COURT STAFF) (Filed on 11/6/2025) (Entered: 11/06/2025)</summary><link href="https://ecf.cand.uscourts.gov/cgi-bin/show_case_doc?640,415175,,," length="0" rel="enclosure" /><updated>2025-11-06T00:00:00-08:00</updated></entry><entry><title>Entry #639 in Kadrey v. Meta Platforms, Inc., 3:23-cv-03417</title><link href="https://www.courtlistener.com/docket/67569326/kadrey-v-meta-platforms-inc/?order_by=desc#entry-639" rel="alternate" /><published>2025-11-05T00:00:00-08:00</published><id>https://www.courtlistener.com/docket/67569326/kadrey-v-meta-platforms-inc/?order_by=desc#entry-639</id><summary type="html">Declaration of Michelle Woodhouse in Support of 636 Administrative Motion to Consider Whether Another Party's Material Should Be Sealed re Plaintiffs' Administrative Motion Requesting Leave to Obtain Limited Additional Discovery filed byMeta Platforms, Inc.. (Attachments: # 1 Exhibit 1, # 2 Exhibit 2, # 3 Exhibit 3, # 4 Exhibit 4)(Related document(s) 636 ) (Stameshkin, Elizabeth) (Filed on 11/5/2025) (Entered: 11/05/2025)</summary><link href="https://storage.courtlistener.com/recap/gov.uscourts.cand.415175/gov.uscourts.cand.415175.639.0.pdf" length="0" rel="enclosure" /><updated>2025-11-05T00:00:00-08:00</updated></entry><entry><title>Entry #638 in Kadrey v. Meta Platforms, Inc., 3:23-cv-03417</title><link href="https://www.courtlistener.com/docket/67569326/kadrey-v-meta-platforms-inc/?order_by=desc#entry-638" rel="alternate" /><published>2025-11-05T00:00:00-08:00</published><id>https://www.courtlistener.com/docket/67569326/kadrey-v-meta-platforms-inc/?order_by=desc#entry-638</id><summary type="html">STIPULATION WITH PROPOSED ORDER re 628 Order, Modifying Scheduling Order filed by Ta-Nehisi Coates, Junot Diaz, Christopher Farnsworth, Christopher Golden, Andrew Sean Greer, David Henry Hwang, Richard Kadrey, Matthew Klam, Laura Lippman, Sarah Silverman, Rachel Louise Snyder, Lysa TerKeurst, Jacqueline Woodson. (Pritt, Maxwell) (Filed on 11/5/2025) (Entered: 11/05/2025)</summary><link href="https://storage.courtlistener.com/recap/gov.uscourts.cand.415175/gov.uscourts.cand.415175.638.0.pdf" length="0" rel="enclosure" /><updated>2025-11-05T00:00:00-08:00</updated></entry><entry><title>Entry #637 in Kadrey v. Meta Platforms, Inc., 3:23-cv-03417</title><link href="https://www.courtlistener.com/docket/67569326/kadrey-v-meta-platforms-inc/?order_by=desc#entry-637" rel="alternate" /><published>2025-11-03T00:00:00-08:00</published><id>https://www.courtlistener.com/docket/67569326/kadrey-v-meta-platforms-inc/?order_by=desc#entry-637</id><summary type="html">OPPOSITION/RESPONSE (re 635 ADMINISTRATIVE MOTION Requesting Leave to Obtain Limited Additional Discovery ) filed byMeta Platforms, Inc.. (Attachments: # 1 Declaration Elizabeth L. Stameshkin, # 2 Exhibit 1, # 3 Proposed Order)(Hartnett, Kathleen) (Filed on 11/3/2025) (Entered: 11/03/2025)</summary><link href="https://storage.courtlistener.com/recap/gov.uscourts.cand.415175/gov.uscourts.cand.415175.637.0.pdf" length="0" rel="enclosure" /><updated>2025-11-03T00:00:00-08:00</updated></entry><entry><title>Entry #636 in Kadrey v. Meta Platforms, Inc., 3:23-cv-03417</title><link href="https://www.courtlistener.com/docket/67569326/kadrey-v-meta-platforms-inc/?order_by=desc#entry-636" rel="alternate" /><published>2025-10-29T00:00:00-07:00</published><id>https://www.courtlistener.com/docket/67569326/kadrey-v-meta-platforms-inc/?order_by=desc#entry-636</id><summary type="html">Administrative Motion to Consider Whether Another Party's Material Should Be Sealed re Plaintiffs' Administrative Motion Requesting Leave to Obtain Limited Additional Discovery filed by Ta-Nehisi Coates, Junot Diaz, Christopher Farnsworth, Christopher Golden, Andrew Sean Greer, David Henry Hwang, Richard Kadrey, Matthew Klam, Laura Lippman, Sarah Silverman, Rachel Louise Snyder, Lysa TerKeurst, Jacqueline Woodson. (Attachments: # 1 Administrative Motion Requesting Leave to Obtain Limited Additional Discovery, # 2 Declaration of David R. Choffnes, # 3 Appendix A, # 4 Appendix B, # 5 Appendix C, # 6 Exhibit A, # 7 Exhibit B, # 8 Exhibit C, # 9 Exhibit D, # 10 Exhibit E, # 11 Exhibit G, # 12 Exhibit I, # 13 Exhibit J, # 14 Exhibit K, # 15 Exhibit L, # 16 Exhibit M, # 17 Exhibit P, # 18 Exhibit Q, # 19 Exhibit R, # 20 Exhibit S, # 21 Exhibit T, # 22 Exhibit U, # 23 Proposed Order)(Pritt, Maxwell) (Filed on 10/29/2025) (Entered: 10/29/2025)</summary><link href="https://ecf.cand.uscourts.gov/doc1/035026374064?caseid=415175" length="0" rel="enclosure" /><updated>2025-10-29T00:00:00-07:00</updated></entry><entry><title>Entry #635 in Kadrey v. Meta Platforms, Inc., 3:23-cv-03417</title><link href="https://www.courtlistener.com/docket/67569326/kadrey-v-meta-platforms-inc/?order_by=desc#entry-635" rel="alternate" /><published>2025-10-29T00:00:00-07:00</published><id>https://www.courtlistener.com/docket/67569326/kadrey-v-meta-platforms-inc/?order_by=desc#entry-635</id><summary type="html">ADMINISTRATIVE MOTION Requesting Leave to Obtain Limited Additional Discovery filed by Ta-Nehisi Coates, Junot Diaz, Christopher Farnsworth, Christopher Golden, Andrew Sean Greer, David Henry Hwang, Richard Kadrey, Matthew Klam, Laura Lippman, Sarah Silverman, Rachel Louise Snyder, Lysa TerKeurst, Jacqueline Woodson. Responses due by 11/3/2025. (Attachments: # 1 Declaration of David R. Choffnes, # 2 Declaration of Maxwell V. Pritt, # 3 Appendix A, # 4 Appendix B, # 5 Appendix C, # 6 Exhibit A, # 7 Exhibit B, # 8 Exhibit C, # 9 Exhibit D, # 10 Exhibit E, # 11 Exhibit F, # 12 Exhibit G, # 13 Exhibit H, # 14 Exhibit I, # 15 Exhibit J, # 16 Exhibit K, # 17 Exhibit L, # 18 Exhibit M, # 19 Exhibit N, # 20 Exhibit O, # 21 Exhibit P, # 22 Exhibit Q, # 23 Exhibit R, # 24 Exhibit S, # 25 Exhibit T, # 26 Exhibit U, # 27 Proposed Order)(Pritt, Maxwell) (Filed on 10/29/2025) (Entered: 10/29/2025)</summary><link href="https://storage.courtlistener.com/recap/gov.uscourts.cand.415175/gov.uscourts.cand.415175.635.0.pdf" length="0" rel="enclosure" /><updated>2025-10-29T00:00:00-07:00</updated></entry><entry><title>Entry #634 in Kadrey v. Meta Platforms, Inc., 3:23-cv-03417</title><link href="https://www.courtlistener.com/docket/67569326/kadrey-v-meta-platforms-inc/?order_by=desc#entry-634" rel="alternate" /><published>2025-10-10T00:00:00-07:00</published><id>https://www.courtlistener.com/docket/67569326/kadrey-v-meta-platforms-inc/?order_by=desc#entry-634</id><summary type="html">ORDER. The Court apologizes for missing the stipulation to toll the deadline to seek relief from Judge Hixson's order. The Court would like Meta to file a response to the motion for relief, but it may make sense to wait for Meta to complete its investigation of the Strike Three issue. The parties should confer and submit another stipulation about the schedule for adjudication of the plaintiffs' motion for relief. Signed by Judge Vince Chhabria on 10/10/25. (This is a text-only entry generated by the court. There is no document associated with this entry.) (vclc2, COURT STAFF) (Filed on 10/10/2025) (Entered: 10/10/2025)</summary><link href="https://ecf.cand.uscourts.gov/cgi-bin/show_case_doc?634,415175,,," length="0" rel="enclosure" /><updated>2025-10-10T00:00:00-07:00</updated></entry><entry><title>Minute entry from 2025-10-10 in Kadrey v. Meta Platforms, Inc., 3:23-cv-03417</title><link href="https://www.courtlistener.com/docket/67569326/kadrey-v-meta-platforms-inc/" rel="alternate" /><published>2025-10-10T00:00:00-07:00</published><id>https://www.courtlistener.com/docket/67569326/kadrey-v-meta-platforms-inc/?order_by=desc#minute-entry-440642975</id><summary type="html">Order</summary><updated>2025-10-10T00:00:00-07:00</updated></entry></feed>