<?xml version='1.0' encoding='utf-8'?>
<feed xmlns="http://www.w3.org/2005/Atom" xml:lang="en-us"><title>Docket updates for N.Z. v. Fenix International Limited, 8:24-cv-01655</title><link href="https://michaellee50.github.io/CourtListener/feed-N.Z.-Fenix-International.xml" rel="self" type="application/atom+xml" /><link href="https://www.courtlistener.com/" rel="alternate" /><link href="https://www.courtlistener.com/docket/68990373/feed/" rel="self" /><id>https://www.courtlistener.com/</id><updated>2026-02-27T00:00:00-08:00</updated><author><name>Free Law Project</name><email>feeds@courtlistener.com</email></author><rights>Created for the public domain by Free Law Project</rights><entry><title>Entry #237 in N.Z. v. Fenix International Limited, 8:24-cv-01655</title><link href="https://www.courtlistener.com/docket/68990373/nz-v-fenix-international-limited/?order_by=desc#entry-237" rel="alternate" /><published>2026-02-27T00:00:00-08:00</published><id>https://www.courtlistener.com/docket/68990373/nz-v-fenix-international-limited/?order_by=desc#entry-237</id><summary type="html">Notice of Appearance or Withdrawal of Counsel: for attorney Younjin Lee counsel for Defendant Verge Agency Inc. Younjin (Jennifer) Lee is no longer counsel of record for the aforementioned party in this case for the reason indicated in the G-123 Notice. Filed by Defendant Verge Agency, Inc.. (Lee, Younjin) (Entered: 02/27/2026)</summary><link href="https://ecf.cacd.uscourts.gov/doc1/031047109501?caseid=935040" length="0" rel="enclosure" /><updated>2026-02-27T00:00:00-08:00</updated></entry><entry><title>Entry #236 in N.Z. v. Fenix International Limited, 8:24-cv-01655</title><link href="https://www.courtlistener.com/docket/68990373/nz-v-fenix-international-limited/?order_by=desc#entry-236" rel="alternate" /><published>2026-02-19T00:00:00-08:00</published><id>https://www.courtlistener.com/docket/68990373/nz-v-fenix-international-limited/?order_by=desc#entry-236</id><summary type="html">OPPOSITION to NOTICE OF MOTION AND MOTION to Dismiss Second Amended Complaint for Lack of Subject Matter and Personal Jurisdiction, Failure to State a Claim, and Improper Venue 225 filed by Plaintiffs A. L., B. L., R. M., S. M., N. Z.. (Carey, Robert) (Entered: 02/19/2026)</summary><link href="https://ecf.cacd.uscourts.gov/doc1/031047044261?caseid=935040" length="0" rel="enclosure" /><updated>2026-02-19T00:00:00-08:00</updated></entry><entry><title>Entry #235 in N.Z. v. Fenix International Limited, 8:24-cv-01655</title><link href="https://www.courtlistener.com/docket/68990373/nz-v-fenix-international-limited/?order_by=desc#entry-235" rel="alternate" /><published>2026-02-19T00:00:00-08:00</published><id>https://www.courtlistener.com/docket/68990373/nz-v-fenix-international-limited/?order_by=desc#entry-235</id><summary type="html">OPPOSITION to NOTICE OF MOTION AND MOTION to Dismiss Second Amended Class Action Complaint 228 filed by Plaintiffs A. L., B. L., R. M., S. M., N. Z.. (Carey, Robert) (Entered: 02/19/2026)</summary><link href="https://ecf.cacd.uscourts.gov/doc1/031047043914?caseid=935040" length="0" rel="enclosure" /><updated>2026-02-19T00:00:00-08:00</updated></entry><entry><title>Entry #234 in N.Z. v. Fenix International Limited, 8:24-cv-01655</title><link href="https://www.courtlistener.com/docket/68990373/nz-v-fenix-international-limited/?order_by=desc#entry-234" rel="alternate" /><published>2026-02-19T00:00:00-08:00</published><id>https://www.courtlistener.com/docket/68990373/nz-v-fenix-international-limited/?order_by=desc#entry-234</id><summary type="html">OPPOSITION to NOTICE OF MOTION AND MOTION to Dismiss Second Amended Complaint 227 filed by Plaintiffs A. L., B. L., R. M., S. M., N. Z.. (Carey, Robert) (Entered: 02/19/2026)</summary><link href="https://ecf.cacd.uscourts.gov/doc1/031047043759?caseid=935040" length="0" rel="enclosure" /><updated>2026-02-19T00:00:00-08:00</updated></entry><entry><title>Entry #233 in N.Z. v. Fenix International Limited, 8:24-cv-01655</title><link href="https://www.courtlistener.com/docket/68990373/nz-v-fenix-international-limited/?order_by=desc#entry-233" rel="alternate" /><published>2026-02-19T00:00:00-08:00</published><id>https://www.courtlistener.com/docket/68990373/nz-v-fenix-international-limited/?order_by=desc#entry-233</id><summary type="html">OPPOSITION to NOTICE OF MOTION AND MOTION to Dismiss Plaintiffs' Second Amended Class Action Complaint 230, NOTICE OF MOTION AND MOTION to Dismiss Defendant Content X Inc pursuant to Rule 12(b)(6) 231, NOTICE OF MOTION AND MOTION to Dismiss Second Amended Class Action Complaint 229 filed by Plaintiffs A. L., B. L., R. M., S. M., N. Z.. (Attachments: # 1 Declaration of Michella A. Kras)(Carey, Robert) (Entered: 02/19/2026)</summary><link href="https://ecf.cacd.uscourts.gov/doc1/031047043720?caseid=935040" length="0" rel="enclosure" /><updated>2026-02-19T00:00:00-08:00</updated></entry><entry><title>Entry #232 in N.Z. v. Fenix International Limited, 8:24-cv-01655</title><link href="https://www.courtlistener.com/docket/68990373/nz-v-fenix-international-limited/?order_by=desc#entry-232" rel="alternate" /><published>2026-01-24T00:00:00-08:00</published><id>https://www.courtlistener.com/docket/68990373/nz-v-fenix-international-limited/?order_by=desc#entry-232</id><summary type="html">JOINDER in NOTICE OF MOTION AND MOTION to Dismiss Second Amended Complaint 227, NOTICE OF MOTION AND MOTION to Dismiss Second Amended Class Action Complaint 228, NOTICE OF MOTION AND MOTION to Dismiss Plaintiffs' Second Amended Class Action Complaint 230, NOTICE OF MOTION AND MOTION to Dismiss Second Amended Complaint for Lack of Subject Matter and Personal Jurisdiction, Failure to State a Claim, and Improper Venue 225, NOTICE OF MOTION AND MOTION to Dismiss Second Amended Class Action Complaint 229 filed by Defendant Content X Inc. (Kumar, Nithin) (Entered: 01/24/2026)</summary><link href="https://ecf.cacd.uscourts.gov/doc1/031046829932?caseid=935040" length="0" rel="enclosure" /><updated>2026-01-24T00:00:00-08:00</updated></entry><entry><title>Entry #231 in N.Z. v. Fenix International Limited, 8:24-cv-01655</title><link href="https://www.courtlistener.com/docket/68990373/nz-v-fenix-international-limited/?order_by=desc#entry-231" rel="alternate" /><published>2026-01-24T00:00:00-08:00</published><id>https://www.courtlistener.com/docket/68990373/nz-v-fenix-international-limited/?order_by=desc#entry-231</id><summary type="html">NOTICE OF MOTION AND MOTION to Dismiss Defendant Content X Inc pursuant to Rule 12(b)(6) filed by Defendant Content X Inc. Motion set for hearing on 3/19/2026 at 10:00 AM before Judge Fred W. Slaughter. (Kumar, Nithin) (Entered: 01/24/2026)</summary><link href="https://ecf.cacd.uscourts.gov/doc1/031046829916?caseid=935040" length="0" rel="enclosure" /><updated>2026-01-24T00:00:00-08:00</updated></entry><entry><title>Entry #230 in N.Z. v. Fenix International Limited, 8:24-cv-01655</title><link href="https://www.courtlistener.com/docket/68990373/nz-v-fenix-international-limited/?order_by=desc#entry-230" rel="alternate" /><published>2026-01-23T00:00:00-08:00</published><id>https://www.courtlistener.com/docket/68990373/nz-v-fenix-international-limited/?order_by=desc#entry-230</id><summary type="html">NOTICE OF MOTION AND MOTION to Dismiss Plaintiffs' Second Amended Class Action Complaint filed by Defendants Behave Agency LLC, Unruly Agency LLC. Motion set for hearing on 3/19/2026 at 10:00 AM before Judge Fred W. Slaughter. (Attachments: # 1 Joinder in Motions of Codefendants and Specially Appearing Codefendants to Dismiss Plaintiffs' Second Amended Class Action Complaint, # 2 Proposed Order) (Jacobs, Matthew) (Entered: 01/23/2026)</summary><link href="https://ecf.cacd.uscourts.gov/doc1/031046828747?caseid=935040" length="0" rel="enclosure" /><updated>2026-01-23T00:00:00-08:00</updated></entry><entry><title>Entry #229 in N.Z. v. Fenix International Limited, 8:24-cv-01655</title><link href="https://www.courtlistener.com/docket/68990373/nz-v-fenix-international-limited/?order_by=desc#entry-229" rel="alternate" /><published>2026-01-23T00:00:00-08:00</published><id>https://www.courtlistener.com/docket/68990373/nz-v-fenix-international-limited/?order_by=desc#entry-229</id><summary type="html">NOTICE OF MOTION AND MOTION to Dismiss Second Amended Class Action Complaint filed by Defendant Verge Agency Inc. (Attachments: # 1 Proposed Order) (Lee, Younjin) (Entered: 01/23/2026)</summary><link href="https://ecf.cacd.uscourts.gov/doc1/031046828239?caseid=935040" length="0" rel="enclosure" /><updated>2026-01-23T00:00:00-08:00</updated></entry><entry><title>Entry #228 in N.Z. v. Fenix International Limited, 8:24-cv-01655</title><link href="https://www.courtlistener.com/docket/68990373/nz-v-fenix-international-limited/?order_by=desc#entry-228" rel="alternate" /><published>2026-01-23T00:00:00-08:00</published><id>https://www.courtlistener.com/docket/68990373/nz-v-fenix-international-limited/?order_by=desc#entry-228</id><summary type="html">NOTICE OF MOTION AND MOTION to Dismiss Second Amended Class Action Complaint filed by Defendant Moxy Management. Motion set for hearing on 3/19/2026 at 10:00 AM before Judge Fred W. Slaughter. (Rocos, Oliver) (Entered: 01/23/2026)</summary><link href="https://ecf.cacd.uscourts.gov/doc1/031046827498?caseid=935040" length="0" rel="enclosure" /><updated>2026-01-23T00:00:00-08:00</updated></entry><entry><title>Entry #227 in N.Z. v. Fenix International Limited, 8:24-cv-01655</title><link href="https://www.courtlistener.com/docket/68990373/nz-v-fenix-international-limited/?order_by=desc#entry-227" rel="alternate" /><published>2026-01-23T00:00:00-08:00</published><id>https://www.courtlistener.com/docket/68990373/nz-v-fenix-international-limited/?order_by=desc#entry-227</id><summary type="html">NOTICE OF MOTION AND MOTION to Dismiss Second Amended Complaint filed by Defendant Elite Creators LLC. Motion set for hearing on 3/19/2026 at 10:00 AM before Judge Fred W. Slaughter. (Jordan, Trinity) (Entered: 01/23/2026)</summary><link href="https://ecf.cacd.uscourts.gov/doc1/031046825402?caseid=935040" length="0" rel="enclosure" /><updated>2026-01-23T00:00:00-08:00</updated></entry><entry><title>Entry #226 in N.Z. v. Fenix International Limited, 8:24-cv-01655</title><link href="https://www.courtlistener.com/docket/68990373/nz-v-fenix-international-limited/?order_by=desc#entry-226" rel="alternate" /><published>2026-01-23T00:00:00-08:00</published><id>https://www.courtlistener.com/docket/68990373/nz-v-fenix-international-limited/?order_by=desc#entry-226</id><summary type="html">DECLARATION of Raza Rasheed in Support of NOTICE OF MOTION AND MOTION to Dismiss Second Amended Complaint for Lack of Subject Matter and Personal Jurisdiction, Failure to State a Claim, and Improper Venue 225 filed by Defendants Fenix International Limited, Fenix Internet LLC. (Rasheed, Raza) (Entered: 01/23/2026)</summary><link href="https://ecf.cacd.uscourts.gov/doc1/031046823408?caseid=935040" length="0" rel="enclosure" /><updated>2026-01-23T00:00:00-08:00</updated></entry><entry><title>Entry #225 in N.Z. v. Fenix International Limited, 8:24-cv-01655</title><link href="https://www.courtlistener.com/docket/68990373/nz-v-fenix-international-limited/?order_by=desc#entry-225" rel="alternate" /><published>2026-01-23T00:00:00-08:00</published><id>https://www.courtlistener.com/docket/68990373/nz-v-fenix-international-limited/?order_by=desc#entry-225</id><summary type="html">NOTICE OF MOTION AND MOTION to Dismiss Second Amended Complaint for Lack of Subject Matter and Personal Jurisdiction, Failure to State a Claim, and Improper Venue filed by Specially Appearing Defendants Fenix International Limited, Fenix Internet LLC. Motion set for hearing on 3/19/2026 at 10:00 AM before Judge Fred W. Slaughter. (Attachments: # 1 Proposed Order) (Russell, Jason) (Entered: 01/23/2026)</summary><link href="https://ecf.cacd.uscourts.gov/doc1/031046823231?caseid=935040" length="0" rel="enclosure" /><updated>2026-01-23T00:00:00-08:00</updated></entry><entry><title>Entry #224 in N.Z. v. Fenix International Limited, 8:24-cv-01655</title><link href="https://www.courtlistener.com/docket/68990373/nz-v-fenix-international-limited/?order_by=desc#entry-224" rel="alternate" /><published>2026-01-21T00:00:00-08:00</published><id>https://www.courtlistener.com/docket/68990373/nz-v-fenix-international-limited/?order_by=desc#entry-224</id><summary type="html">Notice of Appearance or Withdrawal of Counsel: for attorney Bill L. Clawges counsel for Defendant Moxy Management. Adding Bill L. Clawges as counsel of record for Moxy Management for the reason indicated in the G-123 Notice. Filed by defendant Moxy Management. (Attorney Bill L. Clawges added to party Moxy Management(pty:dft))(Clawges, Bill) (Entered: 01/21/2026)</summary><link href="https://ecf.cacd.uscourts.gov/doc1/031046801503?caseid=935040" length="0" rel="enclosure" /><updated>2026-01-21T00:00:00-08:00</updated></entry><entry><title>Entry #223 in N.Z. v. Fenix International Limited, 8:24-cv-01655</title><link href="https://www.courtlistener.com/docket/68990373/nz-v-fenix-international-limited/?order_by=desc#entry-223" rel="alternate" /><published>2026-01-12T00:00:00-08:00</published><id>https://www.courtlistener.com/docket/68990373/nz-v-fenix-international-limited/?order_by=desc#entry-223</id><summary type="html">ORDER by Judge Fred W. Slaughter, RE Joint Stipulation Extending Time to Respond to Second Amended Complaint and Setting Briefing Schedule 222 . NOTE: CHANGES MADE BY COURT. Defendants shall file any motions to dismiss (Defendants' Motions) to the Second Amended Complaint on or before January 23, 2026; SEE DOCUMENT FOR FURTHER INFORMATION. (twdb) (Entered: 01/12/2026)</summary><link href="https://ecf.cacd.uscourts.gov/doc1/031046731771?caseid=935040" length="0" rel="enclosure" /><updated>2026-01-12T00:00:00-08:00</updated></entry><entry><title>Entry #222 in N.Z. v. Fenix International Limited, 8:24-cv-01655</title><link href="https://www.courtlistener.com/docket/68990373/nz-v-fenix-international-limited/?order_by=desc#entry-222" rel="alternate" /><published>2026-01-09T00:00:00-08:00</published><id>https://www.courtlistener.com/docket/68990373/nz-v-fenix-international-limited/?order_by=desc#entry-222</id><summary type="html">Joint STIPULATION for Extension of Time to File Response to Second Amended Complaint and Setting Briefing Schedule filed by Specially Appearing Defendants Fenix International Limited, Fenix Internet LLC. (Attachments: # 1 Proposed Order)(Russell, Jason) (Entered: 01/09/2026)</summary><link href="https://ecf.cacd.uscourts.gov/doc1/031046718289?caseid=935040" length="0" rel="enclosure" /><updated>2026-01-09T00:00:00-08:00</updated></entry><entry><title>Entry #221 in N.Z. v. Fenix International Limited, 8:24-cv-01655</title><link href="https://www.courtlistener.com/docket/68990373/nz-v-fenix-international-limited/?order_by=desc#entry-221" rel="alternate" /><published>2026-01-09T00:00:00-08:00</published><id>https://www.courtlistener.com/docket/68990373/nz-v-fenix-international-limited/?order_by=desc#entry-221</id><summary type="html">SEALED DOCUMENT Second Amended Class Action Complaint re Amended Complaint/Petition 218, APPLICATION to file document Second Amended Class Action Complaint under seal 216, Order on Motion for Leave to File Document Under Seal, 220 filed by Plaintiffs A. L., B. L., R. M., S. M., N. Z.. (Attachments: # 1 Proof of Service)(Carey, Robert) (Entered: 01/09/2026)</summary><link href="https://ecf.cacd.uscourts.gov/doc1/031046717012?caseid=935040" length="0" rel="enclosure" /><updated>2026-01-09T00:00:00-08:00</updated></entry><entry><title>Entry #220 in N.Z. v. Fenix International Limited, 8:24-cv-01655</title><link href="https://www.courtlistener.com/docket/68990373/nz-v-fenix-international-limited/?order_by=desc#entry-220" rel="alternate" /><published>2026-01-08T00:00:00-08:00</published><id>https://www.courtlistener.com/docket/68990373/nz-v-fenix-international-limited/?order_by=desc#entry-220</id><summary type="html">ORDER RE PLAINTIFFS' APPLICATION TO FILE UNDER SEAL SECOND AMENDED CLASS ACTION COMPLAINT by Judge Fred W. Slaughter: Granting 216 APPLICATION. NOTE: CHANGES MADE BY COURT. Plaintiffs shall file the unredacted Second Amended Class Action Complaint, (Dkt. 217-1), as a new and separate filing on or before January 15, 2026, under seal pursuant to Central District of California Local Civil Rule 79-5.2.2(c). (twdb) (Entered: 01/09/2026)</summary><link href="https://ecf.cacd.uscourts.gov/doc1/031046714576?caseid=935040" length="0" rel="enclosure" /><updated>2026-01-08T00:00:00-08:00</updated></entry><entry><title>Entry #219 in N.Z. v. Fenix International Limited, 8:24-cv-01655</title><link href="https://www.courtlistener.com/docket/68990373/nz-v-fenix-international-limited/?order_by=desc#entry-219" rel="alternate" /><published>2026-01-06T00:00:00-08:00</published><id>https://www.courtlistener.com/docket/68990373/nz-v-fenix-international-limited/?order_by=desc#entry-219</id><summary type="html">DECLARATION of Or-el S. Vaknin in Support of APPLICATION to file document Second Amended Class Action Complaint under seal 216 filed by Defendants Fenix International Limited, Fenix Internet LLC. (Vaknin, Or-el) (Entered: 01/06/2026)</summary><link href="https://ecf.cacd.uscourts.gov/doc1/031046686559?caseid=935040" length="0" rel="enclosure" /><updated>2026-01-06T00:00:00-08:00</updated></entry><entry><title>Entry #218 in N.Z. v. Fenix International Limited, 8:24-cv-01655</title><link href="https://www.courtlistener.com/docket/68990373/nz-v-fenix-international-limited/?order_by=desc#entry-218" rel="alternate" /><published>2026-01-02T00:00:00-08:00</published><id>https://www.courtlistener.com/docket/68990373/nz-v-fenix-international-limited/?order_by=desc#entry-218</id><summary type="html">[PUBLIC REDACTED VERSION] SECOND AMENDED COMPLAINT against Defendants All Defendants amending Complaint (Attorney Civil Case Opening), 1, Amended Complaint/Petition 118, filed by Plaintiffs B. L., R. M., S. M., N. Z., A. L.(Carey, Robert) (Entered: 01/02/2026)</summary><link href="https://ecf.cacd.uscourts.gov/doc1/031046665891?caseid=935040" length="0" rel="enclosure" /><updated>2026-01-02T00:00:00-08:00</updated></entry><entry><title>Entry #217 in N.Z. v. Fenix International Limited, 8:24-cv-01655</title><link href="https://www.courtlistener.com/docket/68990373/nz-v-fenix-international-limited/?order_by=desc#entry-217" rel="alternate" /><published>2026-01-02T00:00:00-08:00</published><id>https://www.courtlistener.com/docket/68990373/nz-v-fenix-international-limited/?order_by=desc#entry-217</id><summary type="html">SEALED DECLARATION IN SUPPORT OF APPLICATION to file document Second Amended Class Action Complaint under seal 216 filed by Plaintiffs A. L., B. L., R. M., S. M., N. Z.. (Attachments: # 1 Unredacted Document Second Amended Class Action Complaint)(Carey, Robert) (Entered: 01/02/2026)</summary><link href="https://ecf.cacd.uscourts.gov/doc1/031046665871?caseid=935040" length="0" rel="enclosure" /><updated>2026-01-02T00:00:00-08:00</updated></entry><entry><title>Entry #216 in N.Z. v. Fenix International Limited, 8:24-cv-01655</title><link href="https://www.courtlistener.com/docket/68990373/nz-v-fenix-international-limited/?order_by=desc#entry-216" rel="alternate" /><published>2026-01-02T00:00:00-08:00</published><id>https://www.courtlistener.com/docket/68990373/nz-v-fenix-international-limited/?order_by=desc#entry-216</id><summary type="html">APPLICATION to file document Second Amended Class Action Complaint under seal filed by Plaintiffs A. L., B. L., R. M., S. M., N. Z.. (Attachments: # 1 Redacted Document Second Amended Class Action Complaint, # 2 Proposed Order, # 3 Proof of Service)(Carey, Robert) (Entered: 01/02/2026)</summary><link href="https://ecf.cacd.uscourts.gov/doc1/031046665845?caseid=935040" length="0" rel="enclosure" /><updated>2026-01-02T00:00:00-08:00</updated></entry><entry><title>Entry #215 in N.Z. v. Fenix International Limited, 8:24-cv-01655</title><link href="https://www.courtlistener.com/docket/68990373/nz-v-fenix-international-limited/?order_by=desc#entry-215" rel="alternate" /><published>2025-12-23T00:00:00-08:00</published><id>https://www.courtlistener.com/docket/68990373/nz-v-fenix-international-limited/?order_by=desc#entry-215</id><summary type="html">STATUS REPORT regarding corrective and preventive measures taken because of AI misuse filed by Plaintiffs A. L., B. L., R. M., S. M., N. Z.. (Carey, Robert) (Entered: 12/23/2025)</summary><link href="https://ecf.cacd.uscourts.gov/doc1/031046617360?caseid=935040" length="0" rel="enclosure" /><updated>2025-12-23T00:00:00-08:00</updated></entry><entry><title>Entry #214 in N.Z. v. Fenix International Limited, 8:24-cv-01655</title><link href="https://www.courtlistener.com/docket/68990373/nz-v-fenix-international-limited/?order_by=desc#entry-214" rel="alternate" /><published>2025-12-22T00:00:00-08:00</published><id>https://www.courtlistener.com/docket/68990373/nz-v-fenix-international-limited/?order_by=desc#entry-214</id><summary type="html">FINANCIAL ENTRY: Received $1000.00 into the registry of the Court from CELESTE BOYD. Re: Order on Motion for Leave to File Document, 207 . Receipt number 2244. (ec) (Entered: 12/22/2025)</summary><link href="https://ecf.cacd.uscourts.gov/cgi-bin/show_case_doc?214,935040,,," length="0" rel="enclosure" /><updated>2025-12-22T00:00:00-08:00</updated></entry><entry><title>Entry #213 in N.Z. v. Fenix International Limited, 8:24-cv-01655</title><link href="https://www.courtlistener.com/docket/68990373/nz-v-fenix-international-limited/?order_by=desc#entry-213" rel="alternate" /><published>2025-12-22T00:00:00-08:00</published><id>https://www.courtlistener.com/docket/68990373/nz-v-fenix-international-limited/?order_by=desc#entry-213</id><summary type="html">FINANCIAL ENTRY: Received $1000.00 into the registry of the Court from CELESTE BOYD. Re: Order on Motion for Leave to File Document, 207 . Receipt number 2245. (ec) (Entered: 12/22/2025)</summary><link href="https://ecf.cacd.uscourts.gov/cgi-bin/show_case_doc?213,935040,,," length="0" rel="enclosure" /><updated>2025-12-22T00:00:00-08:00</updated></entry><entry><title>Minute entry from 2025-12-22 in N.Z. v. Fenix International Limited, 8:24-cv-01655</title><link href="https://www.courtlistener.com/docket/68990373/N.Z.-v-Fenix-International-Limited/" rel="alternate" /><published>2025-12-22T00:00:00-08:00</published><id>https://www.courtlistener.com/docket/68990373/nz-v-fenix-international-limited/?order_by=desc#minute-entry-448058257</id><summary type="html">Financial Entry</summary><updated>2025-12-22T00:00:00-08:00</updated></entry><entry><title>Entry #212 in N.Z. v. Fenix International Limited, 8:24-cv-01655</title><link href="https://www.courtlistener.com/docket/68990373/nz-v-fenix-international-limited/?order_by=desc#entry-212" rel="alternate" /><published>2025-12-22T00:00:00-08:00</published><id>https://www.courtlistener.com/docket/68990373/nz-v-fenix-international-limited/?order_by=desc#entry-212</id><summary type="html">FINANCIAL ENTRY: Received $1000.00 into the registry of the Court from CELESTE BOYD. Re: Order on Motion for Leave to File Document, 207 . Receipt number 2246. (ec) (Entered: 12/22/2025)</summary><link href="https://ecf.cacd.uscourts.gov/cgi-bin/show_case_doc?212,935040,,," length="0" rel="enclosure" /><updated>2025-12-22T00:00:00-08:00</updated></entry><entry><title>Minute entry from 2025-12-17 in N.Z. v. Fenix International Limited, 8:24-cv-01655</title><link href="https://www.courtlistener.com/docket/68990373/N.Z.-v-Fenix-International-Limited/" rel="alternate" /><published>2025-12-17T00:00:00-08:00</published><id>https://www.courtlistener.com/docket/68990373/nz-v-fenix-international-limited/?order_by=desc#minute-entry-447533300</id><summary type="html">Financial Entry</summary><updated>2025-12-17T00:00:00-08:00</updated></entry><entry><title>Entry #211 in N.Z. v. Fenix International Limited, 8:24-cv-01655</title><link href="https://www.courtlistener.com/docket/68990373/nz-v-fenix-international-limited/?order_by=desc#entry-211" rel="alternate" /><published>2025-12-17T00:00:00-08:00</published><id>https://www.courtlistener.com/docket/68990373/nz-v-fenix-international-limited/?order_by=desc#entry-211</id><summary type="html">FINANCIAL ENTRY: Received $10,000.00 into the registry of the Court from HAGENS BERMAN SOBOL SHAPIRO LLP. Re: Order on Motion for Leave to File Document, 207 . Receipt number 2231. (ec) (Entered: 12/17/2025)</summary><link href="https://ecf.cacd.uscourts.gov/cgi-bin/show_case_doc?211,935040,,," length="0" rel="enclosure" /><updated>2025-12-17T00:00:00-08:00</updated></entry><entry><title>Entry #210 in N.Z. v. Fenix International Limited, 8:24-cv-01655</title><link href="https://www.courtlistener.com/docket/68990373/nz-v-fenix-international-limited/?order_by=desc#entry-210" rel="alternate" /><published>2025-12-16T00:00:00-08:00</published><id>https://www.courtlistener.com/docket/68990373/nz-v-fenix-international-limited/?order_by=desc#entry-210</id><summary type="html">Notice of Appearance or Withdrawal of Counsel: for attorney Shana H Khader counsel for Plaintiffs A. L., B. L., R. M., S. M., N. Z.. Shana H. Khader is no longer counsel of record for the aforementioned party in this case for the reason indicated in the G-123 Notice. Filed by Plaintiffs N.Z., R.M., B.L., S.M., and A.L.. (Khader, Shana) (Entered: 12/16/2025)</summary><link href="https://ecf.cacd.uscourts.gov/doc1/031046561432?caseid=935040" length="0" rel="enclosure" /><updated>2025-12-16T00:00:00-08:00</updated></entry></feed>