<?xml version='1.0' encoding='utf-8'?>
<feed xmlns="http://www.w3.org/2005/Atom" xml:lang="en-us"><title>Docket updates for Laborers Local 235 Pension Fund v. Rentokil Initial PLC, 2:24-cv-02932</title><link href="https://michaellee50.github.io/CourtListener/feed-Laborers-Local-235-Pension-Fund-v-Rentokil-Initial.xml" rel="self" type="application/atom+xml" /><link href="https://www.courtlistener.com/" rel="alternate" /><link href="https://www.courtlistener.com/docket/69417248/feed/" rel="self" /><id>https://www.courtlistener.com/</id><updated>2025-08-11T00:00:00-07:00</updated><author><name>Free Law Project</name><email>feeds@courtlistener.com</email></author><rights>Created for the public domain by Free Law Project</rights><entry><title>Entry #44 in Laborers Local 235 Pension Fund v. Rentokil Initial PLC, 2:24-cv-02932</title><link href="https://www.courtlistener.com/docket/69417248/laborers-local-235-pension-fund-v-rentokil-initial-plc/?order_by=desc#entry-44" rel="alternate" /><published>2025-08-11T00:00:00-07:00</published><id>https://www.courtlistener.com/docket/69417248/laborers-local-235-pension-fund-v-rentokil-initial-plc/?order_by=desc#entry-44</id><summary type="html">REPLY to Response to Motion re 41 Response in Opposition to Motion to Dismiss for Failure to State a Claim filed by All Defendants. (Mendro, Jason) (Entered: 08/11/2025)</summary><link href="https://ecf.tnwd.uscourts.gov/doc1/17105772590?caseid=104413" length="0" rel="enclosure" /><updated>2025-08-11T00:00:00-07:00</updated></entry><entry><title>Entry #43 in Laborers Local 235 Pension Fund v. Rentokil Initial PLC, 2:24-cv-02932</title><link href="https://www.courtlistener.com/docket/69417248/laborers-local-235-pension-fund-v-rentokil-initial-plc/?order_by=desc#entry-43" rel="alternate" /><published>2025-07-28T00:00:00-07:00</published><id>https://www.courtlistener.com/docket/69417248/laborers-local-235-pension-fund-v-rentokil-initial-plc/?order_by=desc#entry-43</id><summary type="html">ORDER GRANTING DEFENDANTS 42 MOTION REGARDING PAGE LIMITS FOR MOTION TO DISMISS REPLY BRIEFING. Signed by Chief Judge Sheryl H. Lipman on 7/28/2025. (shl) (Entered: 07/28/2025)</summary><link href="https://ecf.tnwd.uscourts.gov/doc1/17105762306?caseid=104413" length="0" rel="enclosure" /><updated>2025-07-28T00:00:00-07:00</updated></entry><entry><title>Entry #42 in Laborers Local 235 Pension Fund v. Rentokil Initial PLC, 2:24-cv-02932</title><link href="https://www.courtlistener.com/docket/69417248/laborers-local-235-pension-fund-v-rentokil-initial-plc/?order_by=desc#entry-42" rel="alternate" /><published>2025-07-28T00:00:00-07:00</published><id>https://www.courtlistener.com/docket/69417248/laborers-local-235-pension-fund-v-rentokil-initial-plc/?order_by=desc#entry-42</id><summary type="html">MOTION for Leave to File Excess Pages for Motion to Dismiss Reply Briefing by All Defendants. (Mendro, Jason) (Entered: 07/28/2025)</summary><link href="https://ecf.tnwd.uscourts.gov/doc1/17105761143?caseid=104413" length="0" rel="enclosure" /><updated>2025-07-28T00:00:00-07:00</updated></entry><entry><title>Entry #41 in Laborers Local 235 Pension Fund v. Rentokil Initial PLC, 2:24-cv-02932</title><link href="https://www.courtlistener.com/docket/69417248/laborers-local-235-pension-fund-v-rentokil-initial-plc/?order_by=desc#entry-41" rel="alternate" /><published>2025-07-09T00:00:00-07:00</published><id>https://www.courtlistener.com/docket/69417248/laborers-local-235-pension-fund-v-rentokil-initial-plc/?order_by=desc#entry-41</id><summary type="html">RESPONSE in Opposition re 38 MOTION TO DISMISS FOR FAILURE TO STATE A CLAIM AMENDED CLASS ACTION COMPLAINT FOR VIOLATIONS OF THE FEDERAL SECURITIES LAWS filed by Laborers Local #235 Pension Fund. (Stranch, J.) (Entered: 07/09/2025)</summary><link href="https://ecf.tnwd.uscourts.gov/doc1/17105747106?caseid=104413" length="0" rel="enclosure" /><updated>2025-07-09T00:00:00-07:00</updated></entry><entry><title>Entry #40 in Laborers Local 235 Pension Fund v. Rentokil Initial PLC, 2:24-cv-02932</title><link href="https://www.courtlistener.com/docket/69417248/laborers-local-235-pension-fund-v-rentokil-initial-plc/?order_by=desc#entry-40" rel="alternate" /><published>2025-05-23T00:00:00-07:00</published><id>https://www.courtlistener.com/docket/69417248/laborers-local-235-pension-fund-v-rentokil-initial-plc/?order_by=desc#entry-40</id><summary type="html">AFFIDAVIT re 39 MOTION for Judicial Notice re 38 MOTION TO DISMISS FOR FAILURE TO STATE A CLAIM, 38 MOTION TO DISMISS FOR FAILURE TO STATE A CLAIM by Stuart M. Ingall-Tombs, Bradley S. Paulsen, Andrew M. Ransom, Rentokil Initial PLC. (Percopo, Lissa) (Entered: 05/23/2025)</summary><link href="https://ecf.tnwd.uscourts.gov/doc1/17105712422?caseid=104413" length="0" rel="enclosure" /><updated>2025-05-23T00:00:00-07:00</updated></entry><entry><title>Entry #39 in Laborers Local 235 Pension Fund v. Rentokil Initial PLC, 2:24-cv-02932</title><link href="https://www.courtlistener.com/docket/69417248/laborers-local-235-pension-fund-v-rentokil-initial-plc/?order_by=desc#entry-39" rel="alternate" /><published>2025-05-23T00:00:00-07:00</published><id>https://www.courtlistener.com/docket/69417248/laborers-local-235-pension-fund-v-rentokil-initial-plc/?order_by=desc#entry-39</id><summary type="html">MOTION for Judicial Notice re 38 MOTION TO DISMISS FOR FAILURE TO STATE A CLAIM by Stuart M. Ingall-Tombs, Bradley S. Paulsen, Andrew M. Ransom, Rentokil Initial PLC. (Mendro, Jason) (Entered: 05/23/2025)</summary><link href="https://ecf.tnwd.uscourts.gov/doc1/17105712414?caseid=104413" length="0" rel="enclosure" /><updated>2025-05-23T00:00:00-07:00</updated></entry><entry><title>Entry #38 in Laborers Local 235 Pension Fund v. Rentokil Initial PLC, 2:24-cv-02932</title><link href="https://www.courtlistener.com/docket/69417248/laborers-local-235-pension-fund-v-rentokil-initial-plc/?order_by=desc#entry-38" rel="alternate" /><published>2025-05-23T00:00:00-07:00</published><id>https://www.courtlistener.com/docket/69417248/laborers-local-235-pension-fund-v-rentokil-initial-plc/?order_by=desc#entry-38</id><summary type="html">MOTION TO DISMISS FOR FAILURE TO STATE A CLAIM by Stuart M. Ingall-Tombs, Bradley S. Paulsen, Andrew M. Ransom, Rentokil Initial PLC. (Attachments: # 1 Memorandum in Support, # 2 Exhibit 1, # 3 Exhibit 2, # 4 Exhibit 3, # 5 Exhibit 4, # 6 Exhibit 5, # 7 Exhibit 6, # 8 Exhibit 7, # 9 Exhibit 8, # 10 Exhibit 9, # 11 Exhibit 10, # 12 Exhibit 11, # 13 Exhibit 12, # 14 Exhibit 13, # 15 Exhibit 14, # 16 Exhibit 15, # 17 Exhibit 16, # 18 Exhibit 17, # 19 Exhibit 18, # 20 Exhibit 19, # 21 Exhibit 20)(Mendro, Jason) (Entered: 05/23/2025)</summary><link href="https://ecf.tnwd.uscourts.gov/doc1/17105712390?caseid=104413" length="0" rel="enclosure" /><updated>2025-05-23T00:00:00-07:00</updated></entry><entry><title>Entry #37 in Laborers Local 235 Pension Fund v. Rentokil Initial PLC, 2:24-cv-02932</title><link href="https://www.courtlistener.com/docket/69417248/laborers-local-235-pension-fund-v-rentokil-initial-plc/?order_by=desc#entry-37" rel="alternate" /><published>2025-05-16T00:00:00-07:00</published><id>https://www.courtlistener.com/docket/69417248/laborers-local-235-pension-fund-v-rentokil-initial-plc/?order_by=desc#entry-37</id><summary type="html">ORDER GRANTING 36 MOTION REGARDING PAGE LIMITS FOR MOTION TO DISMISS BRIEFING. Signed by Chief Judge Sheryl H. Lipman on 5/16/2025. (shl) (Entered: 05/16/2025)</summary><link href="https://ecf.tnwd.uscourts.gov/doc1/17105707042?caseid=104413" length="0" rel="enclosure" /><updated>2025-05-16T00:00:00-07:00</updated></entry><entry><title>Entry #36 in Laborers Local 235 Pension Fund v. Rentokil Initial PLC, 2:24-cv-02932</title><link href="https://www.courtlistener.com/docket/69417248/laborers-local-235-pension-fund-v-rentokil-initial-plc/?order_by=desc#entry-36" rel="alternate" /><published>2025-05-15T00:00:00-07:00</published><id>https://www.courtlistener.com/docket/69417248/laborers-local-235-pension-fund-v-rentokil-initial-plc/?order_by=desc#entry-36</id><summary type="html">MOTION (Unopposed) REGARDING PAGE LIMITS FOR MOTION TO DISMISS BRIEFING proposed order submitted by Stuart M. Ingall-Tombs, Bradley S. Paulsen, Andrew M. Ransom, Rentokil Initial PLC. (Crawford, Robert) (Entered: 05/15/2025)</summary><link href="https://ecf.tnwd.uscourts.gov/doc1/17105705276?caseid=104413" length="0" rel="enclosure" /><updated>2025-05-15T00:00:00-07:00</updated></entry><entry><title>Entry #35 in Laborers Local 235 Pension Fund v. Rentokil Initial PLC, 2:24-cv-02932</title><link href="https://www.courtlistener.com/docket/69417248/laborers-local-235-pension-fund-v-rentokil-initial-plc/?order_by=desc#entry-35" rel="alternate" /><published>2025-04-11T00:00:00-07:00</published><id>https://www.courtlistener.com/docket/69417248/laborers-local-235-pension-fund-v-rentokil-initial-plc/?order_by=desc#entry-35</id><summary type="html">TEXT ONLY ORDER Granting 34 Motion for Leave to Appear Pro Hac Vice as to Lester R. Hooker. Signed by Chief Judge Sheryl H. Lipman on 4/11/2025. (shl) (Entered: 04/11/2025)</summary><link href="https://ecf.tnwd.uscourts.gov/cgi-bin/show_case_doc?35,104413,,," length="0" rel="enclosure" /><updated>2025-04-11T00:00:00-07:00</updated></entry><entry><title>Minute entry from 2025-04-11 in Laborers Local 235 Pension Fund v. Rentokil Initial PLC, 2:24-cv-02932</title><link href="https://www.courtlistener.com/docket/69417248/Laborers-Local-235-Pension-Fund-v-Rentokil-Initial-PLC/" rel="alternate" /><published>2025-04-11T00:00:00-07:00</published><id>https://www.courtlistener.com/docket/69417248/laborers-local-235-pension-fund-v-rentokil-initial-plc/?order_by=desc#minute-entry-422169728</id><summary type="html">Order on Motion for Leave to Appear Pro Hac Vice</summary><updated>2025-04-11T00:00:00-07:00</updated></entry><entry><title>Entry #34 in Laborers Local 235 Pension Fund v. Rentokil Initial PLC, 2:24-cv-02932</title><link href="https://www.courtlistener.com/docket/69417248/laborers-local-235-pension-fund-v-rentokil-initial-plc/?order_by=desc#entry-34" rel="alternate" /><published>2025-04-11T00:00:00-07:00</published><id>https://www.courtlistener.com/docket/69417248/laborers-local-235-pension-fund-v-rentokil-initial-plc/?order_by=desc#entry-34</id><summary type="html">MOTION for Leave to Appear Pro Hac Vice (Filing fee $ 150 receipt number ATNWDC-4662765) by City of Birmingham Retirement and Relief System. (Attachments: # 1 Exhibit Certificate of Good Standing (NY), # 2 Exhibit Certificate of Good Standing (S.D. Fla.))(Hooker, Lester) (Entered: 04/11/2025)</summary><link href="https://ecf.tnwd.uscourts.gov/doc1/17105676492?caseid=104413" length="0" rel="enclosure" /><updated>2025-04-11T00:00:00-07:00</updated></entry><entry><title>Entry #33 in Laborers Local 235 Pension Fund v. Rentokil Initial PLC, 2:24-cv-02932</title><link href="https://www.courtlistener.com/docket/69417248/laborers-local-235-pension-fund-v-rentokil-initial-plc/?order_by=desc#entry-33" rel="alternate" /><published>2025-04-08T00:00:00-07:00</published><id>https://www.courtlistener.com/docket/69417248/laborers-local-235-pension-fund-v-rentokil-initial-plc/?order_by=desc#entry-33</id><summary type="html">AMENDED COMPLAINT Amended Class Action Complaint against All Defendants All Defendants., filed by City of Birmingham Retirement and Relief System.(Stranch, J.) (Entered: 04/08/2025)</summary><link href="https://storage.courtlistener.com/recap/gov.uscourts.tnwd.104413/gov.uscourts.tnwd.104413.33.0.pdf" length="0" rel="enclosure" /><updated>2025-04-08T00:00:00-07:00</updated></entry><entry><title>Entry #32 in Laborers Local 235 Pension Fund v. Rentokil Initial PLC, 2:24-cv-02932</title><link href="https://www.courtlistener.com/docket/69417248/laborers-local-235-pension-fund-v-rentokil-initial-plc/?order_by=desc#entry-32" rel="alternate" /><published>2025-03-07T00:00:00-08:00</published><id>https://www.courtlistener.com/docket/69417248/laborers-local-235-pension-fund-v-rentokil-initial-plc/?order_by=desc#entry-32</id><summary type="html">ORDER SETTING PRELIMINARY SCHEDULE. Signed by Chief Judge Sheryl H. Lipman on 3/7/2025. (shl) (Entered: 03/07/2025)</summary><link href="https://ecf.tnwd.uscourts.gov/doc1/17105648253?caseid=104413" length="0" rel="enclosure" /><updated>2025-03-07T00:00:00-08:00</updated></entry><entry><title>Minute entry from 2025-03-07 in Laborers Local 235 Pension Fund v. Rentokil Initial PLC, 2:24-cv-02932</title><link href="https://www.courtlistener.com/docket/69417248/Laborers-Local-235-Pension-Fund-v-Rentokil-Initial-PLC/" rel="alternate" /><published>2025-03-07T00:00:00-08:00</published><id>https://www.courtlistener.com/docket/69417248/laborers-local-235-pension-fund-v-rentokil-initial-plc/?order_by=desc#minute-entry-418645369</id><summary type="html">Scheduling Conference</summary><updated>2025-03-07T00:00:00-08:00</updated></entry><entry><title>Entry #31 in Laborers Local 235 Pension Fund v. Rentokil Initial PLC, 2:24-cv-02932</title><link href="https://www.courtlistener.com/docket/69417248/laborers-local-235-pension-fund-v-rentokil-initial-plc/?order_by=desc#entry-31" rel="alternate" /><published>2025-03-07T00:00:00-08:00</published><id>https://www.courtlistener.com/docket/69417248/laborers-local-235-pension-fund-v-rentokil-initial-plc/?order_by=desc#entry-31</id><summary type="html">Minute Entry for proceedings held before Chief Judge Sheryl H. Lipman: Microsoft Teams Video Scheduling Conference held on 3/7/2025. J. Gerard Stranch, IV and Joshua Saltzman appeared for the Plaintiffs. Jason J. Mendro, Lissa M. Percopo, and Robert L. Crawford appeared for the Defendants. Status of the case discussed. Deadline to file amended complaint is 4/8/2025. Deadline to file motion to dismiss is 5/23/2025. Plaintiffs' response to the motion to dismiss due 7/9/2025 and defendants' reply is due 8/11/2025. Parties will submit a protective order. Scheduling Order to be entered. (Court Reporter: Candace Covey) (mmm) (Entered: 03/07/2025)</summary><link href="https://ecf.tnwd.uscourts.gov/cgi-bin/show_case_doc?31,104413,,," length="0" rel="enclosure" /><updated>2025-03-07T00:00:00-08:00</updated></entry><entry><title>Entry #30 in Laborers Local 235 Pension Fund v. Rentokil Initial PLC, 2:24-cv-02932</title><link href="https://www.courtlistener.com/docket/69417248/laborers-local-235-pension-fund-v-rentokil-initial-plc/?order_by=desc#entry-30" rel="alternate" /><published>2025-02-27T00:00:00-08:00</published><id>https://www.courtlistener.com/docket/69417248/laborers-local-235-pension-fund-v-rentokil-initial-plc/?order_by=desc#entry-30</id><summary type="html">ORDER DENYING 28 JOINT MOTION REGARDING PROPOSED BRIEFING SCHEDULE AND INITIAL PRETRIAL CONFERENCE. Signed by Chief Judge Sheryl H. Lipman on 2/27/2025. (shl) (Entered: 02/27/2025)</summary><link href="https://ecf.tnwd.uscourts.gov/doc1/17105640254?caseid=104413" length="0" rel="enclosure" /><updated>2025-02-27T00:00:00-08:00</updated></entry><entry><title>Entry #29 in Laborers Local 235 Pension Fund v. Rentokil Initial PLC, 2:24-cv-02932</title><link href="https://www.courtlistener.com/docket/69417248/laborers-local-235-pension-fund-v-rentokil-initial-plc/?order_by=desc#entry-29" rel="alternate" /><published>2025-02-26T00:00:00-08:00</published><id>https://www.courtlistener.com/docket/69417248/laborers-local-235-pension-fund-v-rentokil-initial-plc/?order_by=desc#entry-29</id><summary type="html">NOTICE of Appearance by Lissa M. Percopo on behalf of All Defendants (Percopo, Lissa) (Entered: 02/26/2025)</summary><link href="https://ecf.tnwd.uscourts.gov/doc1/17105639292?caseid=104413" length="0" rel="enclosure" /><updated>2025-02-26T00:00:00-08:00</updated></entry><entry><title>Entry #28 in Laborers Local 235 Pension Fund v. Rentokil Initial PLC, 2:24-cv-02932</title><link href="https://www.courtlistener.com/docket/69417248/laborers-local-235-pension-fund-v-rentokil-initial-plc/?order_by=desc#entry-28" rel="alternate" /><published>2025-02-26T00:00:00-08:00</published><id>https://www.courtlistener.com/docket/69417248/laborers-local-235-pension-fund-v-rentokil-initial-plc/?order_by=desc#entry-28</id><summary type="html">Joint MOTION Regarding Proposed Briefing Schedule and Initial Pretrial Conference by All Defendants. (Mendro, Jason) (Entered: 02/26/2025)</summary><link href="https://ecf.tnwd.uscourts.gov/doc1/17105639286?caseid=104413" length="0" rel="enclosure" /><updated>2025-02-26T00:00:00-08:00</updated></entry><entry><title>Entry #27 in Laborers Local 235 Pension Fund v. Rentokil Initial PLC, 2:24-cv-02932</title><link href="https://www.courtlistener.com/docket/69417248/laborers-local-235-pension-fund-v-rentokil-initial-plc/?order_by=desc#entry-27" rel="alternate" /><published>2025-02-26T00:00:00-08:00</published><id>https://www.courtlistener.com/docket/69417248/laborers-local-235-pension-fund-v-rentokil-initial-plc/?order_by=desc#entry-27</id><summary type="html">NOTICE of Appearance by Jason J. Mendro on behalf of All Defendants (Mendro, Jason) (Entered: 02/26/2025)</summary><link href="https://ecf.tnwd.uscourts.gov/doc1/17105639257?caseid=104413" length="0" rel="enclosure" /><updated>2025-02-26T00:00:00-08:00</updated></entry><entry><title>Minute entry from 2025-02-25 in Laborers Local 235 Pension Fund v. Rentokil Initial PLC, 2:24-cv-02932</title><link href="https://www.courtlistener.com/docket/69417248/Laborers-Local-235-Pension-Fund-v-Rentokil-Initial-PLC/" rel="alternate" /><published>2025-02-25T00:00:00-08:00</published><id>https://www.courtlistener.com/docket/69417248/laborers-local-235-pension-fund-v-rentokil-initial-plc/?order_by=desc#minute-entry-417458306</id><summary type="html">Order on Motion for Leave to Appear Pro Hac Vice</summary><updated>2025-02-25T00:00:00-08:00</updated></entry><entry><title>Entry #26 in Laborers Local 235 Pension Fund v. Rentokil Initial PLC, 2:24-cv-02932</title><link href="https://www.courtlistener.com/docket/69417248/laborers-local-235-pension-fund-v-rentokil-initial-plc/?order_by=desc#entry-26" rel="alternate" /><published>2025-02-25T00:00:00-08:00</published><id>https://www.courtlistener.com/docket/69417248/laborers-local-235-pension-fund-v-rentokil-initial-plc/?order_by=desc#entry-26</id><summary type="html">TEXT ONLY ORDER granting 25 Motion for Leave to Appear Pro Hac Vice as to Jason J. Mendro. Signed by Chief Judge Sheryl H. Lipman on 2/25/2025. (shl) (Entered: 02/25/2025)</summary><link href="https://ecf.tnwd.uscourts.gov/cgi-bin/show_case_doc?26,104413,,," length="0" rel="enclosure" /><updated>2025-02-25T00:00:00-08:00</updated></entry><entry><title>Entry #25 in Laborers Local 235 Pension Fund v. Rentokil Initial PLC, 2:24-cv-02932</title><link href="https://www.courtlistener.com/docket/69417248/laborers-local-235-pension-fund-v-rentokil-initial-plc/?order_by=desc#entry-25" rel="alternate" /><published>2025-02-24T00:00:00-08:00</published><id>https://www.courtlistener.com/docket/69417248/laborers-local-235-pension-fund-v-rentokil-initial-plc/?order_by=desc#entry-25</id><summary type="html">MOTION for Leave to Appear Pro Hac Vice (Filing fee $ 150 receipt number ATNWDC-4623625) by Stuart M. Ingall-Tombs, Bradley S. Paulsen, Andrew M. Ransom, Rentokil Initial PLC. (Attachments: # 1 Exhibit - DC Bar Certificate of Good Standing, # 2 Exhibit - D.D.C. Certificate of Good Standing)(Mendro, Jason) (Entered: 02/24/2025)</summary><link href="https://ecf.tnwd.uscourts.gov/doc1/17105637155?caseid=104413" length="0" rel="enclosure" /><updated>2025-02-24T00:00:00-08:00</updated></entry><entry><title>Entry #24 in Laborers Local 235 Pension Fund v. Rentokil Initial PLC, 2:24-cv-02932</title><link href="https://www.courtlistener.com/docket/69417248/laborers-local-235-pension-fund-v-rentokil-initial-plc/?order_by=desc#entry-24" rel="alternate" /><published>2025-02-21T00:00:00-08:00</published><id>https://www.courtlistener.com/docket/69417248/laborers-local-235-pension-fund-v-rentokil-initial-plc/?order_by=desc#entry-24</id><summary type="html">TEXT ONLY ORDER granting 23 Motion for Leave to Appear Pro Hac Vice as to Joshua H. Saltzman. Signed by Chief Judge Sheryl H. Lipman on 2/21/2025. (shl) (Entered: 02/21/2025)</summary><link href="https://ecf.tnwd.uscourts.gov/cgi-bin/show_case_doc?24,104413,,," length="0" rel="enclosure" /><updated>2025-02-21T00:00:00-08:00</updated></entry><entry><title>Entry #23 in Laborers Local 235 Pension Fund v. Rentokil Initial PLC, 2:24-cv-02932</title><link href="https://www.courtlistener.com/docket/69417248/laborers-local-235-pension-fund-v-rentokil-initial-plc/?order_by=desc#entry-23" rel="alternate" /><published>2025-02-21T00:00:00-08:00</published><id>https://www.courtlistener.com/docket/69417248/laborers-local-235-pension-fund-v-rentokil-initial-plc/?order_by=desc#entry-23</id><summary type="html">MOTION for Leave to Appear Pro Hac Vice (Filing fee $ 150 receipt number ATNWDC-4621762) by City of Birmingham Retirement and Relief System. (Attachments: # 1 Exhibit Certificate of Good Standing (NY), # 2 Exhibit Certificate of Good Standing (S.D.N.Y.))(Saltzman, Joshua) (Entered: 02/21/2025)</summary><link href="https://ecf.tnwd.uscourts.gov/doc1/17105635338?caseid=104413" length="0" rel="enclosure" /><updated>2025-02-21T00:00:00-08:00</updated></entry><entry><title>Minute entry from 2025-02-21 in Laborers Local 235 Pension Fund v. Rentokil Initial PLC, 2:24-cv-02932</title><link href="https://www.courtlistener.com/docket/69417248/Laborers-Local-235-Pension-Fund-v-Rentokil-Initial-PLC/" rel="alternate" /><published>2025-02-21T00:00:00-08:00</published><id>https://www.courtlistener.com/docket/69417248/laborers-local-235-pension-fund-v-rentokil-initial-plc/?order_by=desc#minute-entry-417192861</id><summary type="html">Order on Motion for Leave to Appear Pro Hac Vice</summary><updated>2025-02-21T00:00:00-08:00</updated></entry><entry><title>Entry #22 in Laborers Local 235 Pension Fund v. Rentokil Initial PLC, 2:24-cv-02932</title><link href="https://www.courtlistener.com/docket/69417248/laborers-local-235-pension-fund-v-rentokil-initial-plc/?order_by=desc#entry-22" rel="alternate" /><published>2025-02-21T00:00:00-08:00</published><id>https://www.courtlistener.com/docket/69417248/laborers-local-235-pension-fund-v-rentokil-initial-plc/?order_by=desc#entry-22</id><summary type="html">TEXT ONLY ORDER granting 21 Motion for Leave to Appear Pro Hac Vice as to Lissa M. Percopo. Signed by Chief Judge Sheryl H. Lipman on 2/21/2025.(shl) (Entered: 02/21/2025)</summary><link href="https://ecf.tnwd.uscourts.gov/cgi-bin/show_case_doc?22,104413,,," length="0" rel="enclosure" /><updated>2025-02-21T00:00:00-08:00</updated></entry><entry><title>Entry #21 in Laborers Local 235 Pension Fund v. Rentokil Initial PLC, 2:24-cv-02932</title><link href="https://www.courtlistener.com/docket/69417248/laborers-local-235-pension-fund-v-rentokil-initial-plc/?order_by=desc#entry-21" rel="alternate" /><published>2025-02-20T00:00:00-08:00</published><id>https://www.courtlistener.com/docket/69417248/laborers-local-235-pension-fund-v-rentokil-initial-plc/?order_by=desc#entry-21</id><summary type="html">MOTION for Leave to Appear Pro Hac Vice, proposed order submitted (Filing fee $ 150 receipt number BTNWDC-4621320) by Stuart M. Ingall-Tombs, Bradley S. Paulsen, Andrew M. Ransom, Rentokil Initial PLC. (Attachments: # 1 Exhibit - NY Certificate of Good Standing, # 2 Exhibit - DC Bar Certificate of Good Standing, # 3 Exhibit - District of DC Certificate of Good Standing)(Percopo, Lissa) (Entered: 02/20/2025)</summary><link href="https://ecf.tnwd.uscourts.gov/doc1/17105634897?caseid=104413" length="0" rel="enclosure" /><updated>2025-02-20T00:00:00-08:00</updated></entry><entry><title>Entry #20 in Laborers Local 235 Pension Fund v. Rentokil Initial PLC, 2:24-cv-02932</title><link href="https://www.courtlistener.com/docket/69417248/laborers-local-235-pension-fund-v-rentokil-initial-plc/?order_by=desc#entry-20" rel="alternate" /><published>2025-02-18T00:00:00-08:00</published><id>https://www.courtlistener.com/docket/69417248/laborers-local-235-pension-fund-v-rentokil-initial-plc/?order_by=desc#entry-20</id><summary type="html">SETTING LETTER: A SCHEDULING CONFERENCE pursuant to Rule 16(b) of the Federal Rules of Civil Procedure has been SET for FRIDAY, MARCH 7, 2025 at 1:30 P.M. before Chief Judge Sheryl H. Lipman. The conference will be held via Microsoft Teams Video. A link to the video conference will be emailed to the attorneys prior to the setting.If the parties consent to have the case heard by the magistrate, please file your consent and this conference will be cancelled.Counsel should be prepared to discuss all pending motions.PLEASE REVIEW THE ATTACHED INSTRUCTIONS. The public may also access the video proceeding. If the public and/or media wish to attend in the video proceeding, please click on the following link to request access information: https://www.tnwd.uscourts.gov/videohearings. The access information will be delivered via email to the email address from which the request originated.Parties should consult the instructions for Joining a Meeting in Teams or Joining a Meeting Without a Teams Account. (mmm) (Entered: 02/18/2025)</summary><link href="https://ecf.tnwd.uscourts.gov/doc1/17105631936?caseid=104413" length="0" rel="enclosure" /><updated>2025-02-18T00:00:00-08:00</updated></entry><entry><title>Entry #19 in Laborers Local 235 Pension Fund v. Rentokil Initial PLC, 2:24-cv-02932</title><link href="https://www.courtlistener.com/docket/69417248/laborers-local-235-pension-fund-v-rentokil-initial-plc/?order_by=desc#entry-19" rel="alternate" /><published>2025-02-14T00:00:00-08:00</published><id>https://www.courtlistener.com/docket/69417248/laborers-local-235-pension-fund-v-rentokil-initial-plc/?order_by=desc#entry-19</id><summary type="html">ORDER GRANTING 16 JOINT MOTION REGARDING SERVICE AND CASE SCHEDULE. Signed by Chief Judge Sheryl H. Lipman on 2/14/2025. (shl) (Entered: 02/14/2025)</summary><link href="https://ecf.tnwd.uscourts.gov/doc1/17105630701?caseid=104413" length="0" rel="enclosure" /><updated>2025-02-14T00:00:00-08:00</updated></entry></feed>