<?xml version='1.0' encoding='utf-8'?>
<feed xmlns="http://www.w3.org/2005/Atom" xml:lang="en-us"><title>Docket updates for Brunner v. Fenix Internet, LLC, 1:25-cv-03244</title><link href="https://michaellee50.github.io/CourtListener/feed-Brunner-v-Fenix-Internet.xml" rel="self" type="application/atom+xml" /><link href="https://www.courtlistener.com/" rel="alternate" /><link href="https://www.courtlistener.com/docket/69799401/feed/" rel="self" /><id>https://www.courtlistener.com/</id><updated>2025-10-22T00:00:00-07:00</updated><author><name>Free Law Project</name><email>feeds@courtlistener.com</email></author><rights>Created for the public domain by Free Law Project</rights><entry><title>Entry #55 in Brunner v. Fenix Internet, LLC, 1:25-cv-03244</title><link href="https://www.courtlistener.com/docket/69799401/brunner-v-fenix-internet-llc/?order_by=desc#entry-55" rel="alternate" /><published>2025-10-22T00:00:00-07:00</published><id>https://www.courtlistener.com/docket/69799401/brunner-v-fenix-internet-llc/?order_by=desc#entry-55</id><summary type="html">Order on Motion to Stay</summary><link href="https://ecf.ilnd.uscourts.gov/doc1/067033420000?caseid=475530" length="0" rel="enclosure" /><updated>2025-10-22T00:00:00-07:00</updated></entry><entry><title>Entry #50 in Brunner v. Fenix Internet, LLC, 1:25-cv-03244</title><link href="https://www.courtlistener.com/docket/69799401/brunner-v-fenix-internet-llc/?order_by=desc#entry-50" rel="alternate" /><published>2025-10-14T00:00:00-07:00</published><id>https://www.courtlistener.com/docket/69799401/brunner-v-fenix-internet-llc/?order_by=desc#entry-50</id><summary type="html">Order on Motion to Appear Pro Hac Vice</summary><link href="https://ecf.ilnd.uscourts.gov/doc1/067033367886?caseid=475530" length="0" rel="enclosure" /><updated>2025-10-14T00:00:00-07:00</updated></entry><entry><title>Entry #49 in Brunner v. Fenix Internet, LLC, 1:25-cv-03244</title><link href="https://www.courtlistener.com/docket/69799401/brunner-v-fenix-internet-llc/?order_by=desc#entry-49" rel="alternate" /><published>2025-10-13T00:00:00-07:00</published><id>https://www.courtlistener.com/docket/69799401/brunner-v-fenix-internet-llc/?order_by=desc#entry-49</id><summary type="html">Appear Pro Hac Vice</summary><link href="https://storage.courtlistener.com/recap/gov.uscourts.ilnd.475530/gov.uscourts.ilnd.475530.49.0.pdf" length="0" rel="enclosure" /><updated>2025-10-13T00:00:00-07:00</updated></entry><entry><title>Entry #48 in Brunner v. Fenix Internet, LLC, 1:25-cv-03244</title><link href="https://www.courtlistener.com/docket/69799401/brunner-v-fenix-internet-llc/?order_by=desc#entry-48" rel="alternate" /><published>2025-10-02T00:00:00-07:00</published><id>https://www.courtlistener.com/docket/69799401/brunner-v-fenix-internet-llc/?order_by=desc#entry-48</id><summary type="html">set/reset hearings</summary><link href="https://ecf.ilnd.uscourts.gov/doc1/067033311356?caseid=475530" length="0" rel="enclosure" /><updated>2025-10-02T00:00:00-07:00</updated></entry><entry><title>Entry #47 in Brunner v. Fenix Internet, LLC, 1:25-cv-03244</title><link href="https://www.courtlistener.com/docket/69799401/brunner-v-fenix-internet-llc/?order_by=desc#entry-47" rel="alternate" /><published>2025-07-17T00:00:00-07:00</published><id>https://www.courtlistener.com/docket/69799401/brunner-v-fenix-internet-llc/?order_by=desc#entry-47</id><summary type="html">MINUTE entry before the Honorable John F. Kness: Case called at the parties' request for an in-person status hearing on 7/17/2025 following a hearing in related case (23-cv-6151). As discussed on the record, the parties proposed an acceptable schedule for the filing of motions to dismiss. Should the Court deny Defendants' pending motion to stay 31, any motions to dismiss must be filed 28 days after entry of the order adjudicating the motion to stay. Mailed notice. (exr, ) (Entered: 07/18/2025)</summary><link href="https://ecf.ilnd.uscourts.gov/doc1/067032867527?caseid=475530" length="0" rel="enclosure" /><updated>2025-07-17T00:00:00-07:00</updated></entry><entry><title>Entry #46 in Brunner v. Fenix Internet, LLC, 1:25-cv-03244</title><link href="https://www.courtlistener.com/docket/69799401/brunner-v-fenix-internet-llc/?order_by=desc#entry-46" rel="alternate" /><published>2025-07-14T00:00:00-07:00</published><id>https://www.courtlistener.com/docket/69799401/brunner-v-fenix-internet-llc/?order_by=desc#entry-46</id><summary type="html">MINUTE entry before the Honorable John F. Kness: Defendants' motion to stay 31 is now fully briefed and will be addressed promptly by separate order. Tomorrow's hearing is thus unnecessary and is therefore stricken; it will be reset as needed by separate order. Mailed notice (jfk) (Entered: 07/14/2025)</summary><link href="https://ecf.ilnd.uscourts.gov/doc1/067032839684?caseid=475530" length="0" rel="enclosure" /><updated>2025-07-14T00:00:00-07:00</updated></entry><entry><title>Entry #45 in Brunner v. Fenix Internet, LLC, 1:25-cv-03244</title><link href="https://www.courtlistener.com/docket/69799401/brunner-v-fenix-internet-llc/?order_by=desc#entry-45" rel="alternate" /><published>2025-07-07T00:00:00-07:00</published><id>https://www.courtlistener.com/docket/69799401/brunner-v-fenix-internet-llc/?order_by=desc#entry-45</id><summary type="html">MINUTE entry before the Honorable John F. Kness: The Court sets a telephonic status hearing for 7/15/2025 at 10:15 A.M. The parties are to use the following call-in number: 1-855-244-8681, Access Code: 2315 003 3696. The public and media representatives may have access to the hearing via the same number. Audio recording of the hearing is not permitted; violations of this prohibition may result in sanctions. Participants are directed to keep their device muted when they are not speaking. Mailed notice. (exr, ) (Entered: 07/07/2025)</summary><link href="https://ecf.ilnd.uscourts.gov/doc1/067032792332?caseid=475530" length="0" rel="enclosure" /><updated>2025-07-07T00:00:00-07:00</updated></entry><entry><title>Entry #44 in Brunner v. Fenix Internet, LLC, 1:25-cv-03244</title><link href="https://www.courtlistener.com/docket/69799401/brunner-v-fenix-internet-llc/?order_by=desc#entry-44" rel="alternate" /><published>2025-06-26T00:00:00-07:00</published><id>https://www.courtlistener.com/docket/69799401/brunner-v-fenix-internet-llc/?order_by=desc#entry-44</id><summary type="html">ATTORNEY Appearance for Plaintiffs M. Brunner, J. Fry by Troy M. Frederick (Frederick, Troy) (Entered: 06/26/2025)</summary><link href="https://storage.courtlistener.com/recap/gov.uscourts.ilnd.475530/gov.uscourts.ilnd.475530.44.0.pdf" length="0" rel="enclosure" /><updated>2025-06-26T00:00:00-07:00</updated></entry><entry><title>Entry #43 in Brunner v. Fenix Internet, LLC, 1:25-cv-03244</title><link href="https://www.courtlistener.com/docket/69799401/brunner-v-fenix-internet-llc/?order_by=desc#entry-43" rel="alternate" /><published>2025-06-18T00:00:00-07:00</published><id>https://www.courtlistener.com/docket/69799401/brunner-v-fenix-internet-llc/?order_by=desc#entry-43</id><summary type="html">MINUTE entry before the Honorable John F. Kness: Defendants' Agreed Motion for Extension of Time and Pages in Briefing on Defendants' Motion to Dismiss 41 is granted. Mailed notice. (exr, ) (Entered: 06/18/2025)</summary><link href="https://ecf.ilnd.uscourts.gov/doc1/067032694649?caseid=475530" length="0" rel="enclosure" /><updated>2025-06-18T00:00:00-07:00</updated></entry><entry><title>Entry #42 in Brunner v. Fenix Internet, LLC, 1:25-cv-03244</title><link href="https://www.courtlistener.com/docket/69799401/brunner-v-fenix-internet-llc/?order_by=desc#entry-42" rel="alternate" /><published>2025-06-17T00:00:00-07:00</published><id>https://www.courtlistener.com/docket/69799401/brunner-v-fenix-internet-llc/?order_by=desc#entry-42</id><summary type="html">REPLY by Defendants Fenix International Limited, Fenix Internet, LLC in Support of their 31 Motion to Stay (Kutcher, Matthew) (Entered: 06/17/2025)</summary><link href="https://ecf.ilnd.uscourts.gov/doc1/067032685324?caseid=475530" length="0" rel="enclosure" /><updated>2025-06-17T00:00:00-07:00</updated></entry><entry><title>Entry #41 in Brunner v. Fenix Internet, LLC, 1:25-cv-03244</title><link href="https://www.courtlistener.com/docket/69799401/brunner-v-fenix-internet-llc/?order_by=desc#entry-41" rel="alternate" /><published>2025-06-16T00:00:00-07:00</published><id>https://www.courtlistener.com/docket/69799401/brunner-v-fenix-internet-llc/?order_by=desc#entry-41</id><summary type="html">MOTION by Defendants Fenix International Limited, Fenix Internet, LLC for extension of time and pages in briefing on Defendants' Motion to Dismiss (Agreed) (Kutcher, Matthew) (Entered: 06/16/2025)</summary><link href="https://ecf.ilnd.uscourts.gov/doc1/067032681171?caseid=475530" length="0" rel="enclosure" /><updated>2025-06-16T00:00:00-07:00</updated></entry><entry><title>Entry #40 in Brunner v. Fenix Internet, LLC, 1:25-cv-03244</title><link href="https://www.courtlistener.com/docket/69799401/brunner-v-fenix-internet-llc/?order_by=desc#entry-40" rel="alternate" /><published>2025-06-12T00:00:00-07:00</published><id>https://www.courtlistener.com/docket/69799401/brunner-v-fenix-internet-llc/?order_by=desc#entry-40</id><summary type="html">MEMORANDUM by M. Brunner, J. Fry in Opposition to motion to stay 31 (Gold, Andrea) (Entered: 06/12/2025)</summary><link href="https://storage.courtlistener.com/recap/gov.uscourts.ilnd.475530/gov.uscourts.ilnd.475530.40.0.pdf" length="0" rel="enclosure" /><updated>2025-06-12T00:00:00-07:00</updated></entry><entry><title>Entry #39 in Brunner v. Fenix Internet, LLC, 1:25-cv-03244</title><link href="https://www.courtlistener.com/docket/69799401/brunner-v-fenix-internet-llc/?order_by=desc#entry-39" rel="alternate" /><published>2025-06-10T00:00:00-07:00</published><id>https://www.courtlistener.com/docket/69799401/brunner-v-fenix-internet-llc/?order_by=desc#entry-39</id><summary type="html">ATTORNEY Appearance for Plaintiffs M. Brunner, J. Fry by Robert Bruce Carey (Carey, Robert) (Entered: 06/10/2025)</summary><link href="https://storage.courtlistener.com/recap/gov.uscourts.ilnd.475530/gov.uscourts.ilnd.475530.39.0.pdf" length="0" rel="enclosure" /><updated>2025-06-10T00:00:00-07:00</updated></entry><entry><title>Entry #38 in Brunner v. Fenix Internet, LLC, 1:25-cv-03244</title><link href="https://www.courtlistener.com/docket/69799401/brunner-v-fenix-internet-llc/?order_by=desc#entry-38" rel="alternate" /><published>2025-06-09T00:00:00-07:00</published><id>https://www.courtlistener.com/docket/69799401/brunner-v-fenix-internet-llc/?order_by=desc#entry-38</id><summary type="html">MINUTE entry before the Honorable John F. Kness: Motions by counsel for leave to appear pro hac vice 35 and 36 are granted. Mailed notice. (exr, ) (Entered: 06/09/2025)</summary><link href="https://storage.courtlistener.com/recap/gov.uscourts.ilnd.475530/gov.uscourts.ilnd.475530.38.0.pdf" length="0" rel="enclosure" /><updated>2025-06-09T00:00:00-07:00</updated></entry><entry><title>Entry #37 in Brunner v. Fenix Internet, LLC, 1:25-cv-03244</title><link href="https://www.courtlistener.com/docket/69799401/brunner-v-fenix-internet-llc/?order_by=desc#entry-37" rel="alternate" /><published>2025-06-06T00:00:00-07:00</published><id>https://www.courtlistener.com/docket/69799401/brunner-v-fenix-internet-llc/?order_by=desc#entry-37</id><summary type="html">STATUS Report (Joint) Under Rule 26(f) pursuant to 30 Minute Order by Fenix International Limited, Fenix Internet, LLC (Kutcher, Matthew) (Entered: 06/06/2025)</summary><link href="https://storage.courtlistener.com/recap/gov.uscourts.ilnd.475530/gov.uscourts.ilnd.475530.37.0.pdf" length="0" rel="enclosure" /><updated>2025-06-06T00:00:00-07:00</updated></entry><entry><title>Entry #36 in Brunner v. Fenix Internet, LLC, 1:25-cv-03244</title><link href="https://www.courtlistener.com/docket/69799401/brunner-v-fenix-internet-llc/?order_by=desc#entry-36" rel="alternate" /><published>2025-06-05T00:00:00-07:00</published><id>https://www.courtlistener.com/docket/69799401/brunner-v-fenix-internet-llc/?order_by=desc#entry-36</id><summary type="html">MOTION for Leave to Appear Pro Hac Vice on behalf of M. Brunner by Andrew W. Knox; Filing fee $ 150, receipt number AILNDC-23582796. (Knox, Andrew) (Entered: 06/05/2025)</summary><link href="https://storage.courtlistener.com/recap/gov.uscourts.ilnd.475530/gov.uscourts.ilnd.475530.36.0.pdf" length="0" rel="enclosure" /><updated>2025-06-05T00:00:00-07:00</updated></entry><entry><title>Entry #35 in Brunner v. Fenix Internet, LLC, 1:25-cv-03244</title><link href="https://www.courtlistener.com/docket/69799401/brunner-v-fenix-internet-llc/?order_by=desc#entry-35" rel="alternate" /><published>2025-06-05T00:00:00-07:00</published><id>https://www.courtlistener.com/docket/69799401/brunner-v-fenix-internet-llc/?order_by=desc#entry-35</id><summary type="html">MOTION for Leave to Appear Pro Hac Vice on behalf of M. Brunner by Keith T Vernon; Filing fee $ 150, receipt number AILNDC-23582053. (Attachments: # 1 Supplement)(Vernon, Keith) (Entered: 06/05/2025)</summary><link href="https://storage.courtlistener.com/recap/gov.uscourts.ilnd.475530/gov.uscourts.ilnd.475530.35.0.pdf" length="0" rel="enclosure" /><updated>2025-06-05T00:00:00-07:00</updated></entry><entry><title>Entry #34 in Brunner v. Fenix Internet, LLC, 1:25-cv-03244</title><link href="https://www.courtlistener.com/docket/69799401/brunner-v-fenix-internet-llc/?order_by=desc#entry-34" rel="alternate" /><published>2025-06-04T00:00:00-07:00</published><id>https://www.courtlistener.com/docket/69799401/brunner-v-fenix-internet-llc/?order_by=desc#entry-34</id><summary type="html">MINUTE entry before the Honorable John F. Kness: The Court adopts the parties' agreed briefing schedule on Defendants' Opposed Motion to Stay 31 : Plaintiffs' response shall be filed on or before 6/12/2025. Defendants' reply, if any, shall be filed on or before 6/17/2025. Mailed notice. (exr, ) (Entered: 06/04/2025)</summary><link href="https://ecf.ilnd.uscourts.gov/doc1/067032614518?caseid=475530" length="0" rel="enclosure" /><updated>2025-06-04T00:00:00-07:00</updated></entry><entry><title>Entry #33 in Brunner v. Fenix Internet, LLC, 1:25-cv-03244</title><link href="https://www.courtlistener.com/docket/69799401/brunner-v-fenix-internet-llc/?order_by=desc#entry-33" rel="alternate" /><published>2025-06-02T00:00:00-07:00</published><id>https://www.courtlistener.com/docket/69799401/brunner-v-fenix-internet-llc/?order_by=desc#entry-33</id><summary type="html">Briefing Schedule re 31 STATEMENT by Fenix International Limited, Fenix Internet, LLC (Kutcher, Matthew) (Entered: 06/02/2025)</summary><link href="https://ecf.ilnd.uscourts.gov/doc1/067032598177?caseid=475530" length="0" rel="enclosure" /><updated>2025-06-02T00:00:00-07:00</updated></entry><entry><title>Entry #32 in Brunner v. Fenix Internet, LLC, 1:25-cv-03244</title><link href="https://www.courtlistener.com/docket/69799401/brunner-v-fenix-internet-llc/?order_by=desc#entry-32" rel="alternate" /><published>2025-06-02T00:00:00-07:00</published><id>https://www.courtlistener.com/docket/69799401/brunner-v-fenix-internet-llc/?order_by=desc#entry-32</id><summary type="html">MEMORANDUM by Fenix International Limited, Fenix Internet, LLC in support of motion to stay 31 (Kutcher, Matthew) (Entered: 06/02/2025)</summary><link href="https://ecf.ilnd.uscourts.gov/doc1/067032598110?caseid=475530" length="0" rel="enclosure" /><updated>2025-06-02T00:00:00-07:00</updated></entry><entry><title>Entry #31 in Brunner v. Fenix Internet, LLC, 1:25-cv-03244</title><link href="https://www.courtlistener.com/docket/69799401/brunner-v-fenix-internet-llc/?order_by=desc#entry-31" rel="alternate" /><published>2025-06-02T00:00:00-07:00</published><id>https://www.courtlistener.com/docket/69799401/brunner-v-fenix-internet-llc/?order_by=desc#entry-31</id><summary type="html">MOTION by Defendants Fenix International Limited, Fenix Internet, LLC to stay (Opposed) (Kutcher, Matthew) (Entered: 06/02/2025)</summary><link href="https://storage.courtlistener.com/recap/gov.uscourts.ilnd.475530/gov.uscourts.ilnd.475530.31.0.pdf" length="0" rel="enclosure" /><updated>2025-06-02T00:00:00-07:00</updated></entry><entry><title>Entry #30 in Brunner v. Fenix Internet, LLC, 1:25-cv-03244</title><link href="https://www.courtlistener.com/docket/69799401/brunner-v-fenix-internet-llc/?order_by=desc#entry-30" rel="alternate" /><published>2025-05-23T00:00:00-07:00</published><id>https://www.courtlistener.com/docket/69799401/brunner-v-fenix-internet-llc/?order_by=desc#entry-30</id><summary type="html">MINUTE entry before the Honorable John F. Kness: This case having been reassigned to Judge Kness, the initial status hearing set for 6/13/2025 is stricken. On or before 6/6/2025, the parties shall jointly complete and file on the docket a report that provides the information required by the Court's model Joint Initial Status Report, which can be found at https://www.ilnd.uscourts.gov/judge-info.aspx?Iu9/vqz23r5X7AkWx/nLtg== (see link entitled "Joint Initial Status Report"). Mailed notice. (exr, ) (Entered: 05/23/2025)</summary><link href="https://ecf.ilnd.uscourts.gov/doc1/067032548973?caseid=475530" length="0" rel="enclosure" /><updated>2025-05-23T00:00:00-07:00</updated></entry><entry><title>Entry #29 in Brunner v. Fenix Internet, LLC, 1:25-cv-03244</title><link href="https://www.courtlistener.com/docket/69799401/brunner-v-fenix-internet-llc/?order_by=desc#entry-29" rel="alternate" /><published>2025-05-05T00:00:00-07:00</published><id>https://www.courtlistener.com/docket/69799401/brunner-v-fenix-internet-llc/?order_by=desc#entry-29</id><summary type="html">SUMMONS Issued (Court Participant) as to Defendants Fenix International Limited, Fenix Internet, LLC (Attachments: # 1 Summons Issued)(mam, ) (Entered: 05/05/2025)</summary><link href="https://ecf.ilnd.uscourts.gov/doc1/067032426549?caseid=475530" length="0" rel="enclosure" /><updated>2025-05-05T00:00:00-07:00</updated></entry><entry><title>Entry #27 in Brunner v. Fenix Internet, LLC, 1:25-cv-03244</title><link href="https://www.courtlistener.com/docket/69799401/brunner-v-fenix-internet-llc/?order_by=desc#entry-27" rel="alternate" /><published>2025-05-01T00:00:00-07:00</published><id>https://www.courtlistener.com/docket/69799401/brunner-v-fenix-internet-llc/?order_by=desc#entry-27</id><summary type="html">WAIVER OF SERVICE returned executed by J. Fry, M. Brunner. J. Fry waiver sent on 4/10/2025, answer due 6/9/2025; M. Brunner waiver sent on 4/10/2025, answer due 6/9/2025. (Gold, Andrea) (Entered: 05/01/2025)</summary><link href="https://ecf.ilnd.uscourts.gov/doc1/067032416801?caseid=475530" length="0" rel="enclosure" /><updated>2025-05-01T00:00:00-07:00</updated></entry><entry><title>Entry #25 in Brunner v. Fenix Internet, LLC, 1:25-cv-03244</title><link href="https://www.courtlistener.com/docket/69799401/brunner-v-fenix-internet-llc/?order_by=desc#entry-25" rel="alternate" /><published>2025-04-28T00:00:00-07:00</published><id>https://www.courtlistener.com/docket/69799401/brunner-v-fenix-internet-llc/?order_by=desc#entry-25</id><summary type="html">MINUTE entry before the Honorable John F. Kness: Motion by counsel for leave to appear pro hac vice 24 is granted. Mailed notice. (exr, ) (Entered: 04/28/2025)</summary><link href="https://storage.courtlistener.com/recap/gov.uscourts.ilnd.475530/gov.uscourts.ilnd.475530.25.0.pdf" length="0" rel="enclosure" /><updated>2025-04-28T00:00:00-07:00</updated></entry><entry><title>Entry #24 in Brunner v. Fenix Internet, LLC, 1:25-cv-03244</title><link href="https://www.courtlistener.com/docket/69799401/brunner-v-fenix-internet-llc/?order_by=desc#entry-24" rel="alternate" /><published>2025-04-24T00:00:00-07:00</published><id>https://www.courtlistener.com/docket/69799401/brunner-v-fenix-internet-llc/?order_by=desc#entry-24</id><summary type="html">MOTION for Leave to Appear Pro Hac Vice on behalf of M. Brunner, J. Fry by David McGee; Filing fee $ 150, receipt number AILNDC-23393610. (McGee, David) (Entered: 04/24/2025)</summary><link href="https://storage.courtlistener.com/recap/gov.uscourts.ilnd.475530/gov.uscourts.ilnd.475530.24.0.pdf" length="0" rel="enclosure" /><updated>2025-04-24T00:00:00-07:00</updated></entry><entry><title>Entry #23 in Brunner v. Fenix Internet, LLC, 1:25-cv-03244</title><link href="https://www.courtlistener.com/docket/69799401/brunner-v-fenix-internet-llc/?order_by=desc#entry-23" rel="alternate" /><published>2025-04-23T00:00:00-07:00</published><id>https://www.courtlistener.com/docket/69799401/brunner-v-fenix-internet-llc/?order_by=desc#entry-23</id><summary type="html">MINUTE entry before the Honorable John F. Kness: Defendants Agreed Motion for Extension of Time 22 is granted. Mailed notice. (exr, ) (Entered: 04/23/2025)</summary><link href="https://ecf.ilnd.uscourts.gov/doc1/067032361233?caseid=475530" length="0" rel="enclosure" /><updated>2025-04-23T00:00:00-07:00</updated></entry><entry><title>Entry #22 in Brunner v. Fenix Internet, LLC, 1:25-cv-03244</title><link href="https://www.courtlistener.com/docket/69799401/brunner-v-fenix-internet-llc/?order_by=desc#entry-22" rel="alternate" /><published>2025-04-17T00:00:00-07:00</published><id>https://www.courtlistener.com/docket/69799401/brunner-v-fenix-internet-llc/?order_by=desc#entry-22</id><summary type="html">MOTION by Defendants Fenix International Limited, Fenix Internet, LLC for extension of time to file answer regarding complaint 1 (Agreed Motion) (Kutcher, Matthew) (Entered: 04/17/2025)</summary><link href="https://ecf.ilnd.uscourts.gov/doc1/067032328432?caseid=475530" length="0" rel="enclosure" /><updated>2025-04-17T00:00:00-07:00</updated></entry><entry><title>Entry #21 in Brunner v. Fenix Internet, LLC, 1:25-cv-03244</title><link href="https://www.courtlistener.com/docket/69799401/brunner-v-fenix-internet-llc/?order_by=desc#entry-21" rel="alternate" /><published>2025-04-16T00:00:00-07:00</published><id>https://www.courtlistener.com/docket/69799401/brunner-v-fenix-internet-llc/?order_by=desc#entry-21</id><summary type="html">MINUTE entry before the Honorable John F. Kness: Motions by counsel for leave to appear pro hac vice 18 and 19 are granted. Mailed notice. (exr, ) (Entered: 04/16/2025)</summary><link href="https://storage.courtlistener.com/recap/gov.uscourts.ilnd.475530/gov.uscourts.ilnd.475530.21.0.pdf" length="0" rel="enclosure" /><updated>2025-04-16T00:00:00-07:00</updated></entry><entry><title>Entry #20 in Brunner v. Fenix Internet, LLC, 1:25-cv-03244</title><link href="https://www.courtlistener.com/docket/69799401/brunner-v-fenix-internet-llc/?order_by=desc#entry-20" rel="alternate" /><published>2025-04-14T00:00:00-07:00</published><id>https://www.courtlistener.com/docket/69799401/brunner-v-fenix-internet-llc/?order_by=desc#entry-20</id><summary type="html">MINUTE entry before the Honorable John F. Kness: Case reassigned to the Honorable Judge John F. Kness for all further proceedings pursuant to Local Rule 40.4.Mailed notice (Attachments: # 1 Request for Reassignment) (jh, ) (Entered: 04/16/2025)</summary><link href="https://ecf.ilnd.uscourts.gov/doc1/067032318264?caseid=475530" length="0" rel="enclosure" /><updated>2025-04-14T00:00:00-07:00</updated></entry></feed>