<?xml version='1.0' encoding='utf-8'?>
<feed xmlns="http://www.w3.org/2005/Atom" xml:lang="en-us"><title>Docket updates for Concord Music Group, Inc. v. Anthropic PBC, 3:23-cv-01092</title><link href="https://michaellee50.github.io/CourtListener/feed-concord-anthropic.xml" rel="self" type="application/atom+xml" /><link href="https://www.courtlistener.com/" rel="alternate" /><link href="https://www.courtlistener.com/docket/67894459/feed/" rel="self" /><id>https://www.courtlistener.com/</id><updated>2024-06-26T00:00:00-07:00</updated><author><name>Free Law Project</name><email>feeds@courtlistener.com</email></author><rights>Created for the public domain by Free Law Project</rights><entry><title>Minute entry from 2024-06-26 in Concord Music Group, Inc. v. Anthropic PBC, 3:23-cv-01092</title><link href="https://www.courtlistener.com/docket/67894459/concord-music-group-inc-v-anthropic-pbc/" rel="alternate" /><published>2024-06-26T00:00:00-07:00</published><id>https://www.courtlistener.com/docket/67894459/concord-music-group-inc-v-anthropic-pbc/?order_by=desc#minute-entry-394950095</id><summary type="html">Case transferred from Tennessee Middle District has been opened in California Northern District as case 3:24-cv-03811, filed 06/26/2024. (hb)</summary><updated>2024-06-26T00:00:00-07:00</updated></entry><entry><title>Minute entry from 2024-06-26 in Concord Music Group, Inc. v. Anthropic PBC, 3:23-cv-01092</title><link href="https://www.courtlistener.com/docket/67894459/concord-music-group-inc-v-anthropic-pbc/" rel="alternate" /><published>2024-06-26T00:00:00-07:00</published><id>https://www.courtlistener.com/docket/67894459/concord-music-group-inc-v-anthropic-pbc/?order_by=desc#minute-entry-413066195</id><summary type="html">Docket Annotation</summary><updated>2024-06-26T00:00:00-07:00</updated></entry><entry><title>Minute entry from 2024-06-24 in Concord Music Group, Inc. v. Anthropic PBC, 3:23-cv-01092</title><link href="https://www.courtlistener.com/docket/67894459/concord-music-group-inc-v-anthropic-pbc/" rel="alternate" /><published>2024-06-24T00:00:00-07:00</published><id>https://www.courtlistener.com/docket/67894459/concord-music-group-inc-v-anthropic-pbc/?order_by=desc#minute-entry-394659684</id><summary type="html">Civil case transferred to the Northern District of California. (am)</summary><updated>2024-06-24T00:00:00-07:00</updated></entry><entry><title>Entry #124 in Concord Music Group, Inc. v. Anthropic PBC, 3:23-cv-01092</title><link href="https://www.courtlistener.com/docket/67894459/concord-music-group-inc-v-anthropic-pbc/?order_by=desc#entry-124" rel="alternate" /><published>2024-06-24T00:00:00-07:00</published><id>https://www.courtlistener.com/docket/67894459/concord-music-group-inc-v-anthropic-pbc/?order_by=desc#entry-124</id><summary type="html">ORDER: For the reasons set forth in the accompanying Memorandum Opinion, Defendant Anthropic PBC's Motion to Dismiss for Lack of Personal Jurisdiction and Improper Venue or, in the Alternative, to Transfer Venue (Doc. No. 54 ) is GRANTED IN PART and DENIED AS MOOT IN PART. The Clerk shall TRANSFER this action to the United States District Court for the Northern District of California and close the case. Signed by District Judge Waverly D. Crenshaw, Jr on 6/24/2024. (am) (Entered: 06/24/2024)</summary><link href="https://storage.courtlistener.com/recap/gov.uscourts.tnmd.96652/gov.uscourts.tnmd.96652.124.0.pdf" length="0" rel="enclosure" /><updated>2024-06-24T00:00:00-07:00</updated></entry><entry><title>Minute entry from 2024-06-24 in Concord Music Group, Inc. v. Anthropic PBC, 3:23-cv-01092</title><link href="https://www.courtlistener.com/docket/67894459/concord-music-group-inc-v-anthropic-pbc/" rel="alternate" /><published>2024-06-24T00:00:00-07:00</published><id>https://www.courtlistener.com/docket/67894459/concord-music-group-inc-v-anthropic-pbc/?order_by=desc#minute-entry-394722282</id><summary type="html">Docket Annotation</summary><updated>2024-06-24T00:00:00-07:00</updated></entry><entry><title>Entry #123 in Concord Music Group, Inc. v. Anthropic PBC, 3:23-cv-01092</title><link href="https://www.courtlistener.com/docket/67894459/concord-music-group-inc-v-anthropic-pbc/?order_by=desc#entry-123" rel="alternate" /><published>2024-06-24T00:00:00-07:00</published><id>https://www.courtlistener.com/docket/67894459/concord-music-group-inc-v-anthropic-pbc/?order_by=desc#entry-123</id><summary type="html">MEMORANDUM OPINION OF THE COURT. Signed by District Judge Waverly D. Crenshaw, Jr on 6/24/2024. (DOCKET TEXT SUMMARY ONLY-ATTORNEYS MUST OPEN THE PDF AND READ THE ORDER.)(am) (Entered: 06/24/2024)</summary><link href="https://storage.courtlistener.com/recap/gov.uscourts.tnmd.96652/gov.uscourts.tnmd.96652.123.0.pdf" length="0" rel="enclosure" /><updated>2024-06-24T00:00:00-07:00</updated></entry><entry><title>Entry #122 in Concord Music Group, Inc. v. Anthropic PBC, 3:23-cv-01092</title><link href="https://www.courtlistener.com/docket/67894459/concord-music-group-inc-v-anthropic-pbc/?order_by=desc#entry-122" rel="alternate" /><published>2024-05-10T00:00:00-07:00</published><id>https://www.courtlistener.com/docket/67894459/concord-music-group-inc-v-anthropic-pbc/?order_by=desc#entry-122</id><summary type="html">Joint Case Resolution Status Report by ABKCO Music, Inc., Capitol CMG, Inc., Concord Music Group, Inc., Polygram Publishing, Inc., Songs of Universal, Inc., Universal Music - MGB NA LLC, Universal Music - Z Tunes LLC, Universal Music Corp.. (Chung, Timothy) (Entered: 05/10/2024)</summary><link href="https://storage.courtlistener.com/recap/gov.uscourts.tnmd.96652/gov.uscourts.tnmd.96652.122.0.pdf" length="0" rel="enclosure" /><updated>2024-05-10T00:00:00-07:00</updated></entry><entry><title>Entry #121 in Concord Music Group, Inc. v. Anthropic PBC, 3:23-cv-01092</title><link href="https://www.courtlistener.com/docket/67894459/concord-music-group-inc-v-anthropic-pbc/?order_by=desc#entry-121" rel="alternate" /><published>2024-05-07T00:00:00-07:00</published><id>https://www.courtlistener.com/docket/67894459/concord-music-group-inc-v-anthropic-pbc/?order_by=desc#entry-121</id><summary type="html">NOTICE of Change of Address by Jacob T. Clabo (Clabo, Jacob) (Entered: 05/07/2024)</summary><link href="https://ecf.tnmd.uscourts.gov/doc1/16905773834?caseid=96652" length="0" rel="enclosure" /><updated>2024-05-07T00:00:00-07:00</updated></entry><entry><title>Entry #120 in Concord Music Group, Inc. v. Anthropic PBC, 3:23-cv-01092</title><link href="https://www.courtlistener.com/docket/67894459/concord-music-group-inc-v-anthropic-pbc/?order_by=desc#entry-120" rel="alternate" /><published>2024-04-17T00:00:00-07:00</published><id>https://www.courtlistener.com/docket/67894459/concord-music-group-inc-v-anthropic-pbc/?order_by=desc#entry-120</id><summary type="html">ORDER: Plaintiffs' Motion to Ascertain Status 119 is GRANTED, and Plaintiffs' Motion Requesting Oral Argument 97 is DENIED. Signed by District Judge Waverly D. Crenshaw, Jr on 4/17/2024. (DOCKET TEXT SUMMARY ONLY-ATTORNEYS MUST OPEN THE PDF AND READ THE ORDER.)(kc) (Entered: 04/17/2024)</summary><link href="https://storage.courtlistener.com/recap/gov.uscourts.tnmd.96652/gov.uscourts.tnmd.96652.120.0.pdf" length="0" rel="enclosure" /><updated>2024-04-17T00:00:00-07:00</updated></entry><entry><title>Entry #119 in Concord Music Group, Inc. v. Anthropic PBC, 3:23-cv-01092</title><link href="https://www.courtlistener.com/docket/67894459/concord-music-group-inc-v-anthropic-pbc/?order_by=desc#entry-119" rel="alternate" /><published>2024-04-12T00:00:00-07:00</published><id>https://www.courtlistener.com/docket/67894459/concord-music-group-inc-v-anthropic-pbc/?order_by=desc#entry-119</id><summary type="html">MOTION to Ascertain Status of Motion for Preliminary Injunction re 40, 97 by ABKCO Music, Inc., Capitol CMG, Inc., Concord Music Group, Inc., Polygram Publishing, Inc., Songs of Universal, Inc., Universal Music - MGB NA LLC, Universal Music - Z Tunes LLC, Universal Music Corp.. (Riley, Steven) (Entered: 04/12/2024)</summary><link href="https://storage.courtlistener.com/recap/gov.uscourts.tnmd.96652/gov.uscourts.tnmd.96652.119.0.pdf" length="0" rel="enclosure" /><updated>2024-04-12T00:00:00-07:00</updated></entry><entry><title>Minute entry from 2024-03-04 in Concord Music Group, Inc. v. Anthropic PBC, 3:23-cv-01092</title><link href="https://www.courtlistener.com/docket/67894459/concord-music-group-inc-v-anthropic-pbc/" rel="alternate" /><published>2024-03-04T00:00:00-08:00</published><id>https://www.courtlistener.com/docket/67894459/concord-music-group-inc-v-anthropic-pbc/?order_by=desc#minute-entry-380146034</id><summary type="html">Appear Pro Hac Vice AND Appear Pro Hac Vice AND Order on Motion to Amend/Correct AND Order on Motion to Amend/Correct</summary><updated>2024-03-04T00:00:00-08:00</updated></entry><entry><title>Entry #118 in Concord Music Group, Inc. v. Anthropic PBC, 3:23-cv-01092</title><link href="https://www.courtlistener.com/docket/67894459/concord-music-group-inc-v-anthropic-pbc/?order_by=desc#entry-118" rel="alternate" /><published>2024-03-04T00:00:00-08:00</published><id>https://www.courtlistener.com/docket/67894459/concord-music-group-inc-v-anthropic-pbc/?order_by=desc#entry-118</id><summary type="html">ORDER granting 112 and 113 Having satisfied the requirements of Local Rule 83.01(b), the Amended Motions for Frank Scibilia and Maya Katalan to Appear Pro Hac Vice are granted. Signed by Lynda M. Hill, Clerk of Court, on 03/04/2024. (lh) (Entered: 03/04/2024)</summary><link href="https://ecf.tnmd.uscourts.gov/cgi-bin/show_case_doc?118,96652,,," length="0" rel="enclosure" /><updated>2024-03-04T00:00:00-08:00</updated></entry><entry><title>Entry #117 in Concord Music Group, Inc. v. Anthropic PBC, 3:23-cv-01092</title><link href="https://www.courtlistener.com/docket/67894459/concord-music-group-inc-v-anthropic-pbc/?order_by=desc#entry-117" rel="alternate" /><published>2024-02-27T00:00:00-08:00</published><id>https://www.courtlistener.com/docket/67894459/concord-music-group-inc-v-anthropic-pbc/?order_by=desc#entry-117</id><summary type="html">REPLY to Response to re 102 MOTION For Leave to File Amicus Curiae filed by Association of American Publishers, Inc., Black Music Action Coalition, National Music Publishers' Association, News/Media Alliance, Recording Industry Association of America, Songwriter of North America. (Clabo, Jacob) (Entered: 02/27/2024)</summary><link href="https://storage.courtlistener.com/recap/gov.uscourts.tnmd.96652/gov.uscourts.tnmd.96652.117.0.pdf" length="0" rel="enclosure" /><updated>2024-02-27T00:00:00-08:00</updated></entry><entry><title>Entry #116 in Concord Music Group, Inc. v. Anthropic PBC, 3:23-cv-01092</title><link href="https://www.courtlistener.com/docket/67894459/concord-music-group-inc-v-anthropic-pbc/?order_by=desc#entry-116" rel="alternate" /><published>2024-02-27T00:00:00-08:00</published><id>https://www.courtlistener.com/docket/67894459/concord-music-group-inc-v-anthropic-pbc/?order_by=desc#entry-116</id><summary type="html">REPLY to Response to re 97 MOTION for Leave to Request Oral Argument re 40 MOTION for Preliminary Injunction filed by ABKCO Music, Inc., Capitol CMG, Inc., Concord Music Group, Inc., Polygram Publishing, Inc., Songs of Universal, Inc., Universal Music - MGB NA LLC, Universal Music - Z Tunes LLC, Universal Music Corp.. (Riley, Steven) (Entered: 02/27/2024)</summary><link href="https://ecf.tnmd.uscourts.gov/doc1/16905709060?caseid=96652" length="0" rel="enclosure" /><updated>2024-02-27T00:00:00-08:00</updated></entry><entry><title>Entry #115 in Concord Music Group, Inc. v. Anthropic PBC, 3:23-cv-01092</title><link href="https://www.courtlistener.com/docket/67894459/concord-music-group-inc-v-anthropic-pbc/?order_by=desc#entry-115" rel="alternate" /><published>2024-02-20T00:00:00-08:00</published><id>https://www.courtlistener.com/docket/67894459/concord-music-group-inc-v-anthropic-pbc/?order_by=desc#entry-115</id><summary type="html">RESPONSE in Opposition re 102 MOTION For Leave to File Amicus Curiae filed by Anthropic PBC. (Harwell, Aubrey) (Entered: 02/20/2024)</summary><link href="https://storage.courtlistener.com/recap/gov.uscourts.tnmd.96652/gov.uscourts.tnmd.96652.115.0.pdf" length="0" rel="enclosure" /><updated>2024-02-20T00:00:00-08:00</updated></entry><entry><title>Entry #114 in Concord Music Group, Inc. v. Anthropic PBC, 3:23-cv-01092</title><link href="https://www.courtlistener.com/docket/67894459/concord-music-group-inc-v-anthropic-pbc/?order_by=desc#entry-114" rel="alternate" /><published>2024-02-20T00:00:00-08:00</published><id>https://www.courtlistener.com/docket/67894459/concord-music-group-inc-v-anthropic-pbc/?order_by=desc#entry-114</id><summary type="html">RESPONSE in Opposition re 97 MOTION for Leave to Request Oral Argument re 40 MOTION for Preliminary Injunction filed by Anthropic PBC. (Harwell, Aubrey) (Entered: 02/20/2024)</summary><link href="https://storage.courtlistener.com/recap/gov.uscourts.tnmd.96652/gov.uscourts.tnmd.96652.114.0.pdf" length="0" rel="enclosure" /><updated>2024-02-20T00:00:00-08:00</updated></entry><entry><title>Entry #113 in Concord Music Group, Inc. v. Anthropic PBC, 3:23-cv-01092</title><link href="https://www.courtlistener.com/docket/67894459/concord-music-group-inc-v-anthropic-pbc/?order_by=desc#entry-113" rel="alternate" /><published>2024-02-15T00:00:00-08:00</published><id>https://www.courtlistener.com/docket/67894459/concord-music-group-inc-v-anthropic-pbc/?order_by=desc#entry-113</id><summary type="html">Amended MOTION to Amend/Correct 101 MOTION for attorney Maya Katalan to Appear Pro Hac Vice (paid $150 PHV fee; receipt number ATNMDC-4013463) by Association of American Publishers, Inc., Black Music Action Coalition, National Music Publishers' Association, News/Media Alliance, Recording Industry Association of America, Songwriter of North America. (Attachments: # 1 Exhibit Ex.1-Supplemental Declaration-Katalan, # 2 Exhibit Ex.2-Supplemental Certificate of Good Standing - Katalan)(Kilgore, Lauren) (Entered: 02/15/2024)</summary><link href="https://storage.courtlistener.com/recap/gov.uscourts.tnmd.96652/gov.uscourts.tnmd.96652.113.0.pdf" length="0" rel="enclosure" /><updated>2024-02-15T00:00:00-08:00</updated></entry><entry><title>Entry #112 in Concord Music Group, Inc. v. Anthropic PBC, 3:23-cv-01092</title><link href="https://www.courtlistener.com/docket/67894459/concord-music-group-inc-v-anthropic-pbc/?order_by=desc#entry-112" rel="alternate" /><published>2024-02-15T00:00:00-08:00</published><id>https://www.courtlistener.com/docket/67894459/concord-music-group-inc-v-anthropic-pbc/?order_by=desc#entry-112</id><summary type="html">Amended MOTION to Amend/Correct 100 MOTION for attorney Frank Scibilia to Appear Pro Hac Vice (paid $150 PHV fee; receipt number ATNMDC-4013462) by Association of American Publishers, Inc., Black Music Action Coalition, National Music Publishers' Association, News/Media Alliance, Recording Industry Association of America, Songwriter of North America. (Attachments: # 1 Exhibit Ex.1-Supplemental Declaration Scibilia, # 2 Exhibit Ex.2-Supplemental Certificate of Good Standing - Scibilia)(Kilgore, Lauren) (Entered: 02/15/2024)</summary><link href="https://storage.courtlistener.com/recap/gov.uscourts.tnmd.96652/gov.uscourts.tnmd.96652.112.0.pdf" length="0" rel="enclosure" /><updated>2024-02-15T00:00:00-08:00</updated></entry><entry><title>Entry #111 in Concord Music Group, Inc. v. Anthropic PBC, 3:23-cv-01092</title><link href="https://www.courtlistener.com/docket/67894459/concord-music-group-inc-v-anthropic-pbc/?order_by=desc#entry-111" rel="alternate" /><published>2024-02-15T00:00:00-08:00</published><id>https://www.courtlistener.com/docket/67894459/concord-music-group-inc-v-anthropic-pbc/?order_by=desc#entry-111</id><summary type="html">CERTIFICATE Certificate of Service DE 103 filed by Association of American Publishers, Inc., Black Music Action Coalition, National Music Publishers' Association, News/Media Alliance, Recording Industry Association of America, Songwriter of North America re 103 Memorandum in Support, filed by Black Music Action Coalition, Recording Industry Association of America, News/Media Alliance, Songwriter of North America, Association of American Publishers, Inc., National Music Publishers' Association. (Kilgore, Lauren) (Entered: 02/15/2024)</summary><link href="https://ecf.tnmd.uscourts.gov/doc1/16905699699?caseid=96652" length="0" rel="enclosure" /><updated>2024-02-15T00:00:00-08:00</updated></entry><entry><title>Entry #110 in Concord Music Group, Inc. v. Anthropic PBC, 3:23-cv-01092</title><link href="https://www.courtlistener.com/docket/67894459/concord-music-group-inc-v-anthropic-pbc/?order_by=desc#entry-110" rel="alternate" /><published>2024-02-15T00:00:00-08:00</published><id>https://www.courtlistener.com/docket/67894459/concord-music-group-inc-v-anthropic-pbc/?order_by=desc#entry-110</id><summary type="html">CERTIFICATE Certificate of Service DE 102 filed by Association of American Publishers, Inc., Black Music Action Coalition, National Music Publishers' Association, News/Media Alliance, Recording Industry Association of America, Songwriter of North America re 102 MOTION For Leave to File Amicus Curiae filed by Black Music Action Coalition, Recording Industry Association of America, News/Media Alliance, Songwriter of North America, Association of American Publishers, Inc., National Music Publishers' Association. (Kilgore, Lauren) (Entered: 02/15/2024)</summary><link href="https://ecf.tnmd.uscourts.gov/doc1/16905699694?caseid=96652" length="0" rel="enclosure" /><updated>2024-02-15T00:00:00-08:00</updated></entry><entry><title>Entry #109 in Concord Music Group, Inc. v. Anthropic PBC, 3:23-cv-01092</title><link href="https://www.courtlistener.com/docket/67894459/concord-music-group-inc-v-anthropic-pbc/?order_by=desc#entry-109" rel="alternate" /><published>2024-02-15T00:00:00-08:00</published><id>https://www.courtlistener.com/docket/67894459/concord-music-group-inc-v-anthropic-pbc/?order_by=desc#entry-109</id><summary type="html">CERTIFICATE Certificate of Service DE 101 filed by Association of American Publishers, Inc., Black Music Action Coalition, National Music Publishers' Association, News/Media Alliance, Recording Industry Association of America, Songwriter of North America re 101 MOTION for attorney Maya Katalan to Appear Pro Hac Vice (paid $150 PHV fee; receipt number ATNMDC-4013463) filed by Black Music Action Coalition, Recording Industry Association of America, News/Media Alliance, Songwriter of North America, Association of American Publishers, Inc., National Music Publishers' Association. (Kilgore, Lauren) (Entered: 02/15/2024)</summary><link href="https://ecf.tnmd.uscourts.gov/doc1/16905699691?caseid=96652" length="0" rel="enclosure" /><updated>2024-02-15T00:00:00-08:00</updated></entry><entry><title>Entry #108 in Concord Music Group, Inc. v. Anthropic PBC, 3:23-cv-01092</title><link href="https://www.courtlistener.com/docket/67894459/concord-music-group-inc-v-anthropic-pbc/?order_by=desc#entry-108" rel="alternate" /><published>2024-02-15T00:00:00-08:00</published><id>https://www.courtlistener.com/docket/67894459/concord-music-group-inc-v-anthropic-pbc/?order_by=desc#entry-108</id><summary type="html">CERTIFICATE Certificate of Service DE 100 filed by Association of American Publishers, Inc., Black Music Action Coalition, National Music Publishers' Association, News/Media Alliance, Recording Industry Association of America, Songwriter of North America re 100 MOTION for attorney Frank Scibilia to Appear Pro Hac Vice (paid $150 PHV fee; receipt number ATNMDC-4013462) filed by Black Music Action Coalition, Recording Industry Association of America, News/Media Alliance, Songwriter of North America, Association of American Publishers, Inc., National Music Publishers' Association. (Kilgore, Lauren) (Entered: 02/15/2024)</summary><link href="https://storage.courtlistener.com/recap/gov.uscourts.tnmd.96652/gov.uscourts.tnmd.96652.108.0.pdf" length="0" rel="enclosure" /><updated>2024-02-15T00:00:00-08:00</updated></entry><entry><title>Entry #107 in Concord Music Group, Inc. v. Anthropic PBC, 3:23-cv-01092</title><link href="https://www.courtlistener.com/docket/67894459/concord-music-group-inc-v-anthropic-pbc/?order_by=desc#entry-107" rel="alternate" /><published>2024-02-15T00:00:00-08:00</published><id>https://www.courtlistener.com/docket/67894459/concord-music-group-inc-v-anthropic-pbc/?order_by=desc#entry-107</id><summary type="html">DECLARATION of Ben Y. Zhao filed by ABKCO Music, Inc., Capitol CMG, Inc., Concord Music Group, Inc., Polygram Publishing, Inc., Songs of Universal, Inc., Universal Music - MGB NA LLC, Universal Music - Z Tunes LLC, Universal Music Corp. re: 92 Reply to Response to Motion,. (Chung, Timothy) (Entered: 02/15/2024)</summary><link href="https://storage.courtlistener.com/recap/gov.uscourts.tnmd.96652/gov.uscourts.tnmd.96652.107.0_1.pdf" length="0" rel="enclosure" /><updated>2024-02-15T00:00:00-08:00</updated></entry><entry><title>Entry #106 in Concord Music Group, Inc. v. Anthropic PBC, 3:23-cv-01092</title><link href="https://www.courtlistener.com/docket/67894459/concord-music-group-inc-v-anthropic-pbc/?order_by=desc#entry-106" rel="alternate" /><published>2024-02-15T00:00:00-08:00</published><id>https://www.courtlistener.com/docket/67894459/concord-music-group-inc-v-anthropic-pbc/?order_by=desc#entry-106</id><summary type="html">CERTIFICATE Certificate of Service filed by ABKCO Music, Inc., Capitol CMG, Inc., Concord Music Group, Inc., Polygram Publishing, Inc., Songs of Universal, Inc., Universal Music - MGB NA LLC, Universal Music - Z Tunes LLC, Universal Music Corp. re 95 Declaration, filed by Songs of Universal, Inc., Capitol CMG, Inc., Concord Music Group, Inc., Universal Music - Z Tunes LLC, Universal Music - MGB NA LLC, ABKCO Music, Inc., Universal Music Corp., Polygram Publishing, Inc.. (Chung, Timothy) (Entered: 02/15/2024)</summary><link href="https://storage.courtlistener.com/recap/gov.uscourts.tnmd.96652/gov.uscourts.tnmd.96652.106.0.pdf" length="0" rel="enclosure" /><updated>2024-02-15T00:00:00-08:00</updated></entry><entry><title>Entry #105 in Concord Music Group, Inc. v. Anthropic PBC, 3:23-cv-01092</title><link href="https://www.courtlistener.com/docket/67894459/concord-music-group-inc-v-anthropic-pbc/?order_by=desc#entry-105" rel="alternate" /><published>2024-02-15T00:00:00-08:00</published><id>https://www.courtlistener.com/docket/67894459/concord-music-group-inc-v-anthropic-pbc/?order_by=desc#entry-105</id><summary type="html">CERTIFICATE Certificate of Service filed by ABKCO Music, Inc., Capitol CMG, Inc., Concord Music Group, Inc., Polygram Publishing, Inc., Songs of Universal, Inc., Universal Music - MGB NA LLC, Universal Music - Z Tunes LLC, Universal Music Corp. re 94 Declaration, filed by Songs of Universal, Inc., Capitol CMG, Inc., Concord Music Group, Inc., Universal Music - Z Tunes LLC, Universal Music - MGB NA LLC, ABKCO Music, Inc., Universal Music Corp., Polygram Publishing, Inc.. (Chung, Timothy) (Entered: 02/15/2024)</summary><link href="https://storage.courtlistener.com/recap/gov.uscourts.tnmd.96652/gov.uscourts.tnmd.96652.105.0.pdf" length="0" rel="enclosure" /><updated>2024-02-15T00:00:00-08:00</updated></entry><entry><title>Entry #104 in Concord Music Group, Inc. v. Anthropic PBC, 3:23-cv-01092</title><link href="https://www.courtlistener.com/docket/67894459/concord-music-group-inc-v-anthropic-pbc/?order_by=desc#entry-104" rel="alternate" /><published>2024-02-15T00:00:00-08:00</published><id>https://www.courtlistener.com/docket/67894459/concord-music-group-inc-v-anthropic-pbc/?order_by=desc#entry-104</id><summary type="html">Amended MOTION for Leave to File Document Under Seal by ABKCO Music, Inc., Capitol CMG, Inc., Concord Music Group, Inc., Polygram Publishing, Inc., Songs of Universal, Inc., Universal Music - MGB NA LLC, Universal Music - Z Tunes LLC, Universal Music Corp.. (Attachments: # 1 Attachment Memorandum in Support of Amended Motion for Leave to File Under Seal, # 2 Attachment Proposed Order Granting Amended Motion for Leave to File Under Seal)(Chung, Timothy) (Entered: 02/15/2024)</summary><link href="https://storage.courtlistener.com/recap/gov.uscourts.tnmd.96652/gov.uscourts.tnmd.96652.104.0.pdf" length="0" rel="enclosure" /><updated>2024-02-15T00:00:00-08:00</updated></entry><entry><title>Minute entry from 2024-02-15 in Concord Music Group, Inc. v. Anthropic PBC, 3:23-cv-01092</title><link href="https://www.courtlistener.com/docket/67894459/concord-music-group-inc-v-anthropic-pbc/" rel="alternate" /><published>2024-02-15T00:00:00-08:00</published><id>https://www.courtlistener.com/docket/67894459/concord-music-group-inc-v-anthropic-pbc/?order_by=desc#minute-entry-378598835</id><summary type="html">NOTICE TO FILER re DE# 100 and 101: The pending pro hac vice motion does not comply with the Court's local rules, because the motion fails to state whether disciplinary proceedings by any disciplinary authority, a finding of contempt or a sanction under 28 U.S.C. ยง 1927 by any court, or criminal charges have been instituted against the attorney seeking pro hac vice admission. Local Rule 83.01(b)(2). By no later than five (5) business days from the date of this docket annotation, the pro hac vice motion must be supplemented by the filing of a statement under oath of the attorney seeking pro hac vice admission disclosing such matters. Failure to do so will result in denial of the pro hac vice motion. (kc) Modified on 2/15/2024 (kc).</summary><updated>2024-02-15T00:00:00-08:00</updated></entry><entry><title>Minute entry from 2024-02-15 in Concord Music Group, Inc. v. Anthropic PBC, 3:23-cv-01092</title><link href="https://www.courtlistener.com/docket/67894459/concord-music-group-inc-v-anthropic-pbc/" rel="alternate" /><published>2024-02-15T00:00:00-08:00</published><id>https://www.courtlistener.com/docket/67894459/concord-music-group-inc-v-anthropic-pbc/?order_by=desc#minute-entry-378528777</id><summary type="html">NOTICE TO FILER re DE# 100 and 101 : The pending pro hac vice motion does not comply with the Court's local rules, because the motion fails to state whether disciplinary proceedings by any disciplinary authority, a finding of contempt or a sanction under 28 U.S.C. ยง 1927 by any court, or criminal charges have been instituted against the attorney seeking pro hac vice admission. Local Rule 83.01(b)(2). By no later than five (5) business days from the date of this docket annotation, the pro hac vice motion must be supplemented by the filing of a statement under oath of the attorney seeking pro hac vice admission disclosing such matters. Failure to do so will result in denial of the pro hac vice motion. (kc) Modified on 2/15/2024 (kc).</summary><updated>2024-02-15T00:00:00-08:00</updated></entry><entry><title>Minute entry from 2024-02-15 in Concord Music Group, Inc. v. Anthropic PBC, 3:23-cv-01092</title><link href="https://www.courtlistener.com/docket/67894459/concord-music-group-inc-v-anthropic-pbc/" rel="alternate" /><published>2024-02-15T00:00:00-08:00</published><id>https://www.courtlistener.com/docket/67894459/concord-music-group-inc-v-anthropic-pbc/?order_by=desc#minute-entry-378528544</id><summary type="html">NOTICE TO FILER re DE# 94, 95, 100, 101, 103 : Pursuant to Local Rule 5.01, Certificates of Service shall identify by name the person served, what was served, the method of service, and date of service. Counsel did not include a certificate of service. Please FILE a conformed Certificate of Service for this document. (kc)</summary><updated>2024-02-15T00:00:00-08:00</updated></entry><entry><title>Minute entry from 2024-02-15 in Concord Music Group, Inc. v. Anthropic PBC, 3:23-cv-01092</title><link href="https://www.courtlistener.com/docket/67894459/concord-music-group-inc-v-anthropic-pbc/" rel="alternate" /><published>2024-02-15T00:00:00-08:00</published><id>https://www.courtlistener.com/docket/67894459/concord-music-group-inc-v-anthropic-pbc/?order_by=desc#minute-entry-394950094</id><summary type="html">NY State Bar status verified as active for Maya B. Katalan, Frank P. Scibilia not admitted to this court - Local counsel secured. (kc)</summary><updated>2024-02-15T00:00:00-08:00</updated></entry></feed>